ID,COD_MUNICIPIO,NOME,NOME_RESPONSAVEL,data_nasc,Tipo_erro
100035,4202156,STEFANI SANTOS OLIVEIRA,ILZANY PEREIRA DE JESUS,25/09/1973,Sem erro
100037,4202156,SUZANE GABRIELE NAVARRO BAHIA,ISTEFANY DE JESUS SOUZA,08/06/1959,Sem erro
100038,4202156,TAILANDIA TAVARES BARBOSA,ISVONEIDE PEREIRA DA ROCHA,19/06/1999,Sem erro
100039,4202156,TAILANE RIBEIRO DE OLIVEIRA,IVONETE TEIXEIRA COSTA FREIRE,12/06/1961,Sem erro
100041,2903409,TAINA DOS SANTOS CASTRO,JADIEL FERREIRA DOS SANTOS,28/07/2009,Sem erro
100043,2903409,TATIANE SANTOS DA PAIXAO,JOCELIANA COSTA OLIVEIRA,01/07/2000,Sem erro
100044,4202156,THARESELES MARQUES LEAL,JOILMA ALVES DOS SANTOS PEREIRA,15/08/1970,Sem erro
100045,2903409,UJURAI CASSIMIRO FERREIRA,JOSE OLIVEIRA SANTANA,19/08/1970,Sem erro
