ID,COD_MUNICIPIO,NOME,NOME_RESPONSAVEL,data_nasc,Tipo_erro
1,5221403,POLIANA GUEDES DE ANDRADE,ZEHILDA FARIAS MENDES DELMON,24/08/2001,Sem erro
2,5103403,JOSIANE ALCANTARA CAMPOS,CRISPINA NASCIMENTO SANTOS,13/10/1948,Sem erro
3,3303500,ZEHILDA FARIAS MENDES DELMON,POLIANA GUEDES DE ANDRADE,16/02/1974,Sem erro
4,3306305,IZABEL CRISTINA PEREIRA REIS,ANDRESA ANDRADE MUNIZ FERREIRA DE MEDEIR,31/12/1941,Sem erro
7,2102200,NIVEA MAKENNA DA SILVA FREIRE,FATIMA APARECIDA GIUSTI TORQUATO,14/08/1988,Sem erro
10,2700805,ADRIANE FERREIRA QUEIROZ,MARIA EDVANIA GOMES,14/11/1962,Sem erro
12,2606408,JULIANE MARIA DA SILVA,JOSILENE SANTOS SILVA,24/09/1942,Sem erro
13,3304904,DEIJA COSTA,JOSE GERALDO DOS SANTOS,29/08/1963,Sem erro
15,1200401,JANAINA FERREIRA DA SILVA,JOSE RIBEIRO FILHO,05/12/1982,Sem erro
17,3106705,DJESSICA ADRIAN SANTOS DA SILVA,MIRIAN SILVA DE MOURA LIBERATO,29/05/1955,Sem erro
21,1200252,ELINEL LINHARES SOMBRA,CLEUBER ALVES MARINHO,12/07/1964,Sem erro
25,2704302,EDILEIDE GUERRA COSTA,RENILSON SANTOS OLIVEIRA,29/11/1976,Sem erro
27,2708006,CICERA EMIDIO FALCAO,VANDERLINO SOUZA DOS SANTOS,27/09/1998,Sem erro
28,2708808,JOSE RODRIGUES DA SILVA,JOAS FREITAS DE OLIVEIRA,26/01/1967,Sem erro
30,1302405,ELILSON GOMES DE BRITO,ISABEL CRISTINA LOPES DOS SANTOS,18/04/2009,Sem erro
34,2900355,LAILSON ARAUJO DOS SANTOS,ALINE DA COSTA DE JESUS,14/12/1932,Sem erro
37,3112000,VIVIANE ALMEIDA DOS SANTOS,MARCOS RIBEIRO DE ALMEIDA,14/06/1945,Sem erro
38,2906907,LEIDE CASSIA DA COSTA DO NASCIMENTO,JESUS BARBOSA DOS SANTOS,21/12/1937,Sem erro
39,2911808,EDNA PINHEIRO BATISTA,MANOEL MESSIAS DOS SANTOS,28/01/1956,Sem erro
42,2914000,JUSCILANDO SILVA FERNANDES,GILSON SANTOS MONTEIRO,06/10/1983,Sem erro
44,2917805,MARIVALDO CRISPIN JULIAO DAMASIO,AILA MARIA DA SILVA SALES,07/01/1984,Sem erro
45,2918001,ELSON DE ALMEIDA SIMAO,CARLOS EDUARDO BISPO DOS SANTOS,21/10/1966,Sem erro
50,3533502,THIAGO CASSIMIRO MARTINS,ENIO RODRIGUES,24/07/1962,Sem erro
51,4119806,ANTONIO TAVARES GOMES DOS SANTOS,REILSON RODRIGUES DE ARAUJO,10/10/1961,Sem erro
52,2925956,MARIA NILZA LOBO DA PAIXAO,GIONATA DISCONZI,20/02/1954,Sem erro
53,2927408,UBIRAJARA DOS SANTOS OLIVEIRA,ANTONIA NISIA DE MELO,04/02/1962,Sem erro
55,2516508,AULINO JOSAFA ROSENDO PIRES,FRANCISCO ADALBERTO DE OLIVEIRA CASTRO,18/05/1987,Sem erro
57,2414803,AILA MARIA DA SILVA SALES,FRANCISCO SAMUEL COUTINHO AGUIAR,17/06/1951,Sem erro
58,4322707,CARLOS EDUARDO BISPO DOS SANTOS,ANA PAULA DA SILVA SOUSA,27/06/2014,Sem erro
59,2933604,ANTONIO RODRIGUES DUQUE,ANTONIO GLAUBER DE SOUSA DO NASCIMENTO,06/08/2017,Sem erro
63,2303709,JACKSON COELHO NERY,MARIA DE FATIMA TORQUATO BERTULEZA,27/07/1927,Sem erro
64,2303709,LUCIA DE FATIMA DE FREITAS FREIRES,PAULO SERGIO RIBEIRO DA SILVA,20/04/2015,Sem erro
65,2303709,MARIA ROZENILDA SOUSA FERREIRA,FRANCISCO EUDES MOURA ARAUJO,08/04/1949,Sem erro
69,2304400,GERLANE MARIA XAVIER PEREIRA,RAIMUNDO LOPES DO NASCIMENTO,26/10/1976,Sem erro
70,2304400,MARIA NEIDE GUIMARAES FREIRE,LUCIO FERREIRA DA SILVA,04/06/2013,Sem erro
71,2304400,MARLENE DE SOUZA NOGUEIRA,ALUIZIO SOUSA DE HOLANDA,11/09/1957,Sem erro
75,2307601,FRANCINETE FERREIRA DE SOUSA,SONIA MARIA LIMA BATISTA,17/11/1932,Sem erro
78,2804904,KALIENNE LIMA VIDAL,WASHINGTON DOS SANTOS,21/06/1953,Sem erro
80,2311355,ANTONIO RIBEIRO DA COSTA,LEONARDO DA LUZ DIAS,06/12/1929,Sem erro
81,2412005,JOAO JOSE DE OLIVEIRA ALENCAR,WALESSON SILVA PIRES,19/03/1998,Sem erro
83,2313005,FRANCISCO DE OLIVEIRA,MARLIR PEREIRA CARVALHO,02/08/1934,Sem erro
84,3204054,MARIA DAS GRACAS FRANCO DA SILVA,ROSEANE DA SILVA PEREIRA,21/05/2016,Sem erro
86,3205002,DINE PEREIRA SOARES,ROMARIO NEVES SANTOS,03/09/1976,Sem erro
93,2103307,MARINALVA MOREIRA MATOS,PHABLO HENRIQUE COSTA RODRIGUES,22/04/1952,Sem erro
95,2105427,IRANY LIMA DAMASCENO,JOCELI MARIA NUNES,07/12/2021,Sem erro
97,2106409,ANTONIA CELIA DA SILVA,PAULO MARCOS ARAUJO DOS SANTOS,25/08/1956,Sem erro
98,2107506,MARIA DE LOURDES ARAUJO CABRAL,MARCIA DA CONCEICAO DOS SANTOS,18/03/2008,Sem erro
105,2111300,DOMINGAS DO SOCORRO FERREIRA LOPES,LINDALVA PEREIRA CUNHA,10/11/2012,Sem erro
108,2111748,LUANA BARBOSA DA SILVA,KELLY HILLARY DA ROCHA SEGUINS,12/08/1960,Sem erro
110,2112209,ANTONIO ALVES DE SOUSA,GIOVANA MARIA DA SILVA SOUZA,11/12/2022,Sem erro
111,2112209,EVALDO DA SILVA COSTA,FABRICIO CAMPOS DA SILVA,11/03/2008,Sem erro
112,2112209,RONILDO DA CUNHA RIBEIRO,FRANCISCO JUNIOR DA CRUZ DA ROCHA,17/09/1931,Sem erro
114,2112407,JANILSON DA SILVA ALMEIDA,CESAR ADRIANO ARAUJO DA SILVA,21/11/1957,Sem erro
118,3205101,JOSE RIBAMAR BASTOS COSTA,JOSE RIBAMAR BASTOS COSTA,19/03/2019,Sem erro
120,2112803,MARIA MADALENA LINDOSO PENHA,NAILSON SOUSA DOS SANTOS,12/09/1950,Sem erro
121,3106200,ANA LUIZA DA COSTA,TEREZA DOS REIS FERREIRA,24/12/1935,Sem erro
124,3106705,SONIA TRINDADE DOS SANTOS,FRANCISCO COSME CANUTO,28/07/2016,Sem erro
128,3131604,RAQUEL NEVES DE OLIVEIRA,YAN VITOR GOMES DOS SANTOS,01/07/1950,Sem erro
130,3151800,ALINE PRISCILA GONCALVES,NEIDE PIRES FERREIRA,23/09/1933,Sem erro
133,3169000,FRANCISCA MARIA DA SILVA,CLAUDIO MACHADO,26/11/1997,Sem erro
134,3170578,TIAGO NUNES DA SILVEIRA,NILMA NUNES DA SILVA,04/12/1998,Sem erro
137,1500107,JOSE LUIZ CHAGAS DE OLIVEIRA,CLAUDETE GONCALVES SANTOS,18/03/2007,Sem erro
138,1500107,NILZA FERREIRA PINHEIRO,JOSE ROSA TELES PINTO,14/08/1939,Sem erro
139,1500107,ROSELI LOBATO COSTA,ROSELI LOBATO COSTA,09/05/1985,Sem erro
147,2501906,MESSIAS DE JESUS OLIVEIRA,MILTON HELIO PASTANA DA SILVA,09/11/2006,Sem erro
149,2501906,MILTON HELIO PASTANA DA SILVA,CLEIDE WANZELER SALDANHA,10/05/1951,Sem erro
151,2501906,NILZA SOARES DA SILVA,EDIJANE VALENTE PONTES,13/04/1955,Sem erro
153,2501906,NIZETE NUNES FERREIRA,ELTON DO SOCORRO CARDOSO SEPEDA,27/01/2018,Sem erro
156,1504000,VANESSA DE JESUS RIBEIRO RIBEIRO,RAIMUNDO GONCALVES SEPEDA,10/09/2001,Sem erro
159,1504604,ALACID LOPES FERREIRA,RITA MARIA DE OLIVEIRA DINIZ,09/12/1991,Sem erro
160,1504604,ALUZINEIDE EVANGELISTA DIAS DA SILVA,MARIA JOSE DE OLIVEIRA SANTOS,28/10/1928,Sem erro
162,1504604,CLEOCIANE DE JESUS RODRIGUES FARIAS,JOAO PAULO DE SOUZA,22/08/2004,Sem erro
163,1504604,DIEGO ALMEIDA RODRIGUES,ALINE CARVALHO DE LIMA,07/08/1969,Sem erro
164,1504604,ELTON DO SOCORRO CARDOSO SEPEDA,ALINE CARVALHO DE LIMA,09/06/1940,Sem erro
165,1504604,GILCILENE PEREIRA MORAES,MARIA GORETE DA SILVA DANTAS,10/05/2016,Sem erro
167,1504604,JESSICA MARTINS ALVES,SEVERINA MARIA DE JESUS,08/03/2012,Sem erro
173,1504604,MARIA EVANILCE DE SOUSA MORAES,RISONETE HERMINIO DA SILVA,02/07/1975,Sem erro
175,1504604,MARIA VANIA CORREA,ALEXANDRE JOSE DA SILVA TAVARES,12/07/1935,Sem erro
176,1504604,MAYARA PINTO GONCALVES,CARLOS HENRIQUE DA SILVA,27/11/1988,Sem erro
178,1504604,NICILENE SOUZA DA SILVA,ERICA PATRICIA BARBOSA,20/07/2002,Sem erro
181,1504703,ELCIONE JOSE DOS SANTOS,RAIMUNDA NUNES DA SILVA,19/05/1986,Sem erro
183,1504901,JOSE PEDRO DA COSTA GAMA,RITA CRISTIANE SILVA SOUSA,06/06/1986,Sem erro
185,1507904,NELSON SILVA QUEIROZ,JOSE CANUTO BENIZ,23/07/1958,Sem erro
190,2506608,RAIMUNDO MONTINEGRO DE SOUSA,FLAVIO MEDEIROS FAGUNDES,31/01/1948,Sem erro
193,2513307,JOAO PAULO DE SOUZA,JOSELIA SOARES DE SOUZA REZIER,15/08/1944,Sem erro
194,4215554,JOSE ROMULO FERREIRA DA SILVA,ANA PAULA DE SOUZA MOTA,20/12/1986,Sem erro
195,2513356,HELENA FRANCIELE BEZERRA DA SILVA MOURAT,ANDREA DE OLIVEIRA TORRES,17/05/1950,Sem erro
197,1703826,EDCARLOS DO COUTO SILVA,MARCOS CARBONE,26/12/1932,Sem erro
198,2605905,ANDREIA CARLA DE SENA SILVA,NILZA PAULA HONORATO SAMPAIO,17/11/2020,Sem erro
199,2606101,JOSE SEVERINO FERREIRA FILHO,SELMA FERREIRA DE SOUZA,04/01/1949,Sem erro
200,3127388,JOEL RAMOS DOS SANTOS,VINICIUS DOS SANTOS DE ALMEIDA,09/03/1924,Sem erro
201,2607901,EDJANE PINHEIRO DE OLIVEIRA,JUSARA APARECIDA DE FREITAS,18/12/1993,Sem erro
204,2403251,JAIRO VIRGOLINO DANTAS DOS SANTOS,ANGELA FIDELIS SANTANA,16/11/1931,Sem erro
206,2612505,JOSE ANDRE DE LIMA,LIGIA MAGNANINI DE ARAUJO,03/06/1959,Sem erro
207,2612604,ANSELMO BARBOSA DOS SANTOS,ONESIA DE MATTOS SIQUEIRA,05/03/1933,Sem erro
208,2612604,JOCELIA FERREIRA DE SOUSA,SIRLENE BERNARDES ELOI,27/02/2009,Sem erro
209,2612604,LUCIANO DA SILVA SANTOS,MARIA ALICE DA SILVA COSTA DE MACEDO,30/05/1950,Sem erro
216,2203255,JOSE VALDO SOARES,CLEYSON FERREIRA MARQUES,27/05/1954,Sem erro
217,2203909,GERALDINA TOMAZ DE LIMA,DALVANETE CANDIDO DO NASCIMENTO,16/04/1985,Sem erro
220,2208007,FRANCISCO MARTINS FILHO,ITAPUAN BATISTA DE SOUZA,23/10/1988,Sem erro
221,3163300,IVONEIDE DOS SANTOS DA SILVA,JAIR NELSON BATISTA DE OLIVEIRA,25/01/1942,Sem erro
222,2211001,LIDIANE KALINE NASCIMENTO RIBEIRO,JEFFERSON OLIVEIRA DA SILVA,03/10/1936,Sem erro
223,2211001,MARTA MARIA DA CRUZ,JOAO MARIA CABRAL,17/01/1982,Sem erro
224,2211001,YLMARA SOUSA SILVA,JOAO PEDRO LOPES DA SILVA,12/02/1959,Sem erro
226,4105508,IRINEU PEREIRA BARBOSA,MANOEL MARIA DOS SANTOS,04/05/2021,Sem erro
228,4110300,JOSE DE SOUZA OLIVEIRA,SAMUEL FERNANDO DE LIMA COSTA,29/06/1986,Sem erro
229,4110706,ANDERSON ALVES BOEIRA,SOLANIA LOPES DANTAS,10/02/1969,Sem erro
230,3300407,CARLO DA SILVA OLIVEIRA,CELIO MARQUES BARROS DA COSTA,19/06/1938,Sem erro
233,3302908,MARTA OLIVEIRA COSTA,RENATO DE OLIVEIRA RODRIGUES,06/03/2005,Sem erro
236,3303500,DEBORAH DENISE TEIXEIRA DOS SANTOS,MATHEUS ANTONIO DOS SANTOS AMARAL,31/01/1963,Sem erro
238,3303500,ELVIRA GOMES LEAL,RAQUEL SOARES GONZALEZ,06/04/2008,Sem erro
240,3303500,MARIA NAZARE DA SILVA,MARIA ELISABETE VIEIRA DA SILVA,02/03/1983,Sem erro
244,3303906,CAIQUE AREAS DA SILVA,GUILHERME EDUARDO DA SILVA SOUZA,04/03/1940,Sem erro
245,3303906,JUSARA APARECIDA DE FREITAS,ANA CLARA CRISPIM DA SILVA,04/03/2014,Sem erro
252,3305109,CARLOS JOSE LONTRA FIGUEIRO,VALDELICE MIRANDA CRUZ,21/01/1945,Sem erro
253,3305109,LUCIANA BARAUNA DE SOUZA,MARCIO EMILIANO CANDIDO,02/05/1975,Sem erro
256,2400703,MARIA DA CONCEICAO LOBATO DA CUNHA,LEONICE FELIX DA SILVA,17/10/1991,Sem erro
258,2408102,CASSIANO SILVA DE CARVALHO,SOCORRO SAMUEL SILVA,28/09/1952,Sem erro
259,2408102,EDUARDA KALINE MORAIS DA SILVA,TALITA CARLOS DOS SANTOS TORRES,26/02/2018,Sem erro
261,2408102,JOAO VITOR DE PAIVA PORPINO,WILSON PAES DO NASCIMENTO,26/01/1932,Sem erro
263,2408102,MANOEL FREIRE DA ROCHA,KEROLAINE DOS SANTOS SOUZA,04/03/2006,Sem erro
266,2408102,THALIA DE LIMA FREIRE,PAULO DA SILVA BERNARDO,10/05/1945,Sem erro
267,2403251,VALERIO FEITOSA FREIRE,MARIA CICERA DOS SANTOS SILVA,13/02/2005,Sem erro
268,2403251,WALTER ROBERTO BOHM,ANTONIO LEONIDAS DA SILVA DOS SANTOS,18/11/1925,Sem erro
270,4301305,CESLAU ODETE DE SOUZA LIMA,FLAVIO AGUSTINHO DA SILVA,19/11/2011,Sem erro
272,4301602,GLADIS MARIA DE CAMARGO PEREIRA,ANTONIO IVO DA SILVA,22/06/1949,Sem erro
275,4314407,MARIA LUCIA SIQUEIRA SILVEIRA,JOSE CLOVIS DOS SANTOS SOUZA,28/05/1999,Sem erro
276,4318903,ODACIR ESCOBAR DA SILVA,ROGERIO MATIAS DOS SANTOS,15/11/1956,Sem erro
278,2800209,CICERO VITORINO DOS SANTOS,EMERSON DOS SANTOS FARIAS,11/10/1978,Sem erro
279,2701704,GINALDO DOS SANTOS,MANOEL MESSIAS DOS SANTOS,25/04/1990,Sem erro
280,2801306,MARIA SOLANGE SANTOS,JOSE CICERO PINHEIRO DE ARAUJO,09/12/2004,Sem erro
283,2805604,JOSE RONALDO DOS SANTOS,DAVI SILVA ARAUJO,27/02/2006,Sem erro
284,2805604,VINICIUS MATHEUS DE MELO OLIVEIRA,RONALDO ALVES TEIXEIRA,17/10/1950,Sem erro
286,3513504,ALINE DIAS BENEDITO,JOSE TENORIO DA SILVA,28/09/2001,Sem erro
289,3518701,FABIA ABREU SANTOS,ANDREZA DUARTE ERED,16/06/1993,Sem erro
291,3518701,NATHALIA TEIXEIRA PERES,ANA PEREIRA DA SILVA,19/06/1989,Sem erro
293,3518800,FABIANA SENA INZERILLO,JOSILANE BATISTA PONSIANO,25/06/1939,Sem erro
294,3518800,MARIA LURDES DE OLIVEIRA,VERALICE SILVA SANTOS,22/11/1967,Sem erro
295,4211850,ANTONIO APARECIDO DE OLIVEIRA,UELESON SILVA DOS SANTOS,02/09/1963,Sem erro
296,3539806,EDUARDO PEREIRA DA SILVA FILHO,JOEL NEVES DOS SANTOS,24/03/1991,Sem erro
298,3550308,ISABEL CRISTINA DOS SANTOS,BEMVINDO PEREIRA DE ARAUJO,22/03/2004,Sem erro
299,3550308,JORGE WAGNER DE BARROS BERGAMI,CRISTIANE SANTOS VIDAL,21/09/1950,Sem erro
300,3550308,LUCIANE VALERIA PINTO,IGOR SOUZA DE SANTANA,21/05/1943,Sem erro
301,3550308,MARIA DA PAZ SILVA,INDIARA RODRIGUES PONCIANO,29/10/1956,Sem erro
304,3550308,PEDRO GONCALVES DA SILVA,EDISIO SOUZA RAMOS,18/12/1954,Sem erro
305,3550308,ROSA DA CONCEICAO,CARLOS FRANCISCO CHAGAS,16/11/2019,Sem erro
314,1200500,JAKSON FREITAS TANAZOA,CARLOS LEANDRO DA COSTA,25/10/1959,Sem erro
315,2700300,IRACEMA DORA BEZERRA DA SILVA,JOSE ROBERIO BORGES DOS SANTOS,10/05/1939,Sem erro
316,2700300,MARIA DAS GRACAS CORREIA DOS SANTOS,ANTONIO CARLOS JESUS DA SILVA,26/02/1988,Sem erro
317,2702900,FELIPE NATAN ALEXANDRE ROCHA,RUBENILSON SANTOS DE JESUS,04/08/1929,Sem erro
322,2706000,SAMILY DE NORONHA ARAGAO SOUZA,MARIA CONCEICAO FRANCISCO DA SILVA,18/06/1948,Sem erro
324,1300631,FRANCISCO MONTEIRO SOARES,ELAINE CONCEICAO DE SOUZA DOS SANTOS,05/04/2019,Sem erro
325,1302405,EVILANE MOREIRA BEZERRA,JANE ARAGAO MAMONA,17/01/1934,Sem erro
327,1302405,ROZELIA EVANGELISTA MAIA,CICERO VICENTE DA SILVA,03/08/1963,Sem erro
328,1302603,CRISTIANE SUELEN DA SILVA GUEDES,DJANGO SANTOS DE OLIVEIRA,23/01/2021,Sem erro
330,1600303,IZABEL FONSECA SILVA DA COSTA,JIVALDO CARDOSO MENEZES,01/01/1957,Sem erro
332,2901502,JOSE PEREIRA DOS SANTOS,BENEDITO RODRIGUES COUTINHO,28/10/1980,Sem erro
334,2902807,CLEUSA DOS SANTOS SANTANA,LUCIANA SATURNINO DA CUNHA,15/04/1981,Sem erro
335,2903201,FABIANA DE ARAUJO PEREIRA,ROSENEIDE RUFINO,12/05/1937,Sem erro
338,2905701,DULCE MEIRE MEDINA DE GOIS,JELSON FERREIRA DE CARVALHO,14/01/1963,Sem erro
339,2905701,LARISSA SANTOS DIAS,ANGELA MARCIA DE JESUS DANTAS,25/11/2004,Sem erro
341,2905701,MARIA ELIENE DOS SANTOS,CAMILY SALVADOR DOS SANTOS,25/11/1950,Sem erro
342,2905701,MARLI SOUSA BORGES,FRANCIRLENIO GOMES DA CRUZ,19/05/1974,Sem erro
349,2907707,ANA CRISTINA DO NASCIMENTO BARBOSA,GILMAR PEREIRA DA SILVA,17/12/2005,Sem erro
350,2908408,ADRIANA DE JESUS LIMA,JESSICA BEATRIZ DOS SANTOS CORREIA,14/07/1987,Sem erro
352,2908507,ANA CLAUDIA AQUINO SILVA,RENATA PINTO DA SILVA,09/01/2016,Sem erro
353,2909109,ELAINE DA SILVA OLIVEIRA,ALEX DE JESUS SANTOS,21/08/1980,Sem erro
354,2909307,ROSILDA HONORIA DE OLIVEIRA,ANDRELINO DE JESUS SANTOS,06/10/1951,Sem erro
357,2911501,EDSON SANTOS DE JESUS,JOENI PAIXAO DOS SANTOS,29/05/1956,Sem erro
358,2911709,VANESSA DA CONCEICAO,ROSIVAL DE JESUS SANTOS,21/10/2018,Sem erro
359,2911808,JAKSON PEREIRA SANTOS,DAIANE FERREIRA DE SOUZA,21/07/1971,Sem erro
363,4207601,JAILDO DOS SANTOS CARVALHO,JOSIVAN LIMA SOUTO,31/05/1981,Sem erro
365,2914653,GILDENICE OLIVEIRA SOUZA,CLEBISON DA SILVA XAVIER,29/12/1938,Sem erro
367,2914802,MARIA DAS DORES XAVIER MOREIRA BRANDAO,ANDREA SANTOS NUNES,21/09/1973,Sem erro
368,2916401,DJALMA FRANCA SANTOS,ANDREA SANTOS NUNES,31/07/1993,Sem erro
369,2917300,AGNALDO DA CONCEICAO SILVA,MALU SUELEN DA SILVA,03/04/1981,Sem erro
373,2918407,MARIA JOSE RIBEIRO DOS SANTOS,MARCOS SILVA SANTOS,02/05/1952,Sem erro
374,2918407,ROSINALVA MARIA ALVES LIMA,MARIA APARECIDA SILVA ROCHA,05/08/1950,Sem erro
375,2918407,VIVIANE OLIVEIRA REZENDE,MARIA CLAUDIA RODRIGUES DOS SANTOS,12/01/1965,Sem erro
376,2918506,EDINALDO BARBOSA DE SOUZA,EDMAR DA SILVA MELO,06/12/2019,Sem erro
379,2921708,MARIA ELIANA ALEXANDRINO DE SOUZA,ANTONIO FERNANDO DA SILVA,17/01/1937,Sem erro
383,2924801,NERISVAN RIBEIRO SILVA,CLAUDIA MARIA COELHO,05/04/1950,Sem erro
385,4119806,SERGIO SILVA DOS SANTOS,MARIA AMELIA BARROS DA SILVA,20/07/1971,Sem erro
387,2925600,LIVIA ANDREIA DE ARAUJO MACEDO,REGINA MORAIS DA SILVA,24/12/1957,Sem erro
389,2926905,MARIA ROSA DE OLIVEIRA,GEORGE ALENCAR PEIXOTO,06/03/1986,Sem erro
393,2516508,ELIANA DOS SANTOS PAIXAO,EMANUELE DOS SANTOS COSTA,18/01/1930,Sem erro
394,2931202,MARIA DOMINGAS ALVES,EVELYN EMANUELA FEITOSA FORTE,17/12/1975,Sem erro
395,2931400,GIDEMARIO CARLOS DOS SANTOS,FRANCISCA ELANI MARQUES DA SILVA,17/02/1942,Sem erro
396,2931806,SARA LUCIA CHAGAS,FRANCISCA VANUSA OLIVEIRA,09/01/1928,Sem erro
400,4322707,MALU SUELEN DA SILVA,FRANCISCO FABRICIO MOURA,27/09/1974,Sem erro
404,2300150,MARIA NELE BEZERRA,JOSE ALESSANDRO SANTOS DE CARVALHO,19/10/1943,Sem erro
405,2300754,FRANCISCO CLEIDE DOS SANTOS,KATIA MARIA BATISTA DE ALMEIDA RODRIGUES,25/03/2003,Sem erro
407,2301257,ALCIONE ALVES DE CARVALHO,MARIA GLAUCIA MOREIRA DE ARRUDA,08/01/1981,Sem erro
409,2301307,LUCIENE VELOSO DE OLIVEIRA,MARIA NILDA DA ROCHA,02/03/2017,Sem erro
412,2302404,ERIBERTO SOUSA DA SILVA,BEATRIZ MOURA VIEIRA,28/09/2002,Sem erro
414,2303709,CRISTIANA MOREIRA DE FREITAS,JADE YARA DIAS NASCIMENTO,08/04/1983,Sem erro
416,2303709,JOSE DJALMA ABREU RAMOS,MARIA DE LOURDES DE SOUSA SANTOS,23/06/1989,Sem erro
420,2304103,MANOEL ELIZEU VIEIRA BARBOSA,GERALDO MATIAS COSTA,02/03/1990,Sem erro
421,2304400,FRANCISCO MARCONDES MOURA DE SOUZA,ANTONIO REGIS FERREIRA,19/01/1928,Sem erro
422,2304400,ISABELLY PEREIRA BARBOSA SILVA,RAIMUNDA RODRIGUES DE LIMA,07/04/2001,Sem erro
424,2304400,IVNA BRANDAO DOS SANTOS,LOUISE ANA BARROSO BRAGA,07/01/1935,Sem erro
426,2304400,JOSE ANTENOR GOMES DE BRITO,FRANCISCO MARCELINO ALVES DO NASCIMENTO,02/10/1930,Sem erro
427,2304400,JOSE NASCIMENTO DA SILVA,LUCIO FERREIRA DA SILVA,08/07/1994,Sem erro
428,2304400,JUCIAMIRA CARDOSO ASSUNCAO,SILVANI MOURA SOUSA,20/05/1985,Sem erro
429,2304400,LAUDO NATEL VIANA DE ARAUJO,VIDAL FEIJO RODRIGUES,02/03/1924,Sem erro
431,2304400,MARIA DA SOLIDADE DE OLIVEIRA MARTINS,TATIANA FERREIRA FAVELA,20/09/1941,Sem erro
432,2304400,MARIA FLAVIANA BERNARDO DA SILVA,MILTON CESAR ROSA DA SILVA,16/03/1924,Sem erro
433,2304400,MARIA ZENAIDE MARTINS DE SOUSA,MARCOS ANTONIO DE SOUZA CARVALHO,07/12/1963,Sem erro
438,2306405,LIDUINA FORTUNATO DE SOUSA,BASILEU DE SOUSA SILVA,16/07/1937,Sem erro
440,2308005,ANA CRISTINA CARNEIRO DE ARAUJO,ROMILDA DO NASCIMENTO SOUZA,01/03/2019,Sem erro
443,2308708,RODRIGO VIEIRA SOARES,MAIK TOM VIEIRA DE SA,10/09/1969,Sem erro
446,2309706,ROSEMARY PINHEIRO PEREIRA,LEANDRO ALVES DE OLIVEIRA,31/03/2001,Sem erro
449,2312007,JOAO LUZIELTON LOPES,JOAO BATISTA NEVES MENDES,27/07/1961,Sem erro
450,2412005,FRANCISCO MARCELINO ALVES DO NASCIMENTO,EVA LUCIA DIAS DA SILVA,07/11/1974,Sem erro
452,2412005,SILVANI MOURA SOUSA,ALDENOR SILVA,04/09/1999,Sem erro
455,2313559,KAUA VITOR BRAGA DE OLIVEIRA,ROMARIO NEVES SANTOS,31/07/2017,Sem erro
456,5300108,DEMYLI VALERIA FERREIRA BORGES,GABRIEL MENESES OLIVEIRA,19/04/1962,Sem erro
458,3201605,EISLANE CAROLINA DOS SANTOS,MARIA ANDREIA DOS SANTOS ARAUJO,18/09/1950,Sem erro
461,3205002,DINE PEREIRA SOARES,DOMINGOS DA COSTA SOUZA,19/07/1934,Sem erro
463,3205101,ALTINO DOS SANTOS FERREIRA,FRANCISCO BARRETO OLIVEIRA,14/08/2000,Sem erro
465,3205309,EDINEIA ALVES SIQUEIRA,RAIMUNDO JOSE DOS SANTOS SILVA,31/12/1932,Sem erro
469,3109808,EUNICE CLEIDE ARAUJO BARCELOS,LAURIANE DO ROSARIO GUTERRES MATOS,16/02/1952,Sem erro
473,5220405,SILMARA RIBEIRO MORAES CRUZ,ANNA CECILIA FREIRE DA SILVA,16/05/2004,Sem erro
475,2100956,VALDETINO ARAUJO SILVA,MARIA ISABEL GOMES PROTASIO,03/11/2000,Sem erro
478,2102507,ANTONIO CARLOS MENDES GASPAR,ANDERSON DA SILVA SOUSA,29/12/1943,Sem erro
479,2102507,JOSENILSON FERREIRA SILVA,FRANCINETE LAURINDA DE OLIVEIRA,14/10/2018,Sem erro
481,2102903,RALIANE JAMILLY SOUZA DOS ANJOS,MICHELY DO SOCORRO PIRES NASCIMENTO,19/02/1945,Sem erro
482,2103208,ERICA DE SOUSA FERREIRA,BENEDITA BARBOSA,16/11/2015,Sem erro
483,2103208,FRANCEILSON FERREIRA LIMA,ADENILDE PINHEIRO PEREIRA SANTOS,09/11/1965,Sem erro
485,2103208,THIAGO SILVA DE MENESES,IRANEIDE VIVEIROS MENDES,09/07/1982,Sem erro
488,2105104,VANESSA ROSA DE MORAES,RIVELINO DE JESUS DOS SANTOS,28/08/2012,Sem erro
489,2105302,ANA MARLY BARBOSA DA LUZ,RIVELINO DE JESUS DOS SANTOS,31/08/1957,Sem erro
490,2105302,EGNA LUCIA NUNES DA SILVA LUZ,ROSENILSON REIS RIBEIRO,08/02/1934,Sem erro
493,4115903,CLAUDIO CONCEICAO SOUZA,DANIEL DIAS,14/10/1951,Sem erro
496,2107704,LEONARDO SILVA OLIVEIRA,ELZA PRIMO ALBINO,19/01/1940,Sem erro
497,2108009,FRANCISCO FARIAS GUIMARAES,JOANA D ARC SOARES FREITAS MACIEL,09/05/1964,Sem erro
499,2108504,MARIANA BERENICE PEREIRA CARNEIRO,JORGE ANTONIO SIMAO,10/06/1957,Sem erro
500,2109205,MARCOS DOS SANTOS OLIVEIRA,JOSE CARLOS PIRES,13/10/1937,Sem erro
501,2109239,JACIMEIRE PINHEIRO AROUCHA,JOSEMAR ALVES,16/04/1943,Sem erro
504,2513703,CLEILSON DOS SANTOS SEREJO,NEUSA DE LOURDES SENA,11/06/2021,Sem erro
506,2111201,FRANCINETH DA SILVA RODRIGUES,CRISTINA MARIA SILVA DE ALMEIDA,23/03/1930,Sem erro
507,2111300,ADRIANO SOUZA,WESLEY GONCALVES SANTOS,10/06/1981,Sem erro
509,2111300,LUCIANA DE BARROS,JOSE MAURO EMETERIO,26/06/1991,Sem erro
510,2111300,MARIA SONIA DA SILVA FONTENELE SANTOS,EDMAR ALVES DA SILVA,06/06/2019,Sem erro
513,2613800,WESLEY AZEVEDO MEIRELES,THALIS GONCALVES MATA,25/09/1937,Sem erro
514,2111748,LARYSSA SABRINE RODRIGUES DA SILVA,RENATA CORREA DA CUNHA,31/08/1993,Sem erro
516,2112100,MARIA VANEIDE MACHADO DOS SANTOS,EDUARDA RIBEIRO,19/09/1975,Sem erro
518,2112209,LUCIANA SANTOS LIMA,JOSE BENEVIDES GONCALVES,11/02/1935,Sem erro
520,3205101,ANTONIO CARLOS MORAIS,ANA CLAUDIA FERREIRA GLORIA,08/12/1985,Sem erro
522,3205101,ARNALDO RIBEIRO MORAIS,VANIA DE FATIMA LOURENCO,28/12/2009,Sem erro
523,2112803,ARNALDO RIBEIRO MORAIS,LUCIO VIEIRA,05/06/1995,Sem erro
525,3205101,MARIA FRANCISCA CARDOSO MOTA,AMANDA APARECIDA GOMES DA SILVA,27/02/1946,Sem erro
530,2112803,THALIA DINIZ DOS SANTOS COSTA,MANOEL ALVES DOS SANTOS,13/05/2009,Sem erro
534,3102605,MARCOS ROBERTO TEIXEIRA,PAULO RODRIGUES ROCHA,09/04/1934,Sem erro
535,3106200,ALEXANDRE DE SOUZA ASSUNCAO,CELSO BOSCO CORREA,04/01/1946,Sem erro
536,3106200,ALMERINDA XAVIER DOS SANTOS,JOSE PAULO ALVES,16/05/1962,Sem erro
539,3106200,DELIZETE LUCIA MACIEL,JADER ALBERTO DE SOUZA FERREIRA,01/12/1983,Sem erro
541,3106200,ELCIO JOSE DA SILVA,MESSIAS MACHADO FERREIRA,17/11/1932,Sem erro
542,3106200,ELIEL ANTONIO VIANA,EVILY FERREIRA DA SILVA,04/01/1993,Sem erro
545,3106200,GERALDO MAGELA RAMOS,ANDREA LIMA QUEIROZ,20/10/1977,Sem erro
546,3106200,HELIO MEGALE DE ABREU ROCHA,ANGELITA DA CRUZ,15/08/1976,Sem erro
547,3106200,JANE DE JESUS COELHO,LEONEIDE COSTA AZEVEDO,09/03/1992,Sem erro
548,3106200,JOSE WILSON LEMES DOS SANTOS,LUCIANO DE SOUSA TRINDADE,06/10/1938,Sem erro
549,3106200,LEONARDO PEREIRA DA SILVA,MARA CRISTINA COELHO DE LIMA,04/04/2009,Sem erro
551,3106200,NAYARA CORREA FERREIRA SANTOS,NAZARENO MORAES CARDOSO,03/08/1993,Sem erro
552,3106200,PEDRO HENRIQUE LIMA DE OLIVEIRA,ROMULO DJAVAN DE CARVALHO FERREIRA,09/05/1971,Sem erro
555,3106705,JANDIRA PEREIRA DA SILVA,ANTONIO SALES TEXEIRA PEREIRA,17/12/1997,Sem erro
563,3152501,MARIA HELENA FIGUEIREDO,FRANCISCO FERREIRA DO NASCIMENTO FILHO,09/09/2009,Sem erro
564,2928059,ELITANE LIBRA DE OLIVEIRA,MARCILENE RODRIGUES DA SILVA,26/08/1995,Sem erro
565,2513984,CARLOS ALEXANDRE RODRIGUES DE ARAUJO,MERIANE DE FATIMA BATISTA MOIA,11/04/1950,Sem erro
567,3549003,JOAO ANTONIO GONZAGA,TERCILENE SOUZA NUNES,15/03/1964,Sem erro
568,3549003,JOSE CARLOS FRANCISCO DOS SANTOS,VALCIANE PINTO MIRANDA,16/01/1998,Sem erro
569,3161106,JOSE CARLOS FRANCISCO DOS SANTOS,NATALINO DOS SANTOS MONTEIRO,26/12/1930,Sem erro
570,3162450,CELINA CAVALCANTE BARROS,RAIMUNDA LUZIA CUIMAR MAIA,15/05/1967,Sem erro
580,5100250,ELISEU MARTINS ARRUDA,ANANIAS MARTINS DA SILVA,20/05/1973,Sem erro
582,4117206,ROSIMEIRE DA SILVA,DANIEL JOSE DE SOUZA,03/05/1944,Sem erro
584,2211407,JANICE CONCEICAO FARIA DA SILVA,VANDERLEI DUARTE DE SANTANA,12/12/1994,Sem erro
588,1500107,JOSE ROSA TELES PINTO,JOAO AUGUSTO DA SILVA,10/12/2016,Sem erro
589,1500107,MARCIA SILVA RODRIGUES,JOSE ROMULO FERREIRA DA SILVA,07/08/1981,Sem erro
591,1500305,ELZA BATISTA RAMOS,VERONICA DE LIMA CARDOSO,15/11/1944,Sem erro
594,1500800,NAZARE DO SOCORRO SOUZA MORAIS,FRANCISCO DE ASSIS ALVES DA SILVA,12/08/1953,Sem erro
595,1500909,FRANCISCO ASSIS ARANHA,GEOMARQUES NUNES DE MACEDO,22/09/1932,Sem erro
597,1501402,ANA MARIA FERREIRA SANTOS,ANDRE ALVES DA SILVA,02/10/1996,Sem erro
604,1501402,JAQUELINE CAMPOS PEREIRA,ROBSON CESAR BATISTA DE MELO,25/02/1953,Sem erro
605,1501402,JHONES DA SILVA CORDEIRO,ALFREDO FERREIRA DE SOUZA,31/08/1957,Sem erro
609,2501906,RAIMUNDA SIQUEIRA MORAES,PAULO FERREIRA DE SOUZA,10/02/1989,Sem erro
611,2501906,ROSIMERES DE OLIVEIRA SOUZA,MARIA MARLIETE DE LIMA,14/04/1966,Sem erro
612,1501709,NILMA CRISTINA SILVA DE SOUSA,ALEXSANDRO JOSE DE LIMA,11/08/1980,Sem erro
613,1501907,MANOEL TEIXEIRA DA ANUNCIACAO,MARIA EDILMA DA SILVA,24/02/2022,Sem erro
614,4104501,ALLAN DA CUNHA SANTIAGO,LUCILENE DAMASCENA BISPO,10/02/1994,Sem erro
615,1502509,MARIA JACIREMA MARTINS,DAVID MULLER CASTRO DE LIMA,05/09/1966,Sem erro
617,1503507,IZONIR RODRIGUES DE PAIVA,EDMILSON ANTONIO DE LIMA CARNEIRO,21/06/1951,Sem erro
619,1504208,ILDA DA SILVA PEREIRA,CONCEICAO MARIA TAVARES,07/09/1962,Sem erro
620,1504208,LUZILENE FERREIRA LIMA,DENILSON MORAIS DA SILVA,29/01/1980,Sem erro
621,1504208,MARIA ALICE DE SOUSA MARQUES,EDLEIDE FERREIRA LEITE,31/05/1924,Sem erro
622,1504307,ARTHUR DAVID DAMASCENO DA LUZ,FABIO ALVES FERREIRA,15/04/2004,Sem erro
623,1504505,RAIMUNDO SANTANA SAMPAIO,LUCIANA MARIA LOPES,12/03/2018,Sem erro
624,1504604,ALDIANE CARVALHO DA SILVA,LUCIMAR BEZERRA DA SILVA,15/10/2000,Sem erro
628,1504604,ELIZETE DA CONCEICAO,LENILVALDO BERNARDO DA SILVA,16/09/1929,Sem erro
629,1504604,EMANUELLE LOPES MACIEL,JACSON DA SILVA DIAS,26/10/2008,Sem erro
632,1504604,KATIA CILENE LOPES COELHO,ROSINEIDE MARIA GOMES,07/08/1935,Sem erro
634,1504604,LAIENE ELANA PANTOJA DE ALMEIDA,LEANDRO BARBOSA DOS REIS,22/06/2021,Sem erro
638,1504604,MARIA LEONICE PINTO DOS SANTOS,AGESISLAU DE SOUSA BARROSO,10/01/1968,Sem erro
639,1504604,MILENA FREITAS GONCALVES,MARTINHO FILHO RODRIGUES GOMES,05/08/2010,Sem erro
641,1504604,RAIMUNDA DE NAZARE SACRAMENTO ROCHA,JOSE LUIS ROCHA DE CARVALHO,12/11/1997,Sem erro
642,1504604,ROBERTA COSTA DOS SANTOS,LEANDRO CALIXTO DE ARAUJO,01/03/2010,Sem erro
648,1505403,AUDILENE DOS SANTOS CAMURCA,LEONARDO DE SOUSA NUNES MARQUES,12/11/1974,Sem erro
651,2501807,MARIA DA PENHA DE BRITO SILVA,SIVONETE DE OLIVEIRA,11/01/1989,Sem erro
652,2502003,MARIA FRANCISCA DE SOUSA,JANETE REGINA DA TRINDADE LOPES,05/04/1989,Sem erro
