ID,COD_MUNICIPIO,NOME,NOME_RESPONSAVEL,data_nasc,Tipo_erro
7198,2914802,ROSIMA DOS SANTOS,"",24/07/1979,tipo 1
7249,5212204,DENILZA ALVES DOS SANTOS,"",06/05/2020,tipo 1
7292,5214051,CELESTE OLIVEIRA DOS SANTOS,"",31/03/1974,tipo 1
7322,2926103,ANTONIO EDSON MARQUES DA SILVA,"",01/10/1999,tipo 1
7333,2411106,MARIA DO CARMO OLIVEIRA DA SILVA,"",03/08/1999,tipo 1
7375,2930709,GEANE DIAS DA SILVA MARQUES,"",03/05/1997,tipo 1
7501,2304400,ALINE DA SILVA NORBERTO,"",16/12/1944,tipo 1
7522,2304400,ERIKA CILENE CARDOSO DA SILVA,"",21/03/1990,tipo 1
7536,2304400,JADIANE INACIO DA SILVA,"",16/02/1926,tipo 1
7546,2304400,JOSIVANIA LIMA DOS SANTOS,"",15/06/1989,tipo 1
7558,2304400,MARIA APARECIDA DELFINO DA SILVA,"",04/08/1954,tipo 1
7599,2305407,IRENE NUNES DA SILVA NASCIMENTO,"",04/06/1974,tipo 1
7654,2309607,CHIRLENE FRANCO PEREIRA,"",18/09/2018,tipo 1
7660,2310258,GILSON ANGELO VIANA,"",18/01/2016,tipo 1
7664,2311207,THAMIRES CARVALHO GONCALVES,"",15/01/1981,tipo 1
7667,2311306,JOAO BATISTA ALMEIDA LIMA,"",05/12/1942,tipo 1
7792,4211603,VALERIA APARECIDA DE MORAIS,"",23/04/1957,tipo 1
7914,2513307,MARIA MENEGILDA DINIZ SILVA,"",13/12/1953,tipo 1
7959,2111300,VALDEGRACA PEREIRA DA SILVA,"",18/09/1933,tipo 1
7960,2111300,WALDENILSON CHARLES RAMOS ARAUJO,"",14/09/1929,tipo 1
7967,2111706,EVANDRO NASCIMENTO MATOS,"",25/06/1969,tipo 1
8040,3106200,FRANCISCO COSME CANUTO,"",27/02/1965,tipo 1
8053,3106200,MARIA APARECIDA NASCIMENTO,"",18/06/2010,tipo 1
8058,3106200,NEIDNEIA SOARES DA SILVA,"",27/04/2021,tipo 1
8187,3157005,DILMA BISPO DE OLIVEIRA,"",09/10/2011,tipo 1
8201,3161106,ELZA DAMARISE GONCALVES NASCIMENTO RODRI,"",18/04/1952,tipo 1
8208,3162708,GENI ROCHA,"",25/03/2001,tipo 1
8213,3164472,VANDA LUCIA FERNANDES LEAO,"",20/06/2012,tipo 1
8262,1500107,MANOEL MILTON BENTES FAVACHO,"",20/03/2022,tipo 1
8280,2700805,AGATA DIAS CAVALHEIRO,"",26/01/1988,tipo 1
8470,2515500,TIAGO DE OLIVEIRA,"",22/05/2000,tipo 1
8552,2602902,JOSUE AMARO DOS SANTOS,"",08/06/1945,tipo 1
8562,2604106,JANAINA ANTONIA DE MOURA,"",03/07/1938,tipo 1
8589,3127388,ERALDO JOSE CESAR DA CRUZ FILHO,"",23/11/1943,tipo 1
8631,2105450,MARIA DAS GRACAS DE LIMA,"",07/06/1944,tipo 1
8691,2612505,MARIA DAS NEVES DO NASCIMENTO SOUSA,"",26/08/1962,tipo 1
8709,2614006,PEDRO VALDEMIRO RODRIGUES,"",16/09/1943,tipo 1
8761,2206720,JOSE LUIZ OSORIO,"",08/02/2020,tipo 1
8854,4119905,PAULO JANSEN,"",22/08/1969,tipo 1
8917,3302403,JUNILDE MARIA RIBEIRO,"",28/04/1967,tipo 1
8937,1714203,ROSANE MARIA CESARIO DA SILVA,"",16/09/1999,tipo 1
8960,3303500,FLAVIA DUTRA PEREIRA,"",03/06/1942,tipo 1
8997,3303500,VALDINEIA DE SOUZA FONTE GOMES,"",05/07/1927,tipo 1
9166,2405801,ROSIMERE ARAUJO DE ABREU,"",03/03/1945,tipo 1
9228,2403251,MAURILIO DA SILVA BARBOSA,"",03/04/2000,tipo 1
9235,2409902,MARIA DAS NEVES DE SOUZA,"",07/08/1947,tipo 1
9262,1400233,ELIZANGELA CORREIA FIGUEIREDO,"",30/03/2022,tipo 1
9348,2615706,VERA JOANA AMARAL DA CRUZ,"",11/11/1946,tipo 1
9359,4202453,HUGO LEONEL SILVA DE ALMEIDA,"",08/05/1945,tipo 1
9400,2506905,PATRICIA DE JESUS LIMA,"",10/04/1954,tipo 1
9404,2803401,MARINA NASCIMENTO RAMOS,"",30/09/1991,tipo 1
9409,2803500,JOSE FELIX DOS SANTOS,"",12/01/1937,tipo 1
9428,2806206,MARIA BORGES DOS SANTOS,"",26/10/1985,tipo 1
9519,3513900,KATIA DA SILVA CORDEIRO,"",09/06/2019,tipo 1
9542,3518701,DORIS MARI VELLO,"",13/10/2022,tipo 1
9580,3523503,MARIA APARECIDA NESPEQUE,"",04/08/1986,tipo 1
9584,3525102,PAULA CRISTINA SILVA DE OLIVEIRA,"",12/12/2020,tipo 1
9592,3529401,MARIANE DE OLIVEIRA ALCALDE,"",16/12/2009,tipo 1
9595,3530607,DAMIANA ALMEIDA,"",23/07/1982,tipo 1
9600,3530607,SELMA ELIZA BATISTA,"",03/12/2021,tipo 1
9602,3531100,ROSELI DE CAMARGO PEREIRA,"",30/09/1955,tipo 1
9609,3534401,JOAO CARLOS RODRIGUES,"",12/09/1982,tipo 1
9678,3548708,ELAINE LINARES ALMEIDA,"",23/03/2001,tipo 1
9736,3550308,ANTONIO OLIVEIRA DA SILVA,"",28/09/1937,tipo 1
9757,3550308,DOUGLAS GLAUCIO GOMES DE OLIVEIRA,"",12/06/1933,tipo 1
9760,3550308,EDIMILTON PEREIRA GOMES,"",06/01/1974,tipo 1
9850,3550308,TAINA DO NASCIMENTO ROMAO,"",21/09/1942,tipo 1
9870,3551009,BRUNO VASCONCELOS MONTEIRO,"",14/09/1997,tipo 1
9879,2515930,ELIANE CRISTINA DE CARVALHO CELESTINO,"",30/04/2021,tipo 1
9885,3553005,JESSICA DA SILVA LOPES,"",10/05/1983,tipo 1
9895,3555406,LUZIA BARBOSA DE OLIVEIRA,"",07/12/1961,tipo 1
9968,1200013,LUCILEIA CAMPOS DE SOUZA,"",17/09/2001,tipo 1
9970,1200013,MANOEL CUNHA DE MORAES,"",27/06/1955,tipo 1
9973,1200013,MARIA BERENICE DA MELO SOUZA,"",20/05/1985,tipo 1
9994,1200013,RAIMUNDA NONATA MONTE NOGUEIRA,"",20/08/1955,tipo 1
9997,1200013,RAISSA CAMYLE BRANCO DA SILVA,"",08/04/1995,tipo 1
10040,1200054,DINEIS VALENTIM DA COSTA,"",04/08/1974,tipo 1
10057,1200054,GRACIELA MELENDRE JAMINAWA,"",11/12/1955,tipo 1
10089,1200054,MARLETE ANDES DA COSTA,"",02/12/1932,tipo 1
10121,1200104,ANDREZA BARROSO SANTOS,"",24/06/1934,tipo 1
10127,1200104,ANTONIA FERREIRA DA SILVA,"",04/05/2014,tipo 1
10135,1200104,ARQUILENE BEZERRA CAMPOS,"",21/09/1938,tipo 1
10189,1200104,EULALIA NOGUEIRA DE CASTRO,"",20/02/1925,tipo 1
10235,1200104,JANAELY JERONIMO CABRAL,"",24/01/1982,tipo 1
10270,1200104,MARIA ANTONIA CIRIACO DO REGO,"",10/12/1949,tipo 1
10281,1200104,MARIA GEANE MESQUITA DA SILVA MARTINS,"",24/02/1963,tipo 1
10314,1200104,NEIVA ARANTES DE SOUSA,"",24/07/1991,tipo 1
10341,1200104,ROZIRLANDIA ALVES ANDRADE,"",16/08/1973,tipo 1
10351,1200104,SUELY PADILHA DE SENA,"",18/10/1925,tipo 1
10551,1200179,MARIA APARECIDA DE LIMA CHAVES,"",09/06/1925,tipo 1
10553,1200179,MARIA AUXILIADORA GADELHA DA SILVA,"",10/12/1983,tipo 1
10562,1200179,MARIUZA FREITAS DA SILVA,"",19/06/1945,tipo 1
10620,4306205,ALCIONE DE ALMEIDA ALEMAO,"",23/05/1962,tipo 1
10664,4306205,ANA CARLA DA SILVA OLIVEIRA,"",19/04/1967,tipo 1
10697,4106704,ANA TAIGILA NASCIMENTO DA ROCHA,"",27/06/1934,tipo 1
10699,4306205,ANDERSON OLIVEIRA DE LIMA,"",01/02/1938,tipo 1
10709,1200203,ANDRIELE ABREU DE OLIVEIRA,"",28/08/1948,tipo 1
10800,1200203,ANTONIO JULIO DOMINGOS DO NASCIMENTO,"",27/10/1964,tipo 1
10804,1200203,ANTONIO MOURA DA SILVA,"",22/06/1949,tipo 1
10890,4306205,CLAUDIA IZIDORO BEZERRA,"",04/09/1987,tipo 1
10950,1200203,DAIANE DE SOUZA AQUINO,"",30/10/1988,tipo 1
11070,4106704,ELISSANDRA DOS SANTOS CONCEICAO,"",11/03/1992,tipo 1
11074,4306205,ELIZANETE SOUZA SILVA,"",19/02/1988,tipo 1
11087,1200203,ENILTON COELHO DE ALMEIDA,"",28/11/1941,tipo 1
11117,1200203,FABIANA DE ALMEIDA ALEMAO,"",12/02/1986,tipo 1
11168,1200203,FRANCISCA DUCILENE NASCIMENTO DOS SANTOS,"",06/10/1962,tipo 1
11199,4106704,FRANCISCA SILVA DO AMARAL,"",19/12/2015,tipo 1
11226,1200203,FRANCISCO MARDISSON DA SILVA FERREIRA,"",23/12/2014,tipo 1
11243,4106704,GENERINDA CERQUEIRA LIMA,"",22/06/2021,tipo 1
