ID,COD_MUNICIPIO,NOME,NOME_RESPONSAVEL,data_nasc,Tipo_erro
11300,1200203,IVONARIA GOMES BRAZ,KETHEN SILVA FIGUEIREDO,13/10/1965,tipo 2
11362,4106704,JESUS MARTINS DA COSTA,LUCIETE DO VALE,21/10/1974,tipo 2
11387,4306205,JOICIANE ALMEIDA DA SILVA,MANOEL DA ROCHA,14/04/1981,tipo 2
11405,4106704,JOSE DIOMAR DE OLIVEIRA FERREIRA,MARCIA DE MIRANDA,27/05/1958,tipo 2
11557,4106704,MAINA NASCIMENTO DA SILVA,MARIA PEREIRA DA SILVA,26/10/2001,tipo 2
11641,4106704,MARIA ANTONIA TRINDADE DA SILVA,MARIA RODRIGUES MACIEL,20/09/1985,tipo 2
11657,4106704,MARIA AUXILIADORA DA SILVA CONCEICAO,MARIA DUARTE DA SILVA,31/05/2021,tipo 2
11771,4306205,MARIA DE FATIMA DOS SANTOS OLIVEIRA,MARIA OLIVEIRA DOS SANTOS,07/10/1972,tipo 2
11826,4106704,MARIA ELIANA SABINO,MARIA SILVA DO NASCIMENTO,30/07/2000,tipo 2
11901,4306205,MARIA GISELIA SILVA DO CARMO,MARIA DA SILVA FERREIRA DOS S,31/03/1970,tipo 2
12115,1200203,MARIA RAQUEL SOUZA DA SILVA,PAMELA SOUZA LOYOLA,09/05/1936,tipo 2
12515,4106704,SANDILA CALINE SANTIAGO DE OLIVEIRA,LUCIENE AMARAL MAGALHAES,08/07/1942,tipo 2
12565,4306205,TAIGILA DE OLIVEIRA COSTA,ZELIA DE ARAUJO,06/11/2015,tipo 2
12581,4306205,TAMILA FARIAS DA COSTA,ANGELICA SILVA SOUSA,28/08/1950,tipo 2
12644,4306205,YARISSA DA PASCOA DE SOUZA,FRANCISCA CLAUDIA LEMOS DE SOUSA,17/11/1987,tipo 2
12675,1200252,ELIANA GINA PEREIRA BARRETO,JARLIENE DA SILVA,06/08/1979,tipo 2
12843,1200302,FRANCISCA BATISTA DA CUNHA,ORLEVI E SILVA,18/05/1955,tipo 2
12845,1200302,FRANCISCA DAS CHAGAS GOMES VASCONCELOS,QUESIA SILVA TAVARES,27/01/2015,tipo 2
13117,1200328,JOSE MOISES KAXINAWA,MARIA DE SOUZA NASCIMENTO,03/07/1987,tipo 2
13125,1200328,LIDIANA BARBOSA SABINO KAXINAWA,MARIA SILVA DE HOLANDA,06/01/2004,tipo 2
13169,1200328,ROSILENE DO NASCIMENTO LIMA,TEREZINHA DA SILVA,30/08/1939,tipo 2
13189,1200336,ANTONIO MARCOS MATOS DA SILVA,ARTEMILDA DE OLIVEIRA DA SILVA,12/08/1939,tipo 2
13251,1200336,GEILSON OLIVEIRA DA SILVA,MARIA FATIMA NUNES DA SILVA,19/07/1959,tipo 2
13433,1200344,CARLOS ALBERTO DA SILVA LOPES,MARIA SOUZA SOARES,14/08/1941,tipo 2
13493,1200344,MACIRLENE SALDANHA DA SILVA,ANA MIRANDA LIMA,22/04/1970,tipo 2
13529,1200344,RAIMUNDO NONATO CARVALHO DE SOUZA,GLEICIANA SILVA,07/06/1985,tipo 2
13594,1200351,ELAINA LIMA BEZERRA,VALDECIR COSTA,19/09/2014,tipo 2
13614,1200351,FRANCISCO ERNILSON MOREIRA SILVA,AMADEU DE SOUZA,03/03/1984,tipo 2
13787,1200385,GIRLANE DE SOUZA ARAUJO,RABELES DA SILVA,08/08/2020,tipo 2
14025,1200807,NAGILA SANTOS DE SOUZA,ALDENORA ALMEIDA SILVA,11/01/1952,tipo 2
14056,1200807,THALIA MAIARA CAVALCANTE DA SILVA,ALINE DE ALMEIDA,17/12/1969,tipo 2
14323,5107206,ALDENISA SILVA CASTRO,ANTONIA DE SOUZA RIPARDO,24/11/1985,tipo 2
14389,5107206,AMANDA MARIA DA SILVA CONCEICAO,ARLETE CORDEIRO XIMENES,18/08/1945,tipo 2
14479,5107206,ANA VITORIA ARAGAO DE SOUZA,CAMILA MACIEL OLIVEIRA,08/10/1995,tipo 2
14499,1200401,ANDREIA DA CRUZ FLOR,CARLOS DIAS DURVAL,31/07/2017,tipo 2
14626,5107206,ANTONIA VICTO DE FREITAS,CRISTIANE DE LIMA,13/12/1960,tipo 2
14650,5107206,ANTONIO JOSE BERMUDEZ SILVA,DAIANE MARTINS DA ROCHA,15/07/1981,tipo 2
14703,1200401,AURICELI OLIVEIRA DA SILVA,DARIANA CORREIA DA ROCHA,20/05/1995,tipo 2
14716,1200401,BEATRIZ COELHO DA SILVA,DAYANE REGO BARBOSA,10/10/1961,tipo 2
14726,1200401,BENEDITA DE LIMA PINTO,DEBORA DO PRADO,19/11/1929,tipo 2
14796,1200401,CAROLINE FROTA ALVES,DULCICLEIA SILVA FONTELES,03/06/1996,tipo 2
14802,5107206,CASSIA MAIARA LIMA SOUZA,EDCHERLE COSTA LYRA,21/09/1985,tipo 2
14856,1200401,CLAUDIANE DA SILVA VIANA,ELEN SOUSA PAIM,27/02/2017,tipo 2
14858,5107206,CLAUDINA DE ALMEIDA PARADA,ELENI SANTOS MONTEIRO,03/02/1993,tipo 2
14913,5107206,CREMILDA GOMES DA SILVA,ELIETE RODRIGUES FIDELIS,16/11/1944,tipo 2
14977,1200401,DANIELA BEATRIZ SILVA E SILVA,ELONEIDE OLIVEIRA PINHEIRO,14/06/1937,tipo 2
14986,5107206,DANIELE OLIVEIRA DA ROCHA,ELZIANE FERNANDES,05/12/1925,tipo 2
15009,5107206,DAYANE DE LIMA NUNES,ERICA ROSALES BERROSPI,20/10/1951,tipo 2
15026,5107206,DEBORA FONSECA SOUZA,ERIKA DA SILVA FREIRES,19/11/1934,tipo 2
15037,1200401,DENISE DE OLIVEIRA SIEBRA,ERLEUDA SILVA GONCALVES,15/01/1998,tipo 2
15059,1200401,DIANA MEDEIROS DA SILVA,EUGENIA SILVA MARTINS RIBEIRO,18/08/1989,tipo 2
15071,5107206,DILHERMINA ARAUJO FERREIRA,EVA SILVA FEITOSA,15/12/1988,tipo 2
15294,1200401,ELIZETE DELFINO FERREIRA,FRANCISCO FRAGA,04/08/1995,tipo 2
15318,1200401,ENILCE SOARES DA COSTA,FRANCISCO GOMES DA SILVA,29/06/1935,tipo 2
15344,5107206,ERIKA GONZAGA DA SILVA E SILVA,GABRIELE AMORIM,05/08/1971,tipo 2
