ID,COD_MUNICIPIO,NOME,NOME_RESPONSAVEL,data_nasc,Tipo_erro
3086,2503704,EDUARDO AUGUSTO LINS MARTINS,JUVANILDO DOS SANTOS,07/08/1987,tipo 5
3107,2507606,JOAO VITOR DOS SANTOS SILVA,JOSEANE INACIO SIMOES,10/11/1959,tipo 5
3112,2509107,SEVERINO TARGINO BEZERRA,WELLINGTON SILVA BATISTA,29/04/1953,tipo 5
3118,2510709,REGINA DE OLIVEIRA SILVA,ALEXANDRE JOSE DA SILVA TAVARES,06/10/1991,tipo 5
3120,2511202,SILVANA MARIA DA SILVA,DIEGO ALLISON DE OLIVEIRA SOARES,08/04/2004,tipo 5
3127,2512101,JEANE ARNAUD DE SOUSA GOMES,VITOR KAIC DE ARAUJO BARBOSA,27/02/1983,tipo 5
3130,4215554,FRANCISCO GOMES ROLIM,JOSE ELEICO DIAS DE SA,04/06/1956,tipo 5
3145,2600203,JOSE REIS DE ALBUQUERQUE,SEBASTIAO MIGUEL FERREIRA DA SILVA,31/12/1953,tipo 5
3154,2601201,MARIA DO SOCORRO DA SILVA,JULIANA SANTOS DA SILVA,25/02/1957,tipo 5
3160,2601706,JOSEFA ANTONIA DA SILVA,NADJA DOS SANTOS OLIVEIRA,06/07/1936,tipo 5
3163,2602209,ADEILDO MANOEL DE ANDRADE,WALQUIRIA MARIA DA CONCEICAO,23/03/1930,tipo 5
3167,3300506,DIRCEU OLIVEIRA DE AZEVEDO,ABMAEL FEITOSA DA SILVA,15/10/1928,tipo 5
3195,2604155,ELICLEIDE MARIA DA SILVA,ROBERTO DA SILVA COELHO,25/04/2017,tipo 5
3215,2606002,MARILENE DA SILVA COSTA,EDIGLEIDE MARIA DE OLIVEIRA,16/10/1971,tipo 5
3220,3127388,CLAUDEMIR SILVA DOS SANTOS,WILSON VIEIRA DOS SANTOS,26/11/1990,tipo 5
3225,2606200,JOSE GOMES DA SILVA,ANTONIO JOSE ASSIS CARNEIRO,21/11/1947,tipo 5
3236,4110300,CLAUDIO QUIRINO FREIRE,DOMINGOS PEREIRA DA SILVA,10/11/1939,tipo 5
3240,2607208,JOSELI MARIA DA TRINDADE,NELITON MENDES DE LIMA JUNIOR,13/07/1972,tipo 5
3254,2609907,MARIA DOS REMEDIOS MACEDO LUZ,ORLANDO BORGES DE JESUS,16/02/1992,tipo 5
3270,2610707,ERICA PATRICIA BARBOSA,ISABEL APARECIDA DA SILVA DAS DORES,01/07/1953,tipo 5
3294,2612505,BEATRIZ ZEFERINO DO OH,JOSIELE SOUZA SANTOS,11/08/1994,tipo 5
3308,2614105,JOAO MONTEIRO GOMES,DANIELE VICTOR PINHEIRO,22/02/1981,tipo 5
3320,2616308,SEVERINA MARIA DA SILVA,CESAR DEPLAN DE AZEVEDO,29/02/1936,tipo 5
3322,2616407,NATALIA ANGELA DE SOUZA,MARCELO MARTINS AREIAS,10/12/1960,tipo 5
3325,2201606,JOAO BORGES PESSOA FILHO,NILZA DE OLIVEIRA,16/05/1981,tipo 5
3335,2202778,VALDO FRANCISCO DE ALMEIDA,THIAGO LIMA GOMES OHASI,25/10/2003,tipo 5
3349,2206209,SIMONE FERREIRA DE OLIVEIRA,ADRIANE OLIVEIRA DA SILVA RODRIGUES,13/01/1951,tipo 5
3354,2207900,JOCELIO GOMES BARBOSA,RIVALDA DA SILVA,12/11/2012,tipo 5
3355,2207900,MARIA GILMARA DA SILVA GOMES,VALERIA MUNIZ DE ALMEIDA,28/04/1951,tipo 5
3357,2208007,MARIA LUZINEIDE DOS SANTOS,ALBA DE CASTRO,15/06/1981,tipo 5
3374,2211001,JESSICA WELUMA ALVES FERREIRA SILVA,GEISA JESUS SANTOS,10/03/1992,tipo 5
3382,2211001,MARIA JACIRA DA ROCHA,JENIFFER NEVES CURCIO,05/05/1948,tipo 5
3399,4104907,MARILENE DA SILVA CESAR,MARIA LUIZA COUTINHO DA SILVA,27/02/1941,tipo 5
3413,4127304,VANIA SOUZA DA CRUZ,ATILA COSTA TAVARES,04/12/1936,tipo 5
3425,3301405,JOCELI PESSANHA PINTO,ADRIANO PAULO DA SILVA,03/01/1932,tipo 5
3441,3301702,TAIS MONIQUE DA SILVA,INGRID FERREIRA SIQUEIRA,24/01/1934,tipo 5
3459,3302403,TATIANA GONCALVES CONCEICAO,NERILANE VASQUES AMBROSIO,27/04/1982,tipo 5
3472,3303302,WAGNER COSTA FERREIRA,VANUSA NUNES PEREIRA ALVES,13/06/1946,tipo 5
3477,3303500,ANDRE LUIS GONZALEZ SOUZA,CLEUZA MARIA DA CONCEICAO,19/05/1955,tipo 5
3523,3303500,VILMA ALMEIDA DE OLIVEIRA,VANUSA MARIA DA SILVA,23/02/1943,tipo 5
3525,3303609,ISABEL CRISTINA SOUZA DE ASSIS,ELIANE TINDOR GOMES,28/08/1976,tipo 5
3530,3304102,JAILSON RANCAO DE SOUZA,CLAUDIO PAULO DA COSTA,28/03/1932,tipo 5
3534,3304300,JOAO BATISTA JUNIOR DE ANDRADE DOS SANTO,MICHELY DE LIMA SOARES,14/01/2022,tipo 5
3565,3304557,LEONARDO RODRIGUES TAVARES,IARA MARQUES DO NASCIMENTO,21/02/1974,tipo 5
3580,3304557,RITA DE CASSIA PESSANHA DO PATROCINIO,EUDMAR MARCOLINO DOS SANTOS,06/11/1955,tipo 5
3607,3304904,SIMONE DE MAGALHAES CRUZ,ALESSON MENDES DE SOUZA LIMA,09/08/2018,tipo 5
3610,3304904,VERA LUCIA RODRIGUES DA SILVA,MARA DALILA SOUZA SILVEIRA,24/07/1970,tipo 5
3631,2932903,ROSA MARIA FURTADO PEREIRA,DENOCIR LEONARDO,23/07/1952,tipo 5
3643,2401008,SAMUEL GOMES PINTO,EDVAN DOS SANTOS,05/09/2012,tipo 5
3649,2403301,PALOMA FERNANDES PESSOA,JOSINEIDE DA CRUZ PINTO,01/10/2001,tipo 5
3652,2404309,GIVANILDO DE SOUZA SILVA,JOSE CARLOS DOS SANTOS,20/07/1931,tipo 5
3653,2404309,MARIA EDIVANIA DA SILVA,LUIZ FERNANDO FRAGA MONTEIRO,14/02/1941,tipo 5
3656,2405801,JUSSIMEIRE SANTANA DA SILVA,MARILIA SANTANA DE JESUS,15/05/2008,tipo 5
3657,2406601,EDNA CRISLAYNE SILVA CRUZ,UBIRATAM DE SANTANA,27/11/1976,tipo 5
3667,2408102,CARLOS ALBERTO CASSIANO DE LIMA,ALAN DELON VAGNO BRITO MOREIRA,01/01/2014,tipo 5
3671,2408102,GERALDO DE OLIVEIRA SILVA FILHO,RAIMUNDO JOSE DE GOIS FILHO,14/08/1955,tipo 5
3673,2408102,IANA ROSEANE DO NASCIMENTO DA SILVA,JOSEFA FONTES ALVES,27/07/1958,tipo 5
3702,2408102,WILSON FELIX DA SILVA,CLAIR PEDRO LEITE,10/04/1938,tipo 5
3705,2610400,MARIA INEZ DE BARROS,JUVENAL ELIAS,09/11/1991,tipo 5
3716,2412005,LUCIENE MATIAS DA SILVA,EDUARDO PEREIRA DA SILVA,27/05/1934,tipo 5
3725,1100148,IVANIR MOREIRA,ZENAIDE BARBOSA GOMES,29/10/2007,tipo 5
3729,1400100,IANA KELLY GREGORIO GARCIA,EDILTON BRITO DA SILVA,23/03/1975,tipo 5
3731,1400100,MARIA APARECIDA LIMA DE SOUZA,MARIA PERPETUA DO CARMO,05/05/1963,tipo 5
3738,4314605,GILVANETE DUARTE DA SILVA,MARIA VITORIA DA CONCEICAO,01/10/1976,tipo 5
3739,4315701,ETELVINA MARIA SOUZA DOS SANTOS,JULIANA BORGES RAMOS,21/10/1971,tipo 5
3758,4209805,VANDERLEIA SAITZ SCHLOSSA,KELLYANE SANTOS ALVES PINTO,05/05/1958,tipo 5
3768,2701704,EDIELSON APARECIDO SANTOS,MARIA JOSE NASCIMENTO DE OLIVEIRA,12/03/1990,tipo 5
3769,2801306,GERALDO FERREIRA PASSOS SANTOS,SABRINA DE SOUSA OLIVEIRA,02/07/1948,tipo 5
3772,2801306,VALDILENE SANTOS SANTANA,VALERIA NAKONIECNI,18/08/1962,tipo 5
3784,2803500,MIRALDO XAVIER DOS SANTOS,ELAINE GALDINO DOS SANTOS VIEIRA,18/02/1995,tipo 5
3819,3506508,APARECIDO PECOSQUI,IRENE BALBINO DA SILVA MATHIAS,21/08/1950,tipo 5
3820,3508009,ELIZETE LAUREANO,ITALA ANGELO GOUVEIA,07/04/1990,tipo 5
3843,3513801,NAYALLE ROCHA DA SILVA,CYNTHIA REGIELE DE SIQUEIRA,31/03/1962,tipo 5
3850,3515707,GERALDO FERREIRA QUINTANS,ALDEMAR NICACIO DA SILVA,09/08/1957,tipo 5
3863,3518800,CLEUDO DE ALBUQUERQUE QUEIROZ,BIANCA MARIA DE LIMA,02/01/1944,tipo 5
3868,3518800,JOSE MAURICIO DOS SANTOS,CLEIDIJANE DOS SANTOS PINHEIRO,08/05/1982,tipo 5
3869,3518800,LAECIO SILVA MATOS,CREUSA DE ALMEIDA ANDRADE,30/11/1963,tipo 5
3871,3518800,MARIA APARECIDA RODRIGUES MARTINS SILVA,DANUBIA SOUZA LOPES,07/12/1932,tipo 5
3878,3519709,KATHLEEN MOREIRA FRANCISCO,ELZA JOANA DA SILVA,30/07/1952,tipo 5
3899,3534401,ED CARLOS FELIPE TEIXEIRA,JUPI FERRO,13/08/2022,tipo 5
3904,3534401,LUZINETE NERY DE OLIVEIRA SANTOS,MARCELO LUIS BRUSSOLO,04/11/2019,tipo 5
3920,3543402,BENEDITA DUARTE CARRIJO,MAURA RODRIGUES DE MOURA,12/12/1987,tipo 5
3929,3547809,MARISTELA CALLEGARI,OLGA ANDRADE DOS SANTOS MARTINS,23/06/2020,tipo 5
3934,3548054,JULIO CESAR TOPPAN,REGIANE KATIA PINHEIRO DE CARVALHO,14/01/1951,tipo 5
3954,3548708,LEONICE APARECIDA MARTINS DE SIQUEIRA,MICHELE REZENDE AGUIAR,18/02/2009,tipo 5
3969,3548708,ROSEMEIRE FERREIRA DA SILVA,KEROLAINE DOS SANTOS SOUZA,04/10/1938,tipo 5
3974,3548708,TERRENCE WILLIAM POGGENPOEL,FRANCIRLENE CONCEICAO DE OLIVEIRA,16/12/2020,tipo 5
3977,3549904,EDIVANDO APARECIDO SANTOS,ANDRESSA FERREIRA SILVA,06/07/1943,tipo 5
3978,3549904,EDSON PEDRO LIRA BARBOZA,JOSE GIVANILDO DA SILVA,05/08/1966,tipo 5
3987,3550308,ALESSANDRA OLIVEIRA DA SILVA,WESLAENE CASSIA ALVES DA SILVA,03/01/1978,tipo 5
4016,3550308,GERALDA BATISTA DE ALMEIDA AZEVEDO,AURILENE DOS SANTOS LIMA,30/07/1971,tipo 5
4021,3550308,GISLENE FERREIRA DE CARVALHO,FABIANA DOS SANTOS,19/08/1983,tipo 5
4031,3550308,JOSE CARLOS FERREIRA DOS SANTOS,TATIANA DA SILVA SOARES CORREIA,18/06/1941,tipo 5
4035,3550308,JOSEFINA DE OLIVEIRA,MARIA CICERA DE MELO LINS,07/09/2006,tipo 5
4049,3550308,MARCELO DOS SANTOS,MARIA JOSE MOURA DE OLIVEIRA,06/11/1939,tipo 5
4077,1705607,VALDIRENE TELES DE FRAGA,MARIA CICERA DOS SANTOS,23/05/1999,tipo 5
4118,2702405,LUCIENE BELARMINO DA SILVA,MAURA SORIANA SANTANA,19/01/2013,tipo 5
4130,2704005,ELISSANDRA GAMA DE JESUS,MARIA ERENICE DE SOUZA,02/04/1969,tipo 5
4156,2704906,EDINALDO SILVA DE LIMA,ROBERTO DOS SANTOS,21/04/2013,tipo 5
4157,2704500,GREICE KELY DA SILVA,TELMA DE ANDRADE DA SILVA,06/04/2018,tipo 5
4161,2705606,ELITA LEONEL DO NASCIMENTO,ADAILTON ILDEFONSO DE SOUZA,12/11/1941,tipo 5
4166,2408508,DAMIAO FERREIRA DA SILVA,JOSELIA BATISTA,07/03/1994,tipo 5
4182,2707602,JOSIMAR TEIXEIRA DA SILVA,IURI NUNES DE ARAUJO,14/09/1951,tipo 5
4190,2708600,DAVI RIBEIRO BARROS,ANDRE SOUZA SILVA,16/06/1987,tipo 5
4197,2709152,DIOGO HENRIQUE SILVA FRANCISCO,JARMINHA FERREIRA DA CRUZ,11/11/1985,tipo 5
4199,2709301,TEREZA DE MENEZES CORREIA,ANGELICA CORNELIO DOS SANTOS,25/02/1990,tipo 5
4200,2414902,CLAUDINEIDE PAULO DE ALMEIDA,DAMIAO CONCEICAO DE LIMA,07/12/1945,tipo 5
4203,2414902,MAURICIO FREITAS DA SILVA,RUBENS DOS SANTOS BARBOSA,01/10/1934,tipo 5
4229,1600303,RAFAELA COSTA DOS SANTOS,NATALIA VIEIRA BENEVIDES,29/12/1963,tipo 5
4234,2900207,FERNANDO GOMES DOS SANTOS DA SILVA,SINDOVAL SILVA SANTOS,22/11/1982,tipo 5
4240,2900405,GRIMALDO SILVA JACOB,ELAINE SILVA MACHADO,12/02/1978,tipo 5
4243,2901957,VANUZIA CRISTINA ANUNCIACAO DOS SANTOS,JOSE CARLOS GOMES DA SILVA,26/06/2018,tipo 5
4248,2903003,CARLOS ANDRE FIDELIS DE SOUSA,LUZIANNE CERQUEIRA REGO,26/04/1953,tipo 5
4259,2905602,RENILSON NONATO DA SILVA,MARIA BRANDINA DE JESUS,31/08/1994,tipo 5
4265,2905701,RAIMUNDO PEREIRA DOS SANTOS,LUCIMARI SANTANA DE JESUS,23/05/1964,tipo 5
4268,2906006,JOSE NILSON SOUZA DE JESUS,COSMERINDO VIANA COELHO,12/08/1930,tipo 5
4293,2907202,SIMONE DE ARAUJO AMORIM,DORACY TORQUATO DA SILVA,24/07/2013,tipo 5
4297,2907509,JAMISSON DE JESUS GOMES,MANOEL MESSIAS SANTOS QUADROS,16/09/2003,tipo 5
4345,2912103,ORLEAN NASCIMENTO ANDRADE DOS SANTOS,ROSALIA BATISTA DOS SANTOS,23/11/1930,tipo 5
4351,2913002,ELIETE DOS SANTOS MONTEIRO,CENIRA DOS SANTOS DOS SANTOS,14/02/2003,tipo 5
4353,2913309,ANTONIO JOSE MOTA,ADILSON BATISTA DOS SANTOS,09/09/1941,tipo 5
4387,2915403,KATIA CILENE ALVES DA SILVA,GILMAR DE OLIVEIRA COELHO,29/07/1947,tipo 5
4392,4111100,MARIA RAIMUNDA SANTOS SILVA,ARLINDA PEREIRA DE OLIVEIRA NUNES,26/02/2004,tipo 5
4393,2915809,PAULO WASHINGTON SANTOS BITTENCOURT,ANTONIO SOBRINHO DA NATIVIDADE,15/12/1936,tipo 5
4394,2915809,RENATO OLIVEIRA DA SILVA,GILENE DOS SANTOS SOUZA,01/06/1941,tipo 5
4417,2918407,FRANCISCO ANTONIO BATISTA,ROSIMEIRE DE JESUS SANTOS,16/11/1975,tipo 5
4427,2919108,MARIA DELIA RIBEIRO,IVONETE MARQUES GONCALVES,06/12/1941,tipo 5
4429,2919207,AILTON DE JESUS SANTOS,DALVA SOARES PEREIRA,16/08/2009,tipo 5
4438,2919603,ANDESON FELIPE DE CARVALHO,MARIA MARTA SILVA DOS SANTOS,21/04/1970,tipo 5
4445,2920205,EDVAR AMARO SANTANA,GIDEMARIO CARLOS DOS SANTOS,13/12/1936,tipo 5
4465,2923506,EDSON CONCEICAO DE LIMA,SILVIA DE FRANCA PEDRO,15/04/1994,tipo 5
4479,2925600,EDILEUZA BATISTA MACHADO,CRISTIANE FERREIRA DE AQUINO,26/09/1947,tipo 5
4493,2927002,MARIANGELA DOS SANTOS SANTANA,ANTONIO ELIARDO VIEIRA DE FARIAS,23/12/1981,tipo 5
4522,2929057,TATIANE RIBEIRO DA SILVA,SERGIO MAGNO SILVA DO NASCIMENTO,03/02/1948,tipo 5
4524,2929354,SIDINEI TEIXEIRA SOUZA,FABIANA CARLA DA CONCEICAO,24/06/2011,tipo 5
4533,2930808,ERIVANILDA DA CONCEICAO,ANA PAULA SOUZA DE LIMA,16/01/2018,tipo 5
4549,2931350,RITA SILVA GUERRA,EDUARDO MARQUES,26/06/2003,tipo 5
4569,2933000,ORLANDO SANTOS DE OLIVEIRA,FRANCISCO RIBEIRO DO NASCIMENTO,19/01/2010,tipo 5
4578,3556602,AILA MARIA DA SILVA SALES,JOSE AIRTON CARVALHO DA SILVA,13/05/2011,tipo 5
4579,4322707,ANDREIA FRANCIELE SALDANHA DALTRO,JOSE DOS SANTOS SILVA,07/12/2014,tipo 5
4582,4322707,ANGELA MARIA COSTA LARANJEIRA,JOSE VALDECIR DE SOUSA SILVA,23/12/1931,tipo 5
4585,4322707,MALU SUELEN DA SILVA,LIDIANA ARAUJO DA SILVA,30/12/2011,tipo 5
4607,2302107,ANTONIO GLEICIANO DA SILVA QUEIROZ,MARIA LARA DO NASCIMENTO PIRES,03/05/2005,tipo 5
4610,2302800,ERINALDO VASCONCELOS BARBOSA,MARIA NILZA COSTA DE SOUSA,09/09/1997,tipo 5
4612,4104808,FRANCISCA EDIVANIA DE AQUINO SALVIANO,MAYARA JESSYCA RABELO,07/06/1986,tipo 5
4614,2303501,FRANCISCO SERGIO QUEIROZ DA SILVA,NATIELE FREITAS DO NASCIMENTO,24/05/1928,tipo 5
4619,2303709,ISMAEL LOPES CORREIA,RAIMUNDO RIBEIRO SARAIVA,24/12/1944,tipo 5
4620,2303709,JOAO PAULO LIMA DO NASCIMENTO,RAQUEL DANTAS BEZERRA GASPAR,09/11/1932,tipo 5
4626,2304004,BENEDITA RESPLANDES TELES,SANDRA SILVA LOPES DE PAULO,24/08/1962,tipo 5
4644,2304400,ANTONIA SANDRA DA SILVA PAULINO,JOAO SARAIVA,21/01/1975,tipo 5
4648,2304400,CARLINY MOREIRA PONTES,ELENILTON TEIXEIRA DE SOUSA,20/05/1992,tipo 5
4649,2304400,CARLOS ANTONIO DA SILVA,ELISANGELA DE SOUSA ALMEIDA LOPES,13/10/2021,tipo 5
4650,2304400,CARMELITA CARDOSO DOS SANTOS,EURIAN OLIVEIRA DE FREITAS,20/09/1982,tipo 5
4670,2304400,IVANETE MARIA VIEIRA DOS SANTOS,FRANCISCO WELLINGTON AIRES NUNES,08/02/1972,tipo 5
4673,2304400,JOSE AMERICO GOMES DUARTE,MARIA DE FATIMA FEITOSA CAMPOS,11/06/1924,tipo 5
4681,2304400,LUIZA MARIA DA SILVA,MARIA IDEUSA DA SILVA,30/09/1940,tipo 5
4684,2304400,MARCIO ALEXANDRE ALVES COSTA,FRANCISCO NETO DE SANTANA,05/10/2010,tipo 5
4701,2304400,MARIANO DA COSTA E SOUSA,MATEUS NONATO DA SILVA,28/05/1973,tipo 5
4703,2304400,NATIELE FREITAS DO NASCIMENTO,DANIEL SOUZA RODRIGUES,16/11/1925,tipo 5
4707,2304400,RAQUEL CARLOS DE SOUSA,SAMUEL EMANUEL SILVA DE CARVALHO,15/05/1935,tipo 5
4712,2304400,SALUZA BRENA DOS SANTOS MATIAS,ANTONIO RODRIGUES DOS SANTOS,10/12/1926,tipo 5
4735,2306256,FRANCISCO JOSE MACIEL DE SOUSA,MARIA DO AMPARO DOS SANTOS PAES LANDIM,28/06/1942,tipo 5
4753,2307304,ANTONIO FRANCISCO ALEXANDRE,ELIANA ALVES FURLANI,11/01/1945,tipo 5
4767,2308401,NACHA RAQUEL MENDES NASCIMENTO,SIRLENE BARBOSA NEGRINI,23/09/1981,tipo 5
4772,2309508,ERIVALDO TEODOSIO DE LIMA,MARIA APARECIDA LOPES SANTOS,18/06/2003,tipo 5
4776,2309706,PAULO SERGIO SANTIAGO DA SILVA,MILVA MEIRA SALVADOR,21/10/1955,tipo 5
4793,2311355,FRANCISCO SANTANA RIBEIRO,IONARA DOS SANTOS SILVA,11/10/2015,tipo 5
4800,2311702,PATRICIA LOPES GOMES,RAFAELA COSMO DA SILVA,07/12/2021,tipo 5
4805,2312403,FRANCISCA JULIANA MOREIRA DUARTE,JESSIANE AROUCHA DO NASCIMENTO,10/12/1945,tipo 5
4807,2412005,IVANILDO ARAUJO DE MORAES,PRISCILLA MARTINS PEREIRA,26/12/2007,tipo 5
4813,2313203,MARIA DE NAZARE FARIAS DE SOUZA,MARIA VANILDA ROCHA NERES,15/05/2011,tipo 5
4825,5300108,DELMITA DIAS FERREIRA,MARIA ONILDE PEREIRA SILVA,20/07/1998,tipo 5
4827,5300108,EDUARDO REIS DOS SANTOS,MARLETE DA SILVA,12/05/1929,tipo 5
4828,5300108,ELOIZA MARIA DE CARVALHO,BENEILSON SILVA FERREIRA,14/01/1986,tipo 5
4832,5300108,LOIRRANE RIBEIRO TORRES,VALTER LUIS BRITO FERREIRA,14/07/1952,tipo 5
4833,5300108,LUCIENE BARBOSA BRITO,ELIANE DE JESUS COSTA,12/06/1964,tipo 5
4834,5300108,MARCOS ANTONIO ALEXANDRE DE SOUSA,WELSON ALVES DE LIMA,24/05/2002,tipo 5
4857,3203205,JAQUELINE BORGES DA SILVA,SILVANETE SOUSA TEIXEIRA,04/09/1932,tipo 5
4858,3203205,JOCIANA DA SILVA PEREIRA,EDNA MARIA VASCONCELOS DA SILVA E SILVA,23/12/1970,tipo 5
4879,5203302,MARCILENE RODRIGUES BARBOSA,EDILEUZA XAVIER DO NASCIMENTO,04/07/2021,tipo 5
4887,5212501,MARIA HELENA ALVES FERREIRA,MARIA ELIANA RODRIGUES,06/12/1985,tipo 5
4892,5218300,MARIA CHRISTINA SILVA DE OLIVEIRA,FRANCISCO ANDRADE CUTRIM,30/01/1962,tipo 5
4895,5218805,MARIA ANTONIA SENA DO NASCIMENTO,MARIA ANTONIA TEIXEIRA SILVA,07/12/2020,tipo 5
4910,2101608,DORIVANIA RIBEIRO DA SILVA,NATALIA GEIZA SILVA E SILVA,30/04/2000,tipo 5
4913,2102325,ALINE RAMOS PEREIRA,MARCILENE RODRIGUES DE LIMA,30/06/1960,tipo 5
4918,2102507,ROBERTO FERREIRA RIBEIRO,JOSE BRAULIO PINHEIRO DOMINICI,31/03/1943,tipo 5
4923,2103208,CLEUDILENE DE JESUS ALMEIDA,JOANE PEREIRA LIMA,18/08/1982,tipo 5
4928,2103208,RONALDO CONCEICAO DOS SANTOS,BRUNO RAFAEL MENDES DA SILVA MONTEIRO,08/01/2021,tipo 5
4933,2103703,ANA CLAUDETE BALDEZ,MARIA DA GLORIA MORAES,22/03/2012,tipo 5
4941,2105104,LUCIVALDO DIAS LIMA,SERGIO RICARDO DE SOUSA GOMES,17/06/1943,tipo 5
4956,2106904,ALDENILDES PINHEIRO FERREIRA,EDIMAR DE SA SANTOS,05/02/1999,tipo 5
4957,2106904,KELIANE BATISTA GARCIA,EDMILSON DA SILVA ARAUJO,23/11/2009,tipo 5
4975,2108256,MEIRINALVA DE JESUS LOBATO MARTINS,GILBERTO AIRES DE SA,04/02/2022,tipo 5
4988,2109304,JOAO BATISTA BRITO MESQUITA,HEVERSON ALEXANDRE ROCHA,15/01/1987,tipo 5
4993,2927903,JOSILENE BERNARDO GONCALVES,ANDRELIA CARDOSO DE OLIVEIRA,13/06/1928,tipo 5
5005,2111003,TERLINAURA CAMPOS SANTOS,KELY CRISTINA BERTOLDO LOPES,20/06/1984,tipo 5
5021,2111300,MARIA DO SOCORRO FELICIO DE ARAUJO,TEREZINHA ROSA QUEIROZ DOS SANTOS,06/08/1986,tipo 5
5022,2111300,MARIA JESUINA ALVES DO NASCIMENTO,VALDO DE OLIVEIRA GOMES,22/12/1997,tipo 5
5031,2111300,ROSANA SANTOS PINHEIRO,ANA LUCIA SOARES FERREIRA,24/07/2018,tipo 5
5038,2111706,TARCIS FONSECA,ROMARIO DE SOUZA,16/02/2020,tipo 5
5045,2111904,ZILDA PEREIRA DE ARAUJO,AGHATA NEUVA DA SILVA VIEIRA VASCONSELLO,20/12/1982,tipo 5
5055,2112209,MARIA IVONEIDE ALVES DE OLIVEIRA,TAILA DA SILVA VIANA,16/05/2014,tipo 5
5066,2112803,MARIA DA CONCEICAO BRAGA,AURENITA ALVES DE SOUZA,19/07/1988,tipo 5
5072,3100906,TIAGO DA CRUZ SANTOS,ALICE DE SOUZA MARIANO,01/04/1967,tipo 5
5075,3101607,FRANCISCA MESSIAS,CLEIDE PEREIRA LUIZ,06/11/1947,tipo 5
5079,3104205,BIANCA FERNANDA DOS SANTOS,CLEONICE ALVES CAMPOS,28/10/1985,tipo 5
5085,3106200,DANIELLE CASTILHO DE SOUZA SOARES,MARIA LUCIA DA SILVA,01/02/1991,tipo 5
5104,3106200,NELSON GOMES FERREIRA,VILMA DAS GRACAS ARAUJO,14/08/1983,tipo 5
5113,3106200,TIAGO DA COSTA ALECRIM,REGINA MARGARIDA MARTINS,14/10/1929,tipo 5
5117,3106705,JOAO CARLOS DA SILVA,MOACIR BATISTA GUSMAO,14/06/2020,tipo 5
5120,3102704,GIOVANI XAVIER,EVA APARECIDA PEREIRA,07/09/1954,tipo 5
5132,3118601,JOSE ALVES EMILIANO,JOSE AMILTON ALVES DA SILVA,02/06/1931,tipo 5
5157,3127388,RENATA CORREA DA CUNHA,MARIA FERNANDA GOMES DE OLIVEIRA,28/03/1931,tipo 5
5168,3134707,MARIA ZELIA FRANCA DE OLIVEIRA,ROBSON ROLIM DA COSTA DE SOUZA,11/11/1974,tipo 5
5172,3135407,ANDREIA GOMES PINTO,LUZIA FURTUOSO GOMES DA SILVA,04/07/2013,tipo 5
5173,3135605,MANOEL PEREIRA DOS SANTOS,VERONILDA JESUS CORDEIRO,29/01/2008,tipo 5
5176,3140001,MARCUS VINICIUS PEREIRA CAMPOS,GLAUCIA MARIA DE JESUS CASTRO MANCUSO,02/11/2014,tipo 5
5186,3148509,LEOCARDIA LEMES PRATES,ANA CLAUDIA SILVA DE SOUSA,02/01/1933,tipo 5
5220,3158201,MARIA APARECIDA DIAS,MARIA DO SOCORRO DE SOUZA ARAUJO,03/12/1998,tipo 5
5249,3170404,SILVANIA CORDEIRO PINTO,MANOEL CLAUDIO DE SOUZA GALVAO,12/10/2007,tipo 5
5252,3171204,JOSE ADRIANO GARCIA,MARIA DE FATIMA PANTOJA DE MELO,10/08/1949,tipo 5
5254,3171303,ELIETE LEONCIO DA ROCHA,JURLENE MARIA FREIRE DE OLIVEIRA,27/08/2019,tipo 5
5265,5006606,LUCIANA DA SILVA CABREIRA,DANIELI DUTRA CORREA ALMEIDA,18/12/2003,tipo 5
5269,5101605,BENEDITA GONCALVES DA SILVA,MARIA CELINA RODRIGUES LOBATO,02/06/1959,tipo 5
5277,5106158,LUANA LUZIA PONTES DOS SANTOS,DANIELE CASTRO SANTOS,01/09/1993,tipo 5
5283,5108402,ADEMIR MARTINS DA SILVA,MARTA FARIAS,16/01/2010,tipo 5
5286,1500107,ANTONIEL DA CUNHA QUARESMA,SANDRO DA SILVA SATIL,11/08/1951,tipo 5
5287,1500107,BRUCE WILLES FREITAS VILERMANO,MANOEL PEREIRA BORGES,03/05/1948,tipo 5
5300,1500503,ALICICLEIA TENORIO DE ALMEIDA,KATHLEEN PRISCILA SA CORREA,02/12/1983,tipo 5
5302,1500701,MACIRLENE MARINHO DA SILVA,RISONEIA LIMA DO AMARAL,08/04/1959,tipo 5
5314,2700805,ANGELA SOARES DA CONCEICAO,SEBASTIAO DA SILVA,11/03/1983,tipo 5
5325,2501906,LUCIMAR GONCALVES DE OLIVEIRA,ADRIANA ALVES DOS SANTOS,09/05/1932,tipo 5
5370,1504604,MARIA DE NAZARE CRUZ DIAS,CARLOS JOSE PEREIRA DA COSTA JUNIOR,20/04/1943,tipo 5
5376,1504703,MANOEL SOUZA MARTINS,GILMARA LUCIA DA SILVA CLEMENTINO,18/12/2019,tipo 5
5395,1507961,ANGELA MARIA COLARES DE SA,JOSE ROBERTO NOBERTO DA SILVA,29/11/1996,tipo 5
5398,1508001,MARILDA SOUTA GOMES,AILTON MARQUES DE MORAIS,02/10/1999,tipo 5
5399,1508001,PAULO SERGIO SOUZA SILVA,ELANE BARBOSA XAVIER,29/06/1926,tipo 5
5402,1508084,VANICIA RODRIGUES DE OLIVEIRA,COSME DIAS TEIXEIRA,06/10/1950,tipo 5
5426,2502805,JOSENE FERNANDES DUTRA FILHO,MARIA EXPEDITA DA SILVA,02/12/1991,tipo 5
5431,2503704,MARIA CLARA DA SILVA MOTA,RAQUEL FERREIRA GOMES LIMA,27/12/1971,tipo 5
5441,2504801,JOSE INOCENCIO DE MEDEIROS BARBOZA,ADEILSON RODRIGUES DE AMORIM,26/04/1978,tipo 5
5445,2505204,LUIS ANTONIO JUSTINO,CLAUDETE ARRUDA DA SILVA,06/04/1964,tipo 5
5448,2506103,JOSE ARNOR DO NASCIMENTO,FABIO JULIO DA SILVA,19/09/2012,tipo 5
5464,2507705,SAMARA MARIANNE BATISTA TRAJANO,LYGIA CONCEICAO SERGIO DOS SANTOS,24/07/1984,tipo 5
5466,2509008,LAILA GABRIELLY CORDEIRO DE MOURA,MARINALVA LEANDRO DA SILVA,03/07/1980,tipo 5
5473,1714880,JULIA SABINO DA SILVA,LUCAS GABRIEL PESSOA DA SILVA,04/09/1960,tipo 5
5478,2511202,ALINE FLAVIA DOS SANTOS DO NASCIMENTO,IVAN ANTONIO DE ALMEIDA,19/10/2002,tipo 5
5481,2511707,MARCICLEIDE DE MELO MARTINS,JOSE MARIO DA SILVA,16/09/1949,tipo 5
5494,2513901,WALDICELIA DINIZ DA SILVA,IOLANDA FERREIRA DA SILVA,19/09/1967,tipo 5
5503,2600203,LUANA DA SILVA OLIVEIRA,JOSE LEANDRO AMARO DA SILVA,04/10/1991,tipo 5
5550,2602308,DULCILENE MARIA DA SILVA CAVALCANTI,LEONARDO DELMIRO DA SILVA,24/04/1969,tipo 5
5557,2602605,MARCILIA MARIA SOUZA SILVA,LUCAS LEANDRODA CUNHA FARIAS,23/04/1943,tipo 5
5559,2602803,DAMIANA FIRMINO DE MELO,AILA MARIA RODRIGUES OLIVEIRA,26/07/1947,tipo 5
5560,2602803,ROSANA BESERRA DA SILVA,IRANEIDE SOBREIRA DE LIMA NETO,29/06/1961,tipo 5
5562,2602803,VITORIA EDUARDA VIEIRA XAVIER,ADRIANA ALEXANDRE DA SILVA,25/12/2011,tipo 5
5570,1703826,ADRIANA APARECIDA ALVES DE OLIVEIRA,FERNANDA DOS SANTOS FERREIRA,30/09/1974,tipo 5
5572,2603207,JOSE JOAQUIM DA SILVA NETO,ISADORA BARROS DA SILVA,01/08/2017,tipo 5
5579,2604106,MARIA LARISSA DA SILVA,NICIENE VICENTE ALVES,19/04/1956,tipo 5
5595,2605806,LUIZ FERREIRA DE MELO,THIAGO SILVA COSTA,04/02/1942,tipo 5
5600,2605905,EDVANIA MARIA DA SILVA,PEDRO GONZAGA DA SILVA,15/03/2020,tipo 5
5609,3127388,AILTON FELIPE NERI,DJANIRA MARIA DOS SANTOS,26/05/2021,tipo 5
5610,2606200,ALDILENE SANTOS DA SILVA,MAURILIO DA SILVA BARBOZA,07/08/2010,tipo 5
5640,2607901,EZIEL VENANCIO DOS REIS,DALIAM PINHEIRO NERES LOUZEIRO,22/03/1946,tipo 5
5655,2608800,SIMONE MARIA DA SILVA SANTOS,ALDAIAS DA SILVA LIMA,03/05/1983,tipo 5
5670,2610004,WANDERSON JOSE DA SILVA,MAIRA CRISTINA PEREIRA DOS SANTOS,02/03/1943,tipo 5
5680,2510907,LUCIVANDO SILVA FELIX DE FIGUEREDO,JOSE WILTON PEREIRA ALVES,14/01/1969,tipo 5
5682,2510907,LUIZ FERNANDO ALVES DE ALBUQUERQUE,MARIA DO SOCORRO DA CONCEICAO SILVA,29/07/1997,tipo 5
5684,2610806,JOSE EDIVAN ARAUJO DOS SANTOS,WILIO DOS SANTOS SOUSA,24/04/1934,tipo 5
5690,2611507,AFONSO SIQUEIRA DA SILVA,FRANCINER RIBEIRO LIMA,05/11/1940,tipo 5
5698,2611606,JERLANE MAYARA DE OLIVEIRA,ROSALINA MARIA DO NASCIMENTO,21/06/1925,tipo 5
5699,2611606,JULIA GABRIELA GERALDO DE SENA,ROSILENE FERREIRA OLIVEIRA,12/10/1970,tipo 5
5700,2611606,KAROLINA DA SILVA MILIANO,RUBENY DA CRUZ CARDOSO,20/08/1937,tipo 5
5705,2611606,RITA MARIA DE MELO RICARTE,FRANCISCO BRAZ DE SOUSA,30/06/1927,tipo 5
5706,2611606,ROZEANE FERREIRA SALES,FERNANDO VASCONCELOS CRUZ,02/07/1934,tipo 5
5711,2612505,MARIA HELENILDA DA CONCEICAO,ERENILDA DIAS DE JESUS,14/12/1990,tipo 5
5721,2111706,JOSENILDO FERREIRA DA SILVA,MAYARA ALENCAR OLIVEIRA,15/09/1988,tipo 5
5724,2614006,DAMIAO GONZAGA PROFIRIO,DANIELE ALVES DE SOUSA,05/09/1960,tipo 5
5730,2614709,ELIANO JOSE DA SILVA,RODRIGO ELIAS SILVA,27/05/2013,tipo 5
5731,2615102,JOSE FRANCO CORREIA DA SILVA,MIGUEL PEREIRA DOS SANTOS,20/02/1954,tipo 5
5735,2615607,ANA MARIA DO NASCIMENTO,VALERIA DO PRADO FERREIRA,20/12/1999,tipo 5
5772,2203909,ADELAIDE MARIA GOMES DE OLIVEIRA,ALESSANDRA DE ARAUJO,30/06/1974,tipo 5
5778,2205250,FRANCISCO DE ASSIS FERREIRA E SILVA,ELIANA CLAUDIA LEAL CARMELINO,24/12/1941,tipo 5
5782,2205516,SUELI MARIA ALVES MELO,NEILDO NUNES DE FREITAS,04/11/1986,tipo 5
5798,2208205,JOAO FRANCISCO DO NASCIMENTO,MARIZE LIMA JACINTO,10/08/1936,tipo 5
5818,2211001,BARBIANE SANTOS DA SILVA,DANIEL MARQUES ELOY,07/03/1955,tipo 5
5847,3201001,JOZIANE APARECIDA LIMA,MARINALVA SILVA DA COSTA,03/05/1995,tipo 5
5861,4113734,OLINDA SOARES,TATIANA DE OLIVEIRA LINO,17/05/1998,tipo 5
5882,3169109,ANTONIA DEAMORIM LIRA,CARLOS ALBERTO DA SILVA,27/02/1983,tipo 5
5885,4128500,JESSICA ALEXA DE ALMEIDA,CATIA CRISTINA OLIVEIRA DA SILVA,01/09/1988,tipo 5
5901,3301702,MARIA DE FATIMA DOS SANTOS,GILMAR DE PAIVA,10/12/1941,tipo 5
5906,3301702,ROBSON MARQUES DA SILVA,JOSE CRISTIANO DOS REIS,12/08/2005,tipo 5
5919,3302007,KLEBERSON EDUARDO DA CONCEICAO ELEOTERIO,NELI TAVARES DE JESUS,07/04/2000,tipo 5
5925,3302270,TEREZINHA BRAGA,RENIVAN DA SILVA ARAUJO,27/10/1975,tipo 5
5926,3302270,THAMIRIS DOS SANTOS TORQUATO ROCHA SANTO,ROSANA DOS SANTOS SERRANO,09/10/1940,tipo 5
5938,3302502,IRANILDA MONTEIRO FAILACE,TEREZINHA DE FATIMA GOMES,23/10/2019,tipo 5
5940,3302700,FERNANDA MANHAES RODRIGUES,VINICIUS FERNANDES DE SOUZA DA SILVA,05/11/1978,tipo 5
5953,3303302,ZENILDA RODRIGUES DA SILVA,ANDRE LUIZ NUNES DA SILVA,06/04/1992,tipo 5
5959,3303500,ARNOLD DA SILVA COSTA,CLAUDIA LUCIA MONTEIRO,16/10/1968,tipo 5
5963,3303500,CINTIA COELHO FREIRE,WALTER DOS SANTOS,02/07/1990,tipo 5
5986,3303500,LAZARO TEIXEIRA DA CUNHA,MARIA DAS GRACAS DA SILVA,10/08/1927,tipo 5
6002,3303500,ROBERTO CARLOS CONTANTINO GONCALVES,LEONARDO DAVID DE LIMA,20/12/1972,tipo 5
6007,3303500,SAIONARA DOS SANTOS GONCALVES,JUCELIA PONTES DE SOUZA,04/08/1939,tipo 5
6019,3303708,MARIA ENI DOS PASSOS,ASSUNCAO MARIA DA SILVA,17/01/1968,tipo 5
6020,3303906,BRUNO DOS SANTOS GOMES,BRUNO FONTES HORACIO DE LIMA,14/07/2000,tipo 5
6026,3304300,MARCIO ALEXANDRE MULLIM DOS SANTOS,FABIANA FELIX DE LIMA,11/12/1978,tipo 5
6037,3304557,ANA PAULA SAMUEL DA SILVA,JOSE ERIVAN FERREIRA,20/02/1997,tipo 5
6041,3304557,CARLOS HENRIQUE SOUSA DA SILVA,LUIZIANE ISABELE MENEZES BENICIO,26/11/1969,tipo 5
6061,3304557,GRASIELE MACHADO DO AMARAL,FRANCISCO DE ASSIS BARACHO,31/01/1942,tipo 5
6064,3304557,JANAINA MARIA GONDIM PEREIRA DA SILVA,JOSE ADRIANO SILVANO DE OLIVEIRA,23/06/1968,tipo 5
6077,3304557,LORENA MOREIRA DA SILVA,ANTONIO JOSE DA SILVA,27/04/1956,tipo 5
6101,3304557,SUELI TRIGUEIRO DA SILVA,LIZETE RORAIMA DA COSTA PADILHA,26/02/1983,tipo 5
