ID,COD_MUNICIPIO,NOME,NOME_RESPONSAVEL,data_nasc,Tipo_erro
15394,1200401,EVANETE BARROS ARAUJO,GILBERTO VICENTE DA SILVA,10/02/1951,tipo 3
15400,5107206,EVELI SILVA DOS SANTOS,GILIANE NASCIMENTO LOPES,14/12/1981,tipo 3
15414,1200401,FABIANA DUARTE CORREA,GISLEANE CARDOSO BARROSO,13/03/2014,tipo 3
15424,5107206,FABIOLA DE SOUSA DA SILVA,GLECE SANTOS GARCIA,26/07/1929,tipo 3
15429,5107206,FABRICIA DE SOUSA SILVA,GLEICIANE DA SILVA SOUSA,20/04/1939,tipo 3
15436,5107206,FATIMA LIMA MARIANO,GLECIANE TEODORO DE MACEDO,12/05/1971,tipo 3
15444,1200401,FERNANDA DA SILVA NASCIMENTO,GLEYCIANE ARAUJO SOARES,21/04/1989,tipo 3
15462,1200401,FLAVIA ROLDES DE SOUSA,GUILHERME DANTAS SAAD,31/05/1952,tipo 3
15465,5107206,FRANCIANE APARECIDA DE OLIVERA PAIVA,GUILMA LACERDA LIMA,09/07/1929,tipo 3
15468,5107206,FRANCICLE AMARO BONIFACIO,GUSTAVO NASCIMENTO SALES,29/09/1949,tipo 3
15470,1200401,FRANCIELE BESERRA DA SILVA APURINA,HANYELLE ANDRAMAGALHAES,25/09/1980,tipo 3
15491,5107206,FRANCILENE RODRIGUES RIBERO,HIGO BATISTA DE OLIVERA,08/07/1962,tipo 3
15509,5107206,FRANCINEUMA DA SILVA LIMA ROCHA,INARA HOLANDA BRAGA,27/08/1960,tipo 3
15527,5107206,FRANCISCA BENEDITA PEREIRA DE SOUSA,IRANEDE DA SILVA BARRETO,13/04/2020,tipo 3
15530,1200401,FRANCISCA CLAUCILEDE DE LIMA DA SILVA,IRIS CELIA SALES CASTRO,27/02/1937,tipo 3
15537,1200401,FRANCISCA DA SILVA XAVIER,ISABEL CRISTINA DA SILVA,10/11/1941,tipo 3
15540,5107206,FRANCISCA DAS CHAGAS SILVA DE SOUSA,ISABELE MARIA DOS SANTOS JANUARIO,28/12/2020,tipo 3
15550,1200401,FRANCISCA ELIANA MONTEFUSCO DE AÇIS,ISMAEL DOS SANTOS OLIVERA,27/12/1964,tipo 3
15568,1200401,FRANCISCA JORDAO DA SILVA OLIVERA,IVANILDE SOUSA DA SILVA,14/02/2011,tipo 3
15595,5107206,FRANCISCA REGINA DE FRETAS MELO,JACQUELINE DA SILVA SOUSA,11/04/1971,tipo 3
15596,5107206,FRANCISCA REJANE RICARDO DA SILVA,JACQUELINE DE LIMA FERRERA,21/07/1987,tipo 3
15597,5107206,FRANCISCA RENATA ALMEDA LETE,JACQUELINE SANTOS CARVALHO,25/05/1956,tipo 3
15618,5107206,FRANCISCO AMORIM DA SILVA FILHO,JAMARA PLICILA CHAVES DA SILVA,06/10/1927,tipo 3
15622,5107206,FRANCISCO COSTA DA SILVA,JAMILA OLIVERA SILVA,22/01/1995,tipo 3
15627,1200401,FRANCISCO DAS CHAGAS MARTINS DA COSTA,JAMILLE DA COSTA QUEIROS,10/12/1972,tipo 3
15633,1200401,FRANCISCO DE AÇIS SILVA,JANAINA FERRERA MARTINS,01/11/1967,tipo 3
15634,1200401,FRANCISCO DE OLIVERA LIRA,JANNAINA MARTIN DA SILVA,17/02/2015,tipo 3
15640,1200401,FRANCISCO FEITOSA DE SOUSA,JANNAINA SILVA DE ABREU,20/04/1940,tipo 3
15651,5107206,FRANCISCO ONELIO DE SOUSA DANTAS,JANEFA DE BRITO SALES,14/02/1953,tipo 3
15653,1200401,FRANCISCO RODRIGUES CAVALCANTE,JANETE GOMES DA SILVA,03/04/1975,tipo 3
15657,5107206,FRANCISMARIA DA SILVA LOPES,JANINA DE OLIVEIRA SOUSA LIMA,10/12/2020,tipo 3
15664,5107206,GABRIEL DA SILVA MATOS,JAQUELENE SILVA PERES,10/09/1995,tipo 3
15667,5107206,GABRIELA CRISTINA BATISTA AQUINO,JAQUELINE DA SILVA BARBOSA,28/06/1955,tipo 3
15672,5107206,GABRIELE ALVES LIBERATO,JAQUEÇANDRA DA SILVA VIRGINO,23/02/1967,tipo 3
15734,5107206,GILSIENE SILVA DE SOUSA,JOAO BATISTA DA SILVA NETO,09/01/1947,tipo 3
15752,5107206,GLECIANE DA COSTA SILVA,JOEL PINHERO NASCIMENTO,11/10/1945,tipo 3
15753,1200401,GLECE DE FRETAS AMARAL,JOELMA DE OLIVERA CAMPOS,20/11/2005,tipo 3
15773,1200401,GLEYCIANE DE SOUSA PEREIRA,JOINGRID DE ALMEDA SILVA OLIVERA,23/07/1956,tipo 3
15783,5107206,GRECIANE SILVA DE OLIVERA,JORGENE ESTEVES DE LIMA,07/02/1926,tipo 3
15800,1200401,HELANE CRISTINA QUEIROS DA SILVA,JOSE FRANCISCO SALES DE OLIVERA,06/06/1973,tipo 3
15815,1200401,HOSANNA LUCENA DA SILVA,JOSE NUNES LOPES,28/10/2006,tipo 3
15820,5107206,IANE VERAS ANDRADE,JOSE ROBERTO NASCIMENTO DE LIMA OLIVERA,30/04/1927,tipo 3
15843,1200401,IONETE DA SILVA LIMA,JOSIANE SOARES LIMA,23/03/2004,tipo 3
15861,1200401,ISABEL THAIS SOUSA LIMA,JOYCIANE CONEGUNDES TORES,06/12/1963,tipo 3
15866,5107206,ISABELLE VIANNA LIMA,JUCICLEDE GUEDES DE LIMA,09/05/2009,tipo 3
15885,1200401,IVANICE GOMES DA ROCHA,JULIANA DE OLIVERA MELO,26/11/1987,tipo 3
15889,1200401,IVANILDO TERTULINO MONTERO,JULIANA CAROLINE REIS DE OLIVEIRA,26/03/1955,tipo 3
15891,5107206,IVETE DA SILVA ALMEDA,JULIANA PIO DA CONCECAO,11/11/1975,tipo 3
15898,5107206,IVONETE SAMPAIO ARAUJO,JUSCICLEA PERERA DO NASCIMENTO,23/02/1978,tipo 3
15906,1200401,JACIARA SOUSA DE SOUSA,JUÇARA DA SILVA ALENCAR,02/03/1944,tipo 3
15929,1200401,JACELINE SILVA E SILVA,CARINE ANDRADE DA COSTA,21/04/2018,tipo 3
15932,5107206,JAMAIRA SILVA MELO,CARINE HITLLE DA SILVA,10/08/2007,tipo 3
15935,5107206,JAMES PERERA RODRIGUES,KARINE SANTOS DE SOUSA,16/07/2020,tipo 3
15943,5107206,JAMILY FERRERA RIBERO,CAROLINE VITORIA SANTIAGO COSTA,07/05/1926,tipo 3
15951,1200401,JANNAIRA FLEURY CORREA,CATIA SANAIRA PINTO DA SILVA SANTOS,09/06/1925,tipo 3
15958,5107206,JANAYRA CRISTINA DE SOUSA MATOS,CATIELLE GOMES DA SILVA,07/02/1974,tipo 3
15963,1200401,JANETE DE JESUS SOUSA,CATRINE SOARES SILVA,25/05/2013,tipo 3
15967,1200401,JANETE FONTENELE DE SOUSA,CATRINY VIEIRA DE LIMA,01/05/1979,tipo 3
15968,5107206,JANETE NONATA PINTO,CATTHERINE LIMA DE AQUINO,06/12/1970,tipo 3
15971,5107206,JANILDA VENANCIO DA SILVA,CEGINA DA SILVA JAIME,23/09/1973,tipo 3
15982,1200401,JAQUELINE DA SILVA GALVAO,CELLEN SAARA FERREIRA VIDAL,30/06/2003,tipo 3
15986,5107206,JAQUELINE GOMES DO NASCIMENTO ANDRADE,CELLY DOS ANJOS RODRIGUES,03/05/2007,tipo 3
15988,5107206,JAQUELINE LOPES AMORIM,CELLY MARIA OLIVEIRA DA SILVA,03/01/1978,tipo 3
15998,1200401,JARDEL DA SILVA FRANCA,CEROLAINE LIMA DA SILVA,18/03/2010,tipo 3
16000,5107206,JARDELINA FERNADES BARBOSA CAXINAWA,CEROLEN MAYANE BARROS DA SILVA,11/01/1954,tipo 3
16006,5107206,JARLIANE DA SILVA TEXERA,CETLEN MANHUARI ALVES DOS SANTOS,05/08/1925,tipo 3
16007,5107206,JARLIANE RODRIGUES PAIVA,KETLEN SOUSA CABRAL,25/12/1961,tipo 3
16014,1200401,JEFFERSON DE ARAUJO FRETAS,KESIA LEITE GOMES,03/06/1934,tipo 3
16019,1200401,JENEVANE MATIAS CARNERO,LADI DIANI SILVA DA SILVA,18/05/2015,tipo 3
16025,5107206,JEÇE BRANDAO DA ROCHA,LARICE SANTOS DO NASCIMENTO,28/07/1999,tipo 3
16055,5107206,JOAO BATISTA MACHADO DA SILVA,LEDE CARNERO DE OLIVERA,22/10/2013,tipo 3
16084,1200401,JOICIENE SANTOS DA CUNHA,LEY DA SILVA NOGUERA,22/08/1940,tipo 3
16097,1200401,JORGEAN MONTERO DANTAS,LIDIANE BARBOSA PERERA,28/12/1963,tipo 3
16106,1200401,JOSE BARBOSA DE ANDRADE,LILIA ROCHA DOS SANTOS,23/06/1949,tipo 3
16108,1200401,JOSE CARLOS DA SILVA GOMES,LILIAN OLIVERA DO NASCIMENTO RODRIGUES,29/09/1928,tipo 3
16115,1200401,JOSE DE SOUSA CAVALCANTE,LINDALVA JESUS MOURA,23/08/1950,tipo 3
16128,1200401,JOSE GOMES DE QUEIROS,LUANNA ALBUQUERQUE GOMES,22/11/2010,tipo 3
16135,5107206,JOSE NUNES LOPES,LUANNA DA SILVA SEVERIANO,18/02/1928,tipo 3
16147,1200401,JOSE VALDENIR BESERRA MACHADO,LUCAS DE SOUSA DINIS,26/10/1937,tipo 3
16155,5107206,JOSENEIDE DE SOUSA GOMES,LUCELIA FRETAS DA CUNHA,23/08/1932,tipo 3
16157,1200401,JOSENILSON DE OLIVERA NOBRE,LUCELIA VIERA DA SILVA,01/11/2005,tipo 3
16192,5107206,JULIA DA SILVA FERRERA,LUCIENE QUEIROS DA CUNHA,14/02/1960,tipo 3
16194,5107206,JULIA SELADA MOLINA OLIVEIRA,LUCILEA RODRIGUES SOARES,03/05/1961,tipo 3
16198,5107206,JULIANNA DA COSTA GOMES,LUCILENE PRESTES MONTERO,06/07/2019,tipo 3
16214,5107206,JUNIOR MATOS DA SILVA,LUDIANA PINHERO DA ROCHA,09/05/1975,tipo 3
16218,1200401,JUVENAL PERERA FETOSA JUNIOR,LUIS FERNANDO MAIA TEODORO,22/06/2000,tipo 3
16233,1200401,CARINA CARVALHO SOARES,LUSIANE LIMA DO NASCIMENTO,11/02/2015,tipo 3
16241,5107206,CAROLAINE FERREIRA CUNHA DO VALE,LUSIVAN DE AGUIAR SILVA,07/01/1969,tipo 3
16246,1200401,CATIA CILENE VITORIA DA SILVA,MADALENA CARVALHO DO NASCIMENTO,18/05/1954,tipo 3
16254,1200401,KATIELE SOUSA DOS SANTOS,MAILA DOS SANTOS DE OLIVERA,13/10/1958,tipo 3
16257,1200401,KATILENE NOGUEIRA DA PAS,MAINARA GOMES FIGUEREDO,07/02/1941,tipo 3
16259,5107206,KATIUSI PEREIRA DOS SANTOS CRUS,MAIRA MONTERO DUARTE,22/05/2022,tipo 3
16275,1200401,KEILA DE AÇIS DANTAS,MANOEL FRANCISCO FURTADO SOUSA,14/05/2007,tipo 3
16278,1200401,CELE TEIXEIRA DA SILVA,MANOEL LIMA DA SILVA,25/02/1980,tipo 3
16279,1200401,CELEN SIMPLICIO DA SILVA,MANOEL RIBEIRO PEÇOA,29/04/1944,tipo 3
16286,5107206,KELLY DE LIMA FERREIRA SOUSA,MARCELA ALMEDA DE OLIVERA,26/10/1996,tipo 3
16303,5107206,CETILEEN LIMA ROCHA,MARCIA ALEÇANDRA DA SILVA OLIVEIRA ARAU,19/03/1981,tipo 3
16305,5107206,CETLY CAMILLE ARAUJO GOMES,MARCIA BANDERA DE SOUSA,04/12/1996,tipo 3
16312,5107206,CLECIANE GABRIELE DA SILVA,MARCIA DA SILVA SANTOS,19/01/1995,tipo 3
16318,1200401,LAIANE DUTRA DA SILVA FELIX,MARCIA LIMA PERERA,10/10/1944,tipo 3
16328,1200401,LAUANDA MOTA SALES,MARCILENE DE SOUSA LIRA,02/12/1994,tipo 3
16351,5107206,LEDIANA DE LIMA BRAGA,MARIA ALCINETE LUCAS DA SILVA,13/08/2003,tipo 3
16353,1200401,LEDIANE BARROSO DE FRETAS,MARIA ALCIONE SILVA DA COSTA,11/01/1933,tipo 3
16365,5107206,LELA CRISTINA DANTAS LOPES,MARIA ANTONIA ALVES DA ROCHA,14/02/1927,tipo 3
16367,1200401,LELA MARIA DA CONCECAO SILVA,MARIA ANTONIA BARROSO DE SOUSA,22/12/1961,tipo 3
16379,5107206,LEONARA BARBOSA PAIVA,MARIA ANTONIA JOVENCIO AQUINO,29/04/1991,tipo 3
16380,5107206,LEONARDO FRASAO PEDROSA,MARIA ANTONIA LIMA MOURA,30/03/1982,tipo 3
16388,1200401,LETICIA DE OLIVEIRA SOUSA,MARIA ANTONIA SINSINO DOS SANTOS,24/05/1953,tipo 3
16394,5107206,LEUDIANE MARTINS CARVALHO,MARIA APARECIDA CARNERO DA SILVA,09/11/1949,tipo 3
16403,1200401,LIDIANE DA SILVA SOUSA,MARIA ARAUJO DE FRETAS,22/02/1957,tipo 3
16405,5107206,LIDIANE GONCALVES FERRERA,MARIA AUCINEIDE CAMURCA DE SOUSA,02/08/1984,tipo 3
16411,5107206,LILIANE GOMES DA SILVA,MARIA AUXILIADORA SILVA FORTUOSO,02/08/2021,tipo 3
16413,1200401,LILIANE VIERA DE MATOS,MARIA BEATRIS CAVALCANTE CAMPOS,29/03/1977,tipo 3
16415,5107206,LINDALVA PEREIRA DE SOUSA,MARIA BEATRIS OLIVEIRA DO ESPIRITO SANTO,29/06/2017,tipo 3
16417,1200401,LINDOMAR DANTAS LEONEL,MARIA BENILSA FERNANDES,11/02/2003,tipo 3
16429,1200401,LOURRANNA DA SILVA LIMA,MARIA CHIRLEY RODRIGUES ALBUQUERQUE,18/06/1977,tipo 3
16430,5107206,LUANNA ALVES DOS SANTOS,MARIA CLECILENE DE OLIVERA DUARTE,16/03/1983,tipo 3
16431,1200401,LUANNA AMORIM DE ARAUJO,MARIA CLEMILDA DA SILVA,30/05/1965,tipo 3
16434,1200401,LUANA CRISTINA FELIX DE SOUSA,MARIA CLEUDES COSTA DE OLIVERA,30/03/1958,tipo 3
16438,1200401,LUANA DA SILVA FEITOSA,MARIA CRISTINA COSTA DA SILVA,26/06/1934,tipo 3
16454,5107206,LUCAS PADILHA BEARARI,MARIA DA CONCEICAO MENDES SOUSA,13/07/1993,tipo 3
16459,1200401,LUCIA CAVALCANTE ARAUJO,MARIA DA CONCECAO SILVA RIBERO,22/03/1927,tipo 3
16461,5107206,LUCIA VITORIA GOMES LIMA,MARIA DA CONCEICAO SOUSA DA ROCHA,24/05/2018,tipo 3
16462,5107206,LUCIANNA ALVES MAGALHAES,MARIA DA CONCEICAO SOUSA DE LIMA,23/07/1958,tipo 3
16467,1200401,LUCIANA BRAS DA SILVA,MARIA DA LIBERDAARRUDA MAIA,12/06/1966,tipo 3
16470,1200401,LUCIANNA DA CUNHA AFONSO,MARIA DA LIBERDASOUSA BARROS,07/10/1977,tipo 3
16492,5107206,LUCIENE HENRIQUE DOS SANTOS,MARIA DAS GRACAS BRAGA DA COSTA,12/01/2008,tipo 3
16493,5107206,LUCIENE MARIANO DA COSTA,MARIA DAS GRACAS CASIMIRO,16/10/1985,tipo 3
16495,1200401,LUCIENE VIERA DE LIMA,MARIA DAS GRACAS DA COSTA CAVALCANTE,08/11/1965,tipo 3
16497,1200401,LUCIETE FERRERA DOS SANTOS,MARIA DAS GRACAS DE SOUSA AMANCIO,31/12/1932,tipo 3
16516,5107206,LUCIVANIA SOUSA TAUMATURGO,MARIA FATIMA NUNES DOS SANTOS,23/02/1965,tipo 3
16520,1200401,LUDIMILA MENDES SANTOS,MARIA JESUS CARVALHO DA SILVA,19/12/1964,tipo 3
16536,5107206,LUSANIR MARIA FALCAO DE FREITAS FEITOSA,MARIA DE LOURDES CRUS PINHEIRO,06/01/2005,tipo 3
16537,1200401,LUSANIRA DA ROCHA OLIVEIRA,MARIA DE LOURDES LIMA DE OLIVERA,19/03/1930,tipo 3
16545,5107206,LUSIA PEREIRA DA SILVA,MARIA DE NASARE DA SILVA OLIVEIRA,27/05/1978,tipo 3
16553,1200401,LUSIVANIA PAIXAO DOS SANTOS,MARIA DE NASARE SANTOS E SANTOS,22/07/2000,tipo 3
16554,5107206,LYANDRA GEOVANNA VASCONCELOS ANDRADE,MARIA DE NASARE SILVA ARAUJO DE SOUSA,30/10/1986,tipo 3
16556,1200401,LYLYAN ROCHA ARAUJO,MARIA SOUSA BERNARDO,14/03/2000,tipo 3
16577,1200401,MANILSA SANTOS DA SILVA,MARIA DO SOCORO LIMA,26/11/1975,tipo 3
16585,5107206,MANOEL DE JESUS DA CONCECAO,MARIA DOS ANJOS LIMA,06/02/1930,tipo 3
16595,5107206,MANOELA DA SILVA TEXERA,MARIA EDUARDA ANDRADE NOGUERA,20/03/1957,tipo 3
16599,5107206,MARCELA VASCONCELOS ALVES,MARIA EFIGENIA DA SILVA,03/06/2003,tipo 3
16621,1200401,MARCIA GOMES DO NASCIMENTO,MARIA EULALIA DOS SANTOS COSTA,01/04/2003,tipo 3
16643,1200401,MARIA ALBERTA PERERA DA SILVA,MARIA FRANCISCA CONCECAO DE OLIVERA,25/03/1952,tipo 3
16653,5107206,MARIA AMELIA FERRERA DA SILVA,MARIA FRANCISCA SOUSA DA SILVA,19/06/1973,tipo 3
16664,1200401,MARIA ANTONIA DA COSTA FRETAS,MARIA GIRLANBARROSO FELIX,03/05/1950,tipo 3
16678,1200401,MARIA ANTONIA GOMES LIMA,MARIA INES ARAUJO DOS SANTOS,25/08/1954,tipo 3
16681,1200401,MARIA ANTONIA MARCELINA DA SILVA,MARIA ITAMAR DOURADO DE OLIVERA,27/04/1959,tipo 3
16695,5107206,MARIA ANTONIA VIERA RODRIGUES,MARIA JOSE BESERRA LIBERALINO,18/05/1982,tipo 3
16699,5107206,MARIA APARECIDA DA CRUS SANTOS,MARIA JOSE DA SILVA LIMA,31/08/1954,tipo 3
16707,5107206,MARIA APARECIDA NASCIMENTO DA SILVA,MARIA JOSE FERRERA DE ANDRADE,25/09/1969,tipo 3
16714,5107206,MARIA AURELIA OLIVERA BARBOSA,MARIA JOSE OLIVERA MERA,19/07/1970,tipo 3
16719,1200401,MARIA AUXILIADORA DA LIMA BESERRA,MARIA JOSE SOARES DA SILVA,24/06/1960,tipo 3
16726,1200401,MARIA BRANDINA LOPES NOGUERA,MARIA JUCILENE PIRES DA SILVA,09/06/1960,tipo 3
16731,1200401,MARIA CAROLINA AGUIAR,MARIA CATIUSCIA NASCIMENTO DE MORAIS,18/11/2018,tipo 3
16742,1200401,MARIA CLAUDINEDE DE ANDRADE SOUSA,MARIA LIBERDACALIXTA DA SILVA,11/03/2008,tipo 3
16749,1200401,MARIA CONCECAO DE LIMA AGUIAR,MARIA LUCENY DE SOUSA GUERREIRO,20/11/1932,tipo 3
16759,1200401,MARIA DA CONCECAO DA SILVA VENANCIO,MARIA LUCIELHA DOS SANTOS VIERA DA SILV,14/03/1943,tipo 3
16769,5107206,MARIA DA CONCEICAO SOUSA DA ROCHA,MARIA LUSANETE DA SILVA ABREU,24/03/1926,tipo 3
16780,5107206,MARIA DA LIBERDALIMA DO NASCIMENTO,MARIA MARCELA DA SILVA FETOSA,12/10/2014,tipo 3
16782,1200401,MARIA DA LIBERDASOUSA MOURA,MARIA MARLENE DA SILVA,12/03/1997,tipo 3
16791,1200401,MARIA DANIELE ARAUJO RAMOS,MARIA NASCIMENTO DE SOUSA,21/04/2012,tipo 3
16800,1200401,MARIA DAS DORES DA SILVA,MARIA NEUSA VIERA DA SILVA,01/10/1929,tipo 3
16810,1200401,MARIA DAS GRACAS DA SILVA,MARIA PADILHA DA SILVA,12/01/1988,tipo 3
16823,5107206,MARIA DE FATIMA DA SILVA LETAO DE ARAUJ,MARIA RAIMUNDA DA SILVERA,30/10/1972,tipo 3
16825,1200401,MARIA DE FATIMA DA SILVA LUS,MARIA RAIMUNDA LIMA,25/03/2021,tipo 3
16836,1200401,MARIA FATIMA MOTA LIMA SILVA,MARIA RITA EVANGELISTA DA SILVA,17/12/1944,tipo 3
16852,1200401,MARIA DE NASARE CARDOSO LIMA,MARIA ROSILENE SOUSA DE SOUSA,31/10/1930,tipo 3
16856,1200401,MARIA DE NASARE DE SOUSA LIMA,MARIA ROSINEDE MORENO DA SILVA,25/08/1950,tipo 3
16872,1200401,MARIA DILCE MORENO DA SILVA,MARIA SILVANE ALVES GOMES,24/11/2020,tipo 3
16880,1200401,MARIA DO CARMO QUEMEL DA SILVA,MARIA SOCORO CASTRO LIMA,19/12/1960,tipo 3
16887,1200401,MARIA DO SOCORO DA COSTA TAVARES,MARIA SOUSA DE ANDRADE,09/12/1999,tipo 3
16891,1200401,MARIA DO SOCORRO FERRERA DO VALLE,MARIA SUELY ARES LIMA,28/04/2007,tipo 3
16902,5107206,MARIA DULCEDE GOMES DE FRETAS,MARIA VALDENIRA VIANNA DOS SANTOS,15/01/1955,tipo 3
16922,1200401,MARIA ELILSA SANTOS DO NASCIMENTO,MARIANE RIBERO MARTINS,18/05/1970,tipo 3
16944,5107206,MARIA EVANDIA CESAR FETOSA,MARILENE ROCHA DO NASCIMENTO,22/03/1988,tipo 3
16965,1200401,MARIA FRANCISCA DE OLIVERA FARIAS,MARINES XAVIER DOS ANJOS,27/06/1950,tipo 3
16969,1200401,MARIA FRANCISCA LACERDA DA SILVA,MARINILDA BRAS DA SILVA DIAS,11/04/1941,tipo 3
16978,1200401,MARIA FREIRE DE SOUSA,MARISETE DA CRUS FREITAS,04/12/1968,tipo 3
17001,1200401,MARIA GORETE RODRIGUES DA SILVA COSTA,MARTA DA SILVA,07/08/1998,tipo 3
17011,5107206,MARIA IGLEANE ALMEDA DA SILVA,MATHEUS FREIRE DE SOUSA,23/08/1978,tipo 3
17025,1200401,MARIA IVANILDE ROCHA FERRAS,MAYLANE OLIVERA DA SILVA,03/02/1943,tipo 3
17037,1200401,MARIA JILCELA DO NASCIMENTO,MICHELE DA SILVA LIMA,11/04/1932,tipo 3
17043,5107206,MARIA JOERLANDIA BERNARDO DA ROCHA,MICHELLE SOARES DO NASCIMENTO,07/11/1980,tipo 3
17063,5107206,MARIA JOSE FREIRES DE SOUSA,MIRELE MORAIS SOUSA,18/04/1928,tipo 3
17077,5107206,MARIA JOSE PINHERO FRETAS,MIÇIANA PIRES GOMES,07/08/1953,tipo 3
17098,1200401,MARIA CAUANE RODRIGUES DA SILVA,NAIARA FERRERA DA COSTA,31/05/2018,tipo 3
17100,5107206,MARIA LAUANDA SILVA DO NASCIMENTO,NAIRA CRISTINA OLIVEIRA DE SOUSA,19/03/1964,tipo 3
17124,1200401,MARIA LUCIENE PERERA GOMES,NAIRD ESTEPHANI SILVA BARBARI,18/05/1935,tipo 3
17133,1200401,MARIA LUSIA BARROS DE MOURA,NEREIDE SOUSA DA SILVA,28/10/2022,tipo 3
17135,5107206,MARIA LUSIENE BARBOSA DA SILVA,NEURICELLY DA SILVA CASTRO,16/11/2005,tipo 3
17140,1200401,MARIA MADALENA PERERA BARBOSA,NEWGYENE DA CONCECAO LIMA DA SILVA,23/07/1974,tipo 3
17142,1200401,MARIA MADALENA SANTOS ARRUDA,NICOLY DE FARIAS BESERRA,15/11/1947,tipo 3
17143,5107206,MARIA MADALENA SILVA DO NASCIMENTO,NIELLE FRANCA MELO,25/08/2021,tipo 3
17144,1200401,MARIA MADERO DE ARAUJO CORDERO,NILCE DE SA SOUSA,20/07/2016,tipo 3
17146,1200401,MARIA MARCIANE CATAYANNA MARQUES,NILCE MAIA DE OLIVERA,08/05/1962,tipo 3
17150,5107206,MARIA MARGARIDA DE SOUSA ALMEIDA,NILCILENE FERRERA DA COSTA,09/09/1939,tipo 3
17151,1200401,MARIA MARIANA MORERA ESTEVES,NILCIRENE PINHERO GONDIM,11/10/1962,tipo 3
17175,1200401,MARIA NILDA DA CONCECAO,NUBIA REGIS ARAUJO DA SILVA,26/08/1927,tipo 3
17176,5107206,MARIA NILDA MACHADO GOMES,NUBIA VICENTE SOUSA DA SILVA,05/10/1955,tipo 3
17189,1200401,MARIA OSMARINA PAIVA COSTA,OLIVANIA DO NASCIMENTO BESERRA,18/11/1986,tipo 3
17198,5107206,MARIA RAIMUNDA LIMA MAGNO,OTILIA BRITO DE OLIVERA,20/05/1964,tipo 3
17231,5107206,MARIA ROSELANDE FRETAS DE CASTRO,PAULA NATIANE DE SOUSA ARAUJO DA CRUS,18/06/1974,tipo 3
17241,5107206,MARIA ROSINERI ARAUJO DUARTE,PEDRINA MESQUITA DA SILVA,03/07/2013,tipo 3
17243,1200401,MARIA ROSETE ALVES ROGERIO,PEDRINA RUFINO ARUDA,15/12/2013,tipo 3
17261,5107206,MARIA SILVANIA GARCIA DOS SANTOS,QUEILA SOUSA DA SILVA,01/08/1946,tipo 3
17262,5107206,MARIA SILVANIA VIERA GOMES,QUELE MORAES SOARES,03/04/1955,tipo 3
17264,5107206,MARIA SILVIA SANTOS DA SILVA,QUESID LORANNE BARBOSA DOS SANTOS,22/10/1970,tipo 3
17284,1200401,MARIA TERESA VIANA DA SILVA,RAIANE NASCIMENTO ARAUJO,22/07/2001,tipo 3
17296,5107206,MARIA VERONICA CORDERO CAMPOS,RAILDA DOS SANTOS DA CONCECAO,18/11/1987,tipo 3
17298,1200401,MARIA VITOR DAMASCENO,RAIMUNDA ALVES DE OLIVERA,06/06/2001,tipo 3
17302,1200401,MARIA SULEIDE COSTA DOS SANTOS,RAIMUNDA BARRETO DE OLIVERA SENA,10/10/1975,tipo 3
17304,5107206,MARIANNA ANDRADE DO NASCIMENTO,RAIMUNDA BENEDITA PERERA LOPES,08/04/1998,tipo 3
17305,1200401,MARIANNA DA SILVA,RAIMUNDA CARNERO DE MELO,24/08/1943,tipo 3
17309,1200401,MARIANNA PAIVA CAVALCANTE,RAIMUNDA DA CRUS PEREIRA,15/10/1991,tipo 3
17310,5107206,MARIANNA PAULA DA CUNHA,RAIMUNDA DA SILVA LIMA,18/10/1941,tipo 3
17322,5107206,MARILENE FETOSA SAMPAIO,RAIMUNDA LIMA FERRERA,16/05/2006,tipo 3
17337,5107206,MARINA APARECIDA DA SILVA,RAIMUNDA NONATA MOTA LIMA,27/07/1930,tipo 3
17341,5107206,MARINA SELADA MOLINA RIBEIRO,RAIMUNDA REGO DOS SANTOS,30/07/1991,tipo 3
17344,1200401,MARINALVA SOUSA DA SILVA,RAIMUNDA RIBERO MARTINS,05/05/1982,tipo 3
17350,5107206,MARINES BARBOSA,RAIMUNDA SOUSA DA SILVA CAVALCANTE,29/07/1937,tipo 3
17358,5107206,MARINEUDES DOS RES BARROS,RAIMUNDO FERREIRA DE SOUSA,13/08/2009,tipo 3
17366,1200401,MARIVALDA PEREIRA DE SOUSA,RAIMUNDO PAIVA MELO,27/09/1968,tipo 3
17381,5107206,MARLENE RODRIGUES CASTRO,RAQUEL ALMEDA DOMINGUES,12/07/1986,tipo 3
17396,5107206,MARLI DA SILVA PINTO,RAQUEL OLIVERA DA SILVA,17/01/1942,tipo 3
17399,5107206,MARLY VIANA DE FRETAS,RAQUELE FIGUEREDO MOTA,05/01/1959,tipo 3
17404,1200401,MARRONE MUNIS FREITAS,RAIANE PAIXAO DA SILVA,30/08/1961,tipo 3
17425,5107206,MAURISA SOARES DE ASEVEDO,REGIANE DA CONCECAO FERRERA,31/01/1935,tipo 3
17438,5107206,MELICIA RODRIGUES DA SILVA,REJANE GUERRA ARAUJO,03/04/1976,tipo 3
17448,5107206,MICAELY SOUSA DE QUEIROS,RENILDA BAROS DO NASCIMENTO,30/07/1998,tipo 3
17456,1200401,MICHELE SILVA ALMEDA,RIGLEANGELA PERERA NOGUERA,21/08/1968,tipo 3
17473,1200401,MILENE SILVA CARVALHO,ROMILDO RIBEIRO DE QUEIROS,04/02/1966,tipo 3
17494,1200401,MIRIAN SOUSA GOMES APURINA,ROSA MARIA MATOS LIMA,08/06/1988,tipo 3
17505,1200401,MISLENA CARDOSO BATISTA,ROSANA MARTINS LUCAS DE OLIVERA,30/06/1979,tipo 3
17522,1200401,NAGILA MARIA NUNES GURGEL,ROSE PAULA DA COSTA APURINA,07/06/2003,tipo 3
17532,5107206,NAISOUTELO PALHETA,ROSEMIR DE OLIVERA PERERA,23/04/1976,tipo 3
17536,5107206,NAIR CAROLINE MARTINS MANDROTI,ROSENILDA DE SOUSA SILVA ARAUJO,22/05/1956,tipo 3
17579,1200401,NEILSA OLIVEIRA DE ALENCAR,ROSIMAR FERNANDES DA SILVA,30/12/1928,tipo 3
17588,5107206,NEUSA CRISTINA DE SOUSA LEITE,RUTH NASCIMENTO DE SOUSA,27/08/2019,tipo 3
17589,5107206,NEUSINETE PEREIRA DA SILVA,RUT PEREIRA DE LIMA,09/01/1965,tipo 3
17608,1200401,OBELIA RODRIGUES DA SILVA,SALETE DA SILVA OLIVERA,13/05/2013,tipo 3
17609,5107206,OCELIO DA COSTA CARMO,SALETE DO NASCIMENTO DIAS,15/08/1976,tipo 3
17620,1200401,OLIVIA SARAIVA DE SOUSA DE ANDRADE,SAMARA OLIVERA GONCALVES,24/09/1957,tipo 3
17623,1200401,OSELIA CARNEIRO DE SOUSA,SAMELA ALMEDA DA SILVA,20/08/1978,tipo 3
17627,1200401,OSMARINA DA SILVA MARTINS DE OLIVERA,SAMIR SANTOS DA SILVA,22/04/1942,tipo 3
17634,5107206,PABLINE FELIX DA SILVA,SANDRA MARIA FERNANDES CHAGAS,17/09/1950,tipo 3
17636,5107206,PALMIRA BESERRA ELIAS NETA,SANDRA MARIA SILVA LIMA,18/04/1957,tipo 3
17638,1200401,PAMELA CRISTINA DE SOUSA ALVES,SANDRA RITA DA SILVA,20/06/1967,tipo 3
17645,5107206,PATRICIA ALENCAR DA SILVA,SANTUSA CAREN CABRAL DE ARAUJO,19/06/1998,tipo 3
17651,5107206,PATRICIA MEDEROS FERNANDES ROCHA,SARA DA SILVA SOUSA,26/02/1934,tipo 3
17654,5107206,PATRICIA QUEIROS DE LIMA,SARA JANE DE OLIVERA FRETAS,11/01/1944,tipo 3
17655,5107206,PATRICIA SILVA DE OLIVERA,SARA MELO DA CUNHA,19/07/1979,tipo 3
17656,5107206,PATRICIA SUELEN RODRIGUES DA SILVA,SARA MOURA PAIVA,06/10/1972,tipo 3
17660,1200401,PAULA MARIANNA VASCONCELOS DA SILVA,SARA SOUSA DA SILVA,21/03/1970,tipo 3
17663,5107206,PAULO DA SILVA,SARAH ALVES FERRERA,14/11/1961,tipo 3
17686,5107206,PRISCILA DE OLIVERA GOMES,SELMA FLORINDO BRITO,25/12/1959,tipo 3
17688,5107206,PRISCILA FERRERA DOS SANTOS,SELMA MACHADO DA COSTA,29/10/1983,tipo 3
17697,5107206,QUESIA DO NASCIMENTO LOPES,SHARON NACIMENTO FERNANDES,03/09/1995,tipo 3
17701,1200401,RAFAEL ASEVEDO DE ALMEIDA,SHELA COSTA SILVA,26/07/2020,tipo 3
17710,5107206,RAFAELA MOURA LIMA,SILMAGNO BATISTA NUNES,16/12/1962,tipo 3
17729,1200401,RAILDA DOS SANTOS BESERRA,SIMONE DE OLIVERA GURGEL,12/12/2003,tipo 3
17734,1200401,RAILMA SILVA DOS SANTOS,SIMONE LOPES FERRERA,20/10/1958,tipo 3
17740,1200401,RAIMUNDA CONCECAO DE LIMA,SINAIRA SENA DE SOUSA,05/12/1969,tipo 3
17746,5107206,RAIMUNDA DE SOUSA DO NASCIMENTO,SOCORRO MOURA DE OLIVERA,18/04/1969,tipo 3
17751,1200401,RAIMUNDA CARINNY DE PAULA VIEIRA,SOLANGE DA SILVA MIRANDA,29/07/1993,tipo 3
17764,1200401,RAIMUNDA NONATA LIMA DE OLIVERA,SONIA SANTANA DE SOUSA,19/07/1951,tipo 3
17772,5107206,RAIMUNDA PAIVA FERRERA,STEFANY SILVA DE SOUSA,14/12/1988,tipo 3
17782,5107206,RAIMUNDO CASTELO DA SILVA NETO,SUELI FIGUEREDO DE MENDONCA,23/02/1986,tipo 3
17789,1200401,RAIMUNDO GOMES DE SOUSA,SUIANE TAVARES DA SILVA,09/02/2004,tipo 3
17792,5107206,RAIMUNDO NONATO ANDRE MELO,SUSIANE SANTOS DE SOUSA,19/12/1983,tipo 3
17820,5107206,RAIÇA NOGUEIRA BONFIM,TAIRES DOS SANTOS LIMA,07/02/1972,tipo 3
17821,1200401,RACEL CRISTINE DA SILVA LIMA,TAIRINE SANTOS DA SILVA,27/11/1970,tipo 3
17848,1200401,RAIANE CRISPIM DA SILVA,TARCISIO PERERA DE OLIVERA,04/06/2002,tipo 3
17866,5107206,REGIANE DA SILVA BASTOS,TERESA BARROSO DA ROCHA,11/01/1929,tipo 3
17872,1200401,REGINA RIBERO MOURA,TERESINHA APARECIDA DOS SANTOS,11/12/1979,tipo 3
17873,1200401,REGINALDO BRAGA DA SILVA,TERESINHA DE JESUS GOMES DE FREITAS,23/03/1985,tipo 3
17884,1200401,REVELDO ALVES DA SILVA,TAIS HOLANDA DA SILVA,04/03/1997,tipo 3
17886,5107206,RICARDO GRANGERO DA SILVA,TAIS NUNES MOTA,02/10/1940,tipo 3
17896,1200401,ROBERIA SILVA DOS SANTOS,TARIANE PINHEIRO DE LIMA,27/07/2009,tipo 3
17901,5107206,ROBERTO OLIVEIRA DE AÇUNCAO,THIAGO SOBRALINO DE SOUSA,07/09/2005,tipo 3
17903,5107206,ROCILDA DA SILVA BESERRA,TYRLENE ROCHA ALMEIDA,24/02/2015,tipo 3
17904,5107206,ROGERIO OLIVERA DO NASCIMENTO,TOMASIA MARTINS DA SILVA,23/04/1993,tipo 3
17905,1200401,ROMARA LIMA DA SILVA,UALISON SOUSA DO NASCIMENTO,13/10/1981,tipo 3
17922,1200401,ROSA DOS SANTOS MELO,VALDICC DO CARMO DA CONCEICAO,05/10/2008,tipo 3
17927,5107206,ROSA MARIA FERRERA DA SILVA,VALDISA GALVAO DE ARAUJO,05/07/2006,tipo 3
17937,5107206,ROSALINA BARBOSA,VANDERLEA ALMEDA DA SILVA,11/11/1997,tipo 3
17943,5107206,ROSANGELA ALVES SANTIAGO,VANDREÇA DE OLIVEIRA,16/05/1928,tipo 3
17959,1200401,ROSELIA LOPES DO NASCIMENTO,VANEÇA SILVA FERREIRA,04/04/1982,tipo 3
17962,1200401,ROSEMERE DA SILVA FELIX,VANGLESIA SILVA DE OLIVERA,12/12/1928,tipo 3
17973,1200401,ROSIANI LIMA DA CRUS,VANUSA SOUSA DE ASEVEDO,18/04/1934,tipo 3
17974,1200401,ROSICLEIDE CRUS DA SILVA,VANUSIA DA SILVA ALENCAR,22/05/1966,tipo 3
17986,5107206,ROSILENE DA SILVA LIMA,VERONICA MARIA LIMA CAVALCANTE,15/06/2017,tipo 3
17988,5107206,ROSILENE FERRERA DA SILVA,VERSIA ALVES DA SILVA,19/02/1995,tipo 3
17989,1200401,ROSILENE JULIAO CAMURCA,VERUSCA BATISTA DO NASCIMENTO,06/09/1961,tipo 3
17993,5107206,ROSILENE RES FERRERA,VICTORIA DA SILVA NUNES,17/05/1947,tipo 3
18002,1200401,ROSINEA MELO DA SILVA,VITOR NASCIMENTO SILVA,19/03/2002,tipo 3
18009,1200401,ROSINETE FERRERA DE ARAUJO,VITORIA FRETAS DA SILVA,24/10/1924,tipo 3
18044,5107206,SAINARA DA CONCECAO NASCIMENTO,WGLEYSON DE MENESES VALLE,11/02/1982,tipo 3
18052,1200401,SAMARA CONCECAO DE MATOS,WILLIANE OLIVERA DA SILVA,05/03/1948,tipo 3
18053,5107206,SAMARA DE QUEIROS MESQUITA,UILLISON CESAR DA SILVA,22/04/2014,tipo 3
18056,1200401,SAMARA FROTA DA SILVA,WINGRID CELESTE SALES DE OLIVERA,19/06/1987,tipo 3
18070,1200401,SAMILY OLIVERA DA SILVA,YTAMARA DOS SANTOS DE SOUSA,12/07/1940,tipo 3
18073,1200401,SANDIELE BATISTA BRANDAO,SEINA DE ARAUJO ROCHA,28/08/1975,tipo 3
18081,1200401,SANDRA LOPES DE SOUSA,SIRLANDIA GOMES DOS SANTOS,08/09/1984,tipo 3
