ID,COD_MUNICIPIO,NOME,NOME_RESPONSAVEL,data_nasc,Tipo_erro
18468,5107206,WELISSA FERREIRA CLAUDINO,JULIANA DE FREITAS CHAVES,21/07/2019,Sem erro
18473,1200401,WENNA HEVERLY JUSTO DE ALMEIDA,KARINE MELO DA SILVA,01/02/1929,Sem erro
18474,5107206,WERLEN JUNIOR DE SOUZA REGO,KARITA DANIELY DA SILVA E SILVA,25/07/1939,Sem erro
18475,1200401,WERLES CHARLES GADELHA FERREIRA,KASSIA THAIS DE LIMA DIAS,18/04/1945,Sem erro
18477,5107206,WERVESON SOUZA FIRMINO,KATIA SOUZA DA SILVA,01/08/1994,Sem erro
18479,5107206,WESLA BARRETO CAVALCANTE,KATIANA DOS SANTOS COSTA,27/12/1970,Sem erro
18480,1200401,WESLEY CONCEICAO DA SILVA,KATIANE DE SOUZA BARROS,04/11/2018,Sem erro
18482,1200401,WILIANE GADELHA FERREIRA,KEILA OLIVEIRA ALVES DA SILVA,08/11/1994,Sem erro
18486,5107206,WILLIANE DA SILVA OLIVEIRA,LAINE PEREIRA DA SILVA,26/07/1992,Sem erro
18487,1200401,WILLIANE DE FREITAS MONTEIRO,LARISSA DA SILVA MOREIRA,17/10/2005,Sem erro
18488,1200401,WILLIANE DOS SANTOS TAVARES,LECILDA CHAVES DE SANTANA,01/09/1939,Sem erro
18490,1200401,WILLIANE SILVA PEREIRA,LEILIANE DA SILVA OLIVEIRA,22/05/1928,Sem erro
18491,1200401,WILLIANS RODRIGUES CASAS,LEILIANE PINHEIRO,12/12/1932,Sem erro
18494,5107206,XAIANE ALMEIDA DE LIMA,LEONICE DE OLIVEIRA RODRIGUES,28/04/1943,Sem erro
18497,1200401,YAMILETT FERNANDEZ GONZALES,LIA DA SILVA PERES,08/04/1962,Sem erro
18500,5107206,YANNE CHAVES DA SILVA,LUANA LIMA DE ALMEIDA,25/10/1935,Sem erro
18502,1200401,YARA JULIA PEREIRA DA SILVA,LUCELIA DA SILVA PEREIRA,24/10/1963,Sem erro
18510,1200401,YONAIKER DANIEL RENDON,LUCIRENE DA SILVA ROLA,07/10/2001,Sem erro
18514,1200401,ZENAIDE MOREIRA DA SILVA,LUZIA NAZARE CAVALCANTE,08/02/1927,Sem erro
18517,1200401,ZENILDA JERONIMO DE SOUZA,MAIANE DAMASCENO BARCIO,01/09/1954,Sem erro
18518,1200401,ZILCA ALMEIDA DE SOUZA,MAISA ARARIPE DA SILVA,17/04/1986,Sem erro
18520,5107206,ZILMA NUNES PEREIRA,MARCELA DA SILVA FEITOSA,24/04/1991,Sem erro
18524,5107206,ZULEIDE ELIAS DA SILVA,MARCILENE SILVA TANANTA,27/06/1967,Sem erro
18527,1200427,ANA CAROLINE OLIVEIRA DE SOUZA,MARIA ANTONIA SOUZA DA SILVA,11/11/1927,Sem erro
18530,1200427,ANA MARIA NASCIMENTO DA SILVA,MARIA ARTENISA BEZERRA DA CRUZ,18/07/2000,Sem erro
18531,1200427,ANA MARIA OLIVEIRA DA SILVA,MARIA AUREA SOUZA SILVA,29/04/2000,Sem erro
18532,1200427,ANDRE MARTINS DA COSTA,MARIA CILEUDA SARAIVA DA SILVA,19/05/1955,Sem erro
18533,1200427,ANGELA MARIA MATIAS DE OLIVEIRA,MARIA DA CONCEICAO GOMES DE SOUZA,03/05/1999,Sem erro
18536,1200427,ANTONIA COELHO DE SOUZA,MARIA DAS DORES DE OLIVEIRA,19/12/2019,Sem erro
18539,1200427,ANTONIO ERINILDO DO NASCIMENTO MATIAS,MARIA DE LOURDES DO NASCIMENTO FEITOSA,25/10/1924,Sem erro
18542,1200427,ANTONIO PEREIRA DE OLIVEIRA,MARIA DIVA FERREIRA DE MATOS,28/01/1934,Sem erro
18543,1200427,ANTONIO ROSILDO SILVA DE SOUZA,MARIA DO SOCORRO DA COSTA,07/03/1930,Sem erro
18545,1200427,ARTEMISA RODRIGUES LIMA,MARIA EUNICE SOUZA DA ROCHA,01/12/1936,Sem erro
18547,1200427,AUDERLANDIA FAUSTINO DO NASCIMENTO,MARIA EVILANGELA COSTA DA CRUZ,27/05/2016,Sem erro
18548,1200427,BEATRIZ SARA SILVA DOS SANTOS,MARIA FIGUEIREDO DA SILVA,18/12/1965,Sem erro
18549,1200427,CARLINDA DA SILVA FILGUEIRA,MARIA HELOISA EMILIANO DA SILVA,06/10/2001,Sem erro
18550,1200427,CATIA DA SILVA OLIVEIRA,MARIA HOLANDA LEITE DE BRITO,21/12/1989,Sem erro
18551,1200427,CATIANA AZEVEDO MAGALHAES,MARIA ISABEL GOMES NASCIMENTO,15/07/1987,Sem erro
18552,1200427,CLAUDEMISA DA SILVA MOREIRA,MARIA IVONE MARINHO DE SOUZA,13/06/1929,Sem erro
18555,1200427,DAIANE PINHEIRO OLIVEIRA,MARIA JOSE MARTINS DE ORIAR,18/01/1926,Sem erro
18557,1200427,EDIR MORAIS DE MENEZES,MARIA MADALENA MAIA DA SILVA,07/04/2014,Sem erro
18558,1200427,ELENILDA SILVA ROGERIO,MARIA NAURIA DA SILVA,03/04/1938,Sem erro
18559,1200427,ELENILZA NASCIMENTO DA SILVA,MARIA NEUCELI RIBEIRO DA SILVA,09/09/1967,Sem erro
18560,1200427,ELIMAR DO NASCIMENTO DA SILVA,MARIA NEVES SANTOS DA SILVA,06/09/1952,Sem erro
18561,1200427,ELISANGELA MARIA FERREIRA DA SILVA,MARIA OLIVEIRA DA ROCHA,25/07/1974,Sem erro
18567,1200427,FRANCISCA ISAMILDE FRANCA MATOS,MARIA SANDRA SOUZA DA SILVA SARAIVA,10/07/1971,Sem erro
18568,1200427,FRANCISCA IVANEIDE BRAGA DA CRUZ,MARIA SANTA MORAES DE OLIVEIRA,21/10/1925,Sem erro
18570,1200427,FRANCISCO MAULAIS MELO DO VALE,MARIA TEREZINHA GOMES DA SILVA,06/01/1963,Sem erro
18571,1200427,GENALDO OLIVEIRA DE FRANCA,MARIA ZENEIDE SILVA BARROS,28/01/1960,Sem erro
18572,1200427,GESSICAR CARLAS MOREIRA DA SILVA,MARINEUDA CORDEIRO DA SILVA,31/07/1931,Sem erro
18575,1200427,GRACILENE OLIVEIRA BRAGA,MARINICE CARVALHO DOS SANTOS,01/09/1990,Sem erro
18576,1200427,GRACIMAR NASCIMENTO DOS SANTOS,MARIZA DE SALES BRAGA,31/03/1949,Sem erro
18577,1200427,ILANA DA SILVA LEAO,MARIZANA OLIVEIRA BEZERRA,23/01/1968,Sem erro
18578,1200427,IRENE LOPES NOGUEIRA,MARLUCE MELLO DE SOUZA,01/04/2003,Sem erro
18580,1200427,JAILSA NASCIMENTO DE SOUZA,MASSILDA SILVA DA SILVA,03/12/1981,Sem erro
18581,1200427,JARDEANE FREIRE DA SILVA,MAYARA DA SILVA LIMA,21/11/1980,Sem erro
18582,1200427,JEANE DA SILVA BARBOSA,MAYARA FERREIRA DA SILVA,23/06/1959,Sem erro
18583,1200427,JOAO DA COSTA BARROS NETO,MEIRIANY DAMASCENO DA SILVA,17/08/1945,Sem erro
18586,1200427,JOSE ALVES DA SILVA,MILSON HERNESTO DE ALMEIDA,12/06/1977,Sem erro
18588,1200427,JOSE FRANCISCO ALMEIDA DA SILVA,MIRACY TEIXEIRA DA SILVA,30/11/1945,Sem erro
18589,1200427,JOSE FRANCISCO VASCONCELOS DE OLIVEIRA,MIRIAN FERREIRA DINIZ,21/02/2011,Sem erro
18591,1200427,JOSE MARNILSON DE SOUZA BUSSON,NAIANA PINHEIRO GUIMARAES,25/01/1954,Sem erro
18592,1200427,JOSE NEURIMAR COSTA DE SOUZA,NAIR SIQUEIRA MOURA,30/08/2011,Sem erro
18595,1200427,LAIANE SILVA DE SOUZA,NALDILENE CAMPOS COSTA,25/07/1979,Sem erro
18598,1200427,LUCAS DE OLIVEIRA AMORIM,NATIELE DA SILVA NASCIMENTO,03/04/2003,Sem erro
18599,1200427,LUCICLEIA DE SOUSA FERREIRA,NEULIANE GOMES DA SILVA,11/03/2006,Sem erro
18601,1200427,LUCILA DE OLIVEIRA SILVA,NILDINEIA MARTINS GOMES,25/11/1946,Sem erro
18602,1200427,LUZIANE MARTINS DE OLIVEIRA,NIVEA MAIANY LIRA COSTA,11/02/1955,Sem erro
18605,1200427,MARIA ADRIANA GOMES DE OLIVEIRA,OCINEIDE MOURA VILACO,04/04/1983,Sem erro
18606,1200427,MARIA ALCILENE RODRIGUES DA CONCEICAO,ODICEIA ANDRE DE FARIAS,20/06/2003,Sem erro
18607,1200427,MARIA ALDENICE RODRIGUES DA SILVA,OLGA JUSETE DE LIRA MORAES,24/02/1940,Sem erro
18608,1200427,MARIA ANTONIA OLIVEIRA DE SOUZA,ONAYS DE OLIVEIRA LIMA,11/03/1974,Sem erro
18610,1200427,MARIA ANTONIA SILVA DOS SANTOS,PEREGRINA GONZAGA DA SILVA,19/02/1937,Sem erro
18611,1200427,MARIA ANTONIETA DA SILVA JAMIMAWA,PRISCILLA VIEIRA DA SILVA,05/06/1994,Sem erro
18612,1200427,MARIA ANTONIETA DE AZEVEDO CRUZ DE SOUZA,QUELLEN DA SILVA MENEZES,27/03/1930,Sem erro
18613,1200427,MARIA BENEDITA LIMA DE AMARAL,RAIANE GALVAO DA COSTA,29/08/1938,Sem erro
18614,1200427,MARIA CATIELE AZEVEDO DE OLIVEIRA,RAILDA PAIVA DA SILVA,19/05/1936,Sem erro
18615,1200427,MARIA CLAUDETE DE SOUZA FERREIRA,RAIMUNDA CIRINO DE LIMA,10/09/1971,Sem erro
18616,1200427,MARIA CLAUDIA SILVA DOS SANTOS,RAIMUNDA FERREIRA DA SILVA,14/02/2017,Sem erro
18617,1200427,MARIA CLEICIANE REGIO RODRIGUES,RAIMUNDO DA SILVA FREITAS,03/02/1971,Sem erro
18618,1200427,MARIA CORREIA DE SOUZA,RAIMUNDO SILVA DOS SANTOS,02/02/1992,Sem erro
18620,1200427,MARIA DA CONCEICAO DA SILVA NETO,RAQUEL RIBEIRO DA SILVA,05/05/1945,Sem erro
18621,1200427,MARIA DA GLORIA AGRIPINO BEZERRA,RAYSSA OLIVEIRA ALMEIDA,30/04/1932,Sem erro
18622,1200427,MARIA DA GLORIA NASCIMENTO DE ALMEIDA,REGINA SILVA DE OLIVEIRA,20/04/1988,Sem erro
18624,1200427,MARIA DAS GRACAS DE OLIVEIRA GONDIN,RESBLINE DE SOUZA ANDRADE,09/04/1996,Sem erro
18625,1200427,MARIA DEUZIMAR DOS SANTOS PEREIRA,RISANGELA DA SILVA BARROS,04/11/1951,Sem erro
18627,1200427,MARIA EDILENE SOUZA DA SILVA,RIVANIA GOMES PINHEIRO,08/11/1991,Sem erro
18629,1200427,MARIA ELANE DA SILVA CHAGAS,RONEY MAGALHAES DA COSTA,24/09/2004,Sem erro
18631,1200427,MARIA EUNICE SANTOS FRANCA,ROSANIA BERNALDO DA SILVA,10/07/1929,Sem erro
18633,1200427,MARIA GOMES DA SILVA,ROSELYANE BARBOSA SIQUEIRA,23/04/1938,Sem erro
18634,1200427,MARIA GRACIETE CRUZ DE MESQUITA,ROSEMAR DE BRITO VIEIRA SILVA,10/11/2009,Sem erro
18636,1200427,MARIA INES CABRAL MONTEIRO,ROSICLEA SOUZA DA SILVA,28/07/1942,Sem erro
18639,1200427,MARIA JOSE MODESTO DA SILVA,ROSILENE FACUNDE DE SOUSA,01/01/2014,Sem erro
18640,1200427,MARIA JOSE OLIVEIRA AMORIM,ROSILETE DA SILVA,15/12/2019,Sem erro
18641,1200427,MARIA JOSELDA DA COSTA VAZ,ROZANA DOS SANTOS LIMA,11/07/2018,Sem erro
18643,1200427,MARIA LEIDIMAR SILVA DE OLIVEIRA,ROZINELDO DA SILVA LIMA,13/07/1927,Sem erro
18645,1200427,MARIA LUCIANA FABRICIO DA SILVA,SAILA MARIA DE SOUZA DA SILVA,04/08/1958,Sem erro
18646,1200427,MARIA LUCINETE BERNARDO LIMA,SAMARA SILVA SANTANA,13/04/2015,Sem erro
18647,1200427,MARIA LUCLECIA ARAUJO DE LIMA,SANGELA MARIA NASCIMENTO DA CRUZ,20/02/1976,Sem erro
18650,1200427,MARIA MILENE BEZERRA DA SILVA,SEBASTIANA ANDRESSA PAULA DE OLIVEIRA,25/11/1932,Sem erro
18651,1200427,MARIA NAIANA DA SILVA PERES KAXINAWA,SEBASTIANA SILVA DE SOUZA,01/01/1933,Sem erro
18656,1200427,MARIA ROSENILDE FIRMO DE SOUZA,SILVANE VIANA VELOSO,13/05/1980,Sem erro
18659,1200427,MARIA YASMIM DE LIMA FREIRE,SIRLEIDE MOURA DA SILVA,20/11/1986,Sem erro
18660,1200427,MARIA ZENEIDE VIEIRA DA SILVA,SORAIA MOURA GOMES,06/02/1961,Sem erro
18661,1200427,MARIA ZUILA DO NASCIMENTO,SUELY BRILHANTE DE SOUZA QUEIROZ,06/04/1992,Sem erro
18664,1200427,MICHEL PIMENTEL DA SILVA,TAILANE DA COSTA NERI,08/07/2005,Sem erro
18666,1200427,MILENE DA COSTA FEITOZA,TATIANA DE LIMA QUEIROZ,11/06/2012,Sem erro
18667,1200427,MISMA MARTINS DA SILVA,TEREZA FERREIRA DA SILVA,16/01/1947,Sem erro
18670,1200427,PRISCILA SANTOS DA SILVA,UBERLANDIA VIEIRA DE LIMA,17/07/1938,Sem erro
18671,1200427,RAILANE DA SILVA ROCHA,VALCIRIA DE SOUZA,09/05/2007,Sem erro
18673,1200427,RAIMUNDA RODRIGUES DE SOUZA,VALDECY RAMALHO DE OLIVEIRA,28/09/2013,Sem erro
18675,1200427,RAQUEL DE LIMA SILVA,VANUSA SOUZA NOBREGA,28/02/1997,Sem erro
18676,1200427,RONIELA CRUZ DAS CHAGAS,VANUZIA PEREIRA FALCAO,31/07/1964,Sem erro
18678,1200427,ROSANA CAMARA,VICTORIA CAVALCANTE BARROSO,05/07/1962,Sem erro
18679,1200427,ROSELI DA SILVA NEGREIROS,VILANI MONTE DE ALBUQUERQUE,31/05/1980,Sem erro
18684,1200427,TAINARA DE SOUZA SILVA,ZELIA MARIA GOMES DA SILVA,08/05/1957,Sem erro
18685,1200427,VALDENIZIA LIMA MOREIRA,ZULENE VALE DA SILVA,07/01/1930,Sem erro
18687,1200435,AIDA NONATO SAMORA KAXINAWA,ALDEMIR ARAUJO DA SILVA,28/09/1975,Sem erro
18690,1200435,ANTONIA FRANCISCA ALVES DA SILVA,ALLANA CRISTINA CORDEIRO DE ARAUJO,19/03/1948,Sem erro
18691,1200435,ARLENE AUGUSTO LOPES KAXINAWA,ANA PAULA DE SOUSA LIMA MARINHO,27/12/1977,Sem erro
18693,1200435,CLAUDETE DA SILVA LOPES KAXINAWA,ANDREA LOURENCO GOMES,11/09/1944,Sem erro
18694,1200435,CLEIA BARBOSA KAXINAWA,ANIELY MORAES DE OLIVEIRA,18/04/1950,Sem erro
18696,1200435,DANIEL NONATO SAMORA KAXINAWA,ANTONIA IZONEIDE FELIX DA SIVA,06/03/2001,Sem erro
18699,1200435,EDILSON SALES MOURA,BRENDA KEROLAYNE SOUZA VIANA,27/03/1968,Sem erro
18702,1200435,ELZA NAPOLEAO BARDALES KAXINAWA,CINTIA MAIA DA COSTA,03/01/1945,Sem erro
18703,1200435,EMPERATRIZ VALENTINA KIRINO LOPEZ,CLAUDIA DE ARAUJO VIEIRA,13/11/1940,Sem erro
18704,1200435,ESTELA DA SILVA KAXINAWA,CLECIANE BARBOSA MENEZES,12/09/1929,Sem erro
18705,1200435,FRANCILEUDA DA SILVA MIRANDA,CLEONICE FERREIRA ALVES,23/07/2011,Sem erro
18706,1200435,FRANCISCA LEIDIANE ALBUQUERQUE DE SOUZA,COSMA MIRANDA DA CONCEICAO,30/08/1946,Sem erro
18710,1200435,GILSON DOS SANTOS NOBREGA,DAVIDAIANA GOMES MARTINS CAETANO,12/11/1980,Sem erro
18712,1200435,IDA KULINA,DJENANE DA SILVA RIBEIRO,03/02/1984,Sem erro
18714,1200435,IRIS LAURIANO BATISTA KAXINAWA,EDIVANIA FERREIRA OLIVEIRA,01/12/1968,Sem erro
18716,1200435,IVANEIDE BARBOSA DE ARAUJO,EDVANIA DOS SANTOS,28/06/1963,Sem erro
18718,1200435,LAZIANE DA SILVA PADILHA,ELIANA COSTA DOS SANTOS,06/10/1964,Sem erro
18719,1200435,LENILDA VATSABA KULINA,ENEDINA PINHEIRO DE MELO FARIAS,13/08/1970,Sem erro
18722,1200435,MARCIA KULINA,EUGENIO PATROCINO DE OLIVEIRA,15/08/1943,Sem erro
18723,1200435,MARGARIDA NAPOLEAO CAPU JAMINAWA,EVA ROSANA MENDONCA,21/08/2000,Sem erro
18724,1200435,MARIA ANADIR CUNHA LIMA,EVERSON MORAIS DO VINO,01/03/1982,Sem erro
18726,1200435,MARIA FEITOSA KAXINAWA,FATIMA RODRIGUES DA SILVA,19/06/2004,Sem erro
18728,1200435,MARIA JOCILEUDA BATISTA DOMINGOS KAXINAW,FERNANDA DA LUZ SANTOS,18/12/1965,Sem erro
18730,1200435,MARILYN LOPES LAURIANO KAXINAWA,FRANCIBELE FERREIRA BEZERRA,10/05/1970,Sem erro
18731,1200435,MARIVALDA MADJA,FRANCILENE FERREIRA DA SILVA,21/05/1987,Sem erro
18733,1200435,NEIVA MARIANO KAXINAWA,FRANCINETE DA SILVA CARNEIRO,22/02/1961,Sem erro
18735,1200435,NILDA RUBIN KAXINAWA,FRANCISCA DOS SANTOS COSTA,24/11/1970,Sem erro
18737,1200435,QUERUBINA NASCIMENTO PRADO KAXINAWA,FRANCISCA IVANILDE RODRIGUES DO NASCIMEN,07/04/2011,Sem erro
18738,1200435,QUEZIA LIMA DA SILVA,FRANCISCA LIMA DE SOUZA OLIVEIRA,17/12/2008,Sem erro
18739,1200435,RAQUEL DE SOUZA KORIME KULINA,FRANCISCA RARIS RABELO DE SOUZA,06/06/1963,Sem erro
18745,1200435,SANDY SAMPAIO PINHEIRO KAXINAWA,IRENE DE MOURA JAIME,25/12/1942,Sem erro
18746,1200435,SELMA DE OLIVEIRA BRITO,IVANETE FIGUEIREDO DE SOUZA GARCIA,27/04/2007,Sem erro
18747,1200435,VALDECI RUBIM KAXINAWA,IVNI MARIELMA DIAS ALVARES,08/02/1978,Sem erro
18748,1200435,VERONIA NASCIMENTO DA SILVA KAXINAWA,IVONETE DE LIMA E SILVA,09/01/1948,Sem erro
18750,1200435,YOLANDA NONATO KAXINAWA,JAINE PINTO DA SILVA,27/12/1937,Sem erro
18751,1200435,ZENILDA BATISTA KAXINAWA,JAIRAN SIMAO SANTANA,17/04/2006,Sem erro
18752,1200500,ADAIZA DE SOUZA LEAO,JANAINA DA SILVA PEREIRA,04/08/1973,Sem erro
18753,1200500,ADENALDO DO NASCIMENTO DA SILVA,JANIELE DE PAULA SANTOS,19/04/1937,Sem erro
18754,1200500,AGUINAIRA LIMA DE SOUZA,JECIRLANE ARAUJO DA SILVA,23/04/1998,Sem erro
18758,1200500,ALBETIZA MARINHO DE FREITAS,JOSE ALEKSANDRO SANTOS DA SILVA,28/05/2019,Sem erro
18761,1200500,ALDEIZA RODRIGUES OLIVEIRA,JOSE IVAN MOREIRA DE HOLANDA,18/10/1964,Sem erro
18762,1200500,ALDENIZA ORIAR MOURA,JOSIMEIRE DA COSTA BARROSO,23/08/1951,Sem erro
18764,1200500,ALDERLANDIA DE LIMA NUNES,JOYCE JOSEANE NICACIO RODRIGUES,12/11/1963,Sem erro
18765,1200500,ALDINEIA PEREIRA DA SILVA,JUSCELINA DA SILVA ARAUJO,16/04/2009,Sem erro
18767,1200500,ALESANDRA GONCALVES LEITE,KATIA DA SILVA SOUZA,04/03/2020,Sem erro
18770,1200500,ALINE FREITAS MOTA,KETHELEM FRANCA DE SOUZA,15/06/1959,Sem erro
18771,1200500,ALINE QUEIROZ ESPINDOLA,KILVIA MARIA PEREIRA DA SILVA,24/11/1972,Sem erro
18772,1200500,ALTEAN PAIVA DA SILVA,LADISLEIA PESSOA DE OLIVEIRA,26/09/1939,Sem erro
18774,1200500,AMANDA DA CUNHA LIRA,LAIANE DA SILVA JOSE,23/10/1969,Sem erro
18775,1200500,ANA CLAUDIA DA SILVA SANTOS,LAINY MENEZES DE QUEIROZ,16/11/1938,Sem erro
18776,1200500,ANA CLAUDIA DOS SANTOS SILVA,LARA NAELI LIMA BRITO,20/09/2011,Sem erro
18780,1200500,ANA PAULA SILVA FERREIRA,LEYDY LAURA FERREIRA DE SOUZA,07/03/1949,Sem erro
18781,1200500,ANDRE SILVA DE SOUZA,LILIA CLICE DE MORAIS GOMES,14/07/2017,Sem erro
18782,1200500,ANDRECIA FERREIRA DE ALBUQUERQUE,LUANA DA SILVA FREITAS,01/06/1973,Sem erro
18784,1200500,ANEIZA SOUZA DA SILVA,LUCINETE DA SILVA LIMA,19/09/2002,Sem erro
18788,1200500,ANTONIA BRAGA DA SILVA,MARCELINHO SOUZA DOS SANTOS,12/09/1970,Sem erro
18790,1200500,ANTONIA COSTA DA SILVA,MARCIA DE SOUZA DA COSTA,02/02/1935,Sem erro
18791,1200500,ANTONIA DA SILVA SAMPAIO,MARCIA DIAS DA SILVA,09/05/2001,Sem erro
18792,1200500,ANTONIA DANIELA OLIVEIRA DO NASCIMENTO,MARGARIDA DE FREITAS SANTOS,18/09/2010,Sem erro
18796,1200500,ANTONIA LIMA DE SALES,MARIA CLEIDIANES DE ALMEIDA SANTOS,05/12/2019,Sem erro
18798,1200500,ANTONIA MENEZES DO NASCIMENTO,MARIA DA CONCEICAO DA COSTA DE SOUZA,14/07/2019,Sem erro
18800,1200500,ANTONIA QUEIROZ RIBEIRO,MARIA DALVA DE MELO NASCIMENTO,06/12/1945,Sem erro
18803,1200500,ANTONIA SOLANGE NASCIMENTO SILVA,MARIA DE FATIMA DE SOUSA FERMINO,20/10/1982,Sem erro
18804,1200500,ANTONIA VILANIR DOS SANTOS LIMA,MARIA DE FATIMA LIMA DA SILVA,17/09/2017,Sem erro
18806,1200500,ANTONIO DUARTE DE BARROS,MARIA GLEICIANE GALVAO DE SOUZA,08/06/1943,Sem erro
18809,1200500,ANTONIO JOSE GANUM ALVES,MARIA JOSE OLIVEIRA DA SILVA,31/03/1929,Sem erro
18810,1200500,ANTONIO NATAL CALDAS DA SILVA,MARIA NEIDA DA SILVA BARRETO,27/10/1961,Sem erro
18811,1200500,ANTONIO PAULO MARINHO DA SILVA,MARIA NEVES JUVENAL,08/03/2007,Sem erro
18813,1200500,ARIELE MARQUES DA SILVA,MARIA SIMONE BULHOES DA SILVA,03/06/2017,Sem erro
18814,1200500,ARTEMIRA CORREIA DA SILVA,MARILZA VENANCIO DA SILVA,11/08/1959,Sem erro
18815,1200500,ARTEMIZA ORIAR MOURA,MARINES TIMOTEO DA SILVA DURICE,14/01/1977,Sem erro
18818,1200500,BRENDA FERNANDA LIMA DE ARAUJO,MARTA DE OLIVEIRA BEZERRA,12/07/1965,Sem erro
18823,1200500,CAROL DA SILVA ARAUJO,PABLINE DE SOUZA LIMA,16/03/1934,Sem erro
18824,1200500,CASSIA SUAVE DA SILVA,PRISCILA DE ALMEIDA COSTA,09/05/2011,Sem erro
18825,1200500,CIRLEIDE GADELHA ALMEIDA,RAFAELA FORMIGA COSTA,10/08/2000,Sem erro
18826,1200500,CLEICIANE DA SILVA MACHADO,RAIMUNDA BORGES DO NASCIMENTO,15/09/1967,Sem erro
18828,1200500,CLEONICE CONSTANCIA DA SILVA,RAIMUNDA NONATA BATISTA DE LIMA,28/12/2008,Sem erro
18832,1200500,CRISTINA LAURA JAMINAWA,RECLEUDI DE ARAUJO FERREIRA,29/03/1941,Sem erro
18835,1200500,DAIANE DA SILVA SOUZA,ROBERTA NAINE SOUZA DE MENEZES,13/11/1976,Sem erro
18838,1200500,DAMILA LEITAO DE ALMEIDA,ROSANA NUNES DO NASCIMENTO ARAUJO,11/04/1927,Sem erro
18839,1200500,DANIELE DA SILVA LIMA,ROSANGELA DO NASCIMENTO CAVALCANTE,05/05/1925,Sem erro
18840,1200500,DAVI VENANCIO DA SILVA,ROSIMARI DA SILVA SANTOS,22/06/1980,Sem erro
18841,1200500,DAVID DA CRUZ SOUSA,ROZINEIDE DE OLIVEIRA AZEVEDO,24/06/2004,Sem erro
18842,1200500,DAYANA MENDES VIEIRA,SAMARA GOMES DE ARAUJO,30/07/2018,Sem erro
18843,1200500,DEIJANE MORAES DE OLIVEIRA,SAMARA MARIA FERREIRA DA COSTA,30/03/2014,Sem erro
18845,1200500,DELZUITE RODRIGUES DOS SANTOS,SAMILLA MARIA FERREIRA DA COSTA,28/02/2020,Sem erro
18846,1200500,DENICE CARDOZO FIGUEIREDO,SANDRA MARIA TEOFILO DE OLIVEIRA,26/08/1983,Sem erro
18848,1200500,DENISSE DE MESQUITA BRAGA LIMA,SEBASTIANA NEVES PAULO DOS SANTOS,04/07/1979,Sem erro
18850,1200500,DERLANDIA PAIVA DE ARAUJO,SHAMILLA SHANIA DA COSTA RODRIGUES,24/12/1953,Sem erro
18852,1200500,DEUZENIR ALVES DA SILVA,SIMONE DA SILVA SAMPAIO,20/10/1942,Sem erro
18855,1200500,DUCILENE FREIRE DE SOUZA,VALDIRENE DA CUNHA SANTOS,18/05/1960,Sem erro
18856,1200500,EDILENE DA SILVA SANTOS,VALERIA SOUZA DE MOURA,01/03/1944,Sem erro
18862,1200500,EDNA FERREIRA DE SOUSA,VITORIA RAILANE DA SILVA MALAQUIAS,26/04/1999,Sem erro
18863,1200500,EDSANDRA COSTA DA SILVA,WILMA SILVA DE ARAUJO,30/09/2020,Sem erro
18864,1200500,EFANIA VALDA JAMINAWA,YRLA DA SILVA NASCIMENTO,03/02/2021,Sem erro
18865,1200500,ELAINE CELESTINO DO NASCIMENTO CUNHA,ADEILSON OLIVEIRA LIMA,08/10/1993,Sem erro
18867,1200500,ELDO NASCIMENTO DE LIMA,ADRIANA BEZERRA DA SILVA,25/07/2003,Sem erro
18869,1200500,ELIANE DA SILVA DAMAZIO,ALBERLANDIA DE SOUZA FERREIRA,30/05/1940,Sem erro
18871,1200500,ELIETE BERNARDO DA SILVA,ALEX DA SILVA DAVI,24/11/1934,Sem erro
18873,1200500,ELISSANDRA DA SILVA PAIVA,AMINADABE ALVES DA SILVA,01/06/1946,Sem erro
18874,1200500,ELISSANDRA SOUZA DA ROCHA,ANA CLARA VIANA DE BRITO,04/05/1986,Sem erro
18875,1200500,ELISSANDRA SOUZA DE OLIVEIRA,ANA KELI DE FREITAS SOUZA,07/05/1946,Sem erro
18877,1200500,ELIZABETE SARAIVA DE OLIVEIRA,ANA MARIA DE FATIMA DA SILVA SOUSA,15/10/1962,Sem erro
18878,1200500,ELIZAMA PINTO DA SILVA,ANA MARIA MIRANDA DE SOUSA,20/06/1958,Sem erro
18879,1200500,ELIZANGELA BREGENCE SOUZA,ANA PAULA DAS CHAGAS SOUZA,29/03/1969,Sem erro
18880,1200500,ELIZETE DA SILVA AGUIAR,ANA TASSIA PIAUHY MENDONCA,06/07/1955,Sem erro
18881,1200500,ELIZEUDA ALVES BARRETO,ANDREA SAMPAIO SOARES,13/05/1937,Sem erro
18882,1200500,ELONIZA FERREIRA DA ROCHA,ANDRESSON MENDONCA PEREIRA,11/10/1994,Sem erro
18883,1200500,EMERSON DE OLIVEIRA FERNANDES,ANELI DE FRANCA OLIVEIRA,10/05/1958,Sem erro
18885,1200500,EMYLLI SUZY BONA RAMOS,ANGELICA DO NASCIMENTO CRUZ,12/12/1973,Sem erro
18889,1200500,ERICA SILVA DE QUEIROZ,ANTONIA DE SOUZA LIMA,16/05/1935,Sem erro
18890,1200500,ERIZALDA RIBEIRO MOTA,ANTONIA DELCIANI MOURA DE SOUSA,01/09/1975,Sem erro
18899,1200500,FABIULA SOUSA DA SILVA,ANTONIA MARIMAR DE OLIVEIRA PEREIRA,06/12/1942,Sem erro
18901,1200500,FERNANDA OLIVEIRA DE ALBUQUERQUE,ANTONIA ROSA DA SILVA BRAGA,27/12/1942,Sem erro
18903,1200500,FRANCILENE NASCIMENTO DE QUEIROZ,ANTONIA ROSELY DE AQUINO MACHADO,10/07/1932,Sem erro
18904,1200500,FRANCIMEIRE OLIVEIRA DA SILVA,ANTONIA SANDRA SILVA DO NASCIMENTO,13/09/1981,Sem erro
18905,1200500,FRANCINEIDE FIGUEREDO DA SILVA,ANTONIA TATIANA DE ARAUJO MONTEIRO,08/05/1998,Sem erro
18910,1200500,FRANCISCA CARDOSO DE ARRUDA,ANTONIO FRANCISCO FERNANDES DA ROCHA,24/04/1928,Sem erro
18912,1200500,FRANCISCA DA SILVA,ANTONIO WILAS DE SOUZA FERREIRA,28/04/2016,Sem erro
18914,1200500,FRANCISCA DAS CHAGAS TEIXEIRA,ARTEMIZA MENDES DA SILVA,30/08/2010,Sem erro
18916,1200500,FRANCISCA DE NAZARE DOURADO DA SILVA,CARLENE MARIA DA SILVA SOUZA,06/09/1935,Sem erro
18917,1200500,FRANCISCA LOPES RODRIGUES,CARMELIA DE ARAUJO LIMA,08/05/1960,Sem erro
18918,1200500,FRANCISCA MAGALHAES DA SILVA,CAROLAINE MOURA MELO,24/10/2002,Sem erro
18919,1200500,FRANCISCA NAELIA GOMES DA SILVA,CAROLINE SILVA DE MATOS,16/08/2008,Sem erro
18920,1200500,FRANCISCA NONATA DE MENDONCA COIMBRA,CASSANDRA CORREIA DA SILVA,17/10/2005,Sem erro
18923,1200500,FRANCISCA SILVA DE SOUZA,CELIANE DO NASCIMENTO CAMPOS,18/04/1960,Sem erro
18926,1200500,FRANCISCO FERREIRA DA SILVA,CLAUDIO MACARIO NAPOLEAO KAXINAWA,30/10/2012,Sem erro
18930,1200500,GEANE ALMEIDA DE MELO,CREMILDA MORAIS BEZERRA,06/07/1939,Sem erro
18931,1200500,GENEZIO PEREIRA TRINDADE,CRISTINA DO NASCIMENTO SILVA,21/04/1994,Sem erro
18932,1200500,GEOLIVAN APOLINARIO DE MOURA,DAMIANA LIMA DE OLIVEIRA,13/04/1999,Sem erro
18937,1200500,GISELLE SOUSA LEITE,DENISE DO NASCIMENTO NOGUEIRA,05/10/2009,Sem erro
18940,1200500,GRACILENE MACAMBIRA LOPES,DOMINGOS SOARES ALVES,01/07/1967,Sem erro
18941,1200500,GUSTAVO COSTA DIAS,DUCENIRA FERREIRA MARTINS,23/08/2008,Sem erro
18944,1200500,INES CELESTINO DA COSTA,EDIANE EMIDIO BRASIL,11/04/1945,Sem erro
18945,1200500,INGLYS LANE PIRES DOS SANTOS,EDICINALDA MACEDO MACHADO FREITAS,06/06/2007,Sem erro
18946,1200500,IOLANDA SANTOS LIRA,EDIMARIA ALVES DE FREITAS,03/05/1939,Sem erro
18951,1200500,IVANEIDE CUESTA DAMASCENO,ELIONE BATISTA DA SILVA,27/02/2018,Sem erro
18954,1200500,JAKCILANDIA ALMEIDA DE QUEIROZ,ELOIZA COELHO ARAUJO,08/03/1998,Sem erro
18955,1200500,JANAINA DE MORAIS MATA,ELZA SANTOS DUARTE,17/07/1990,Sem erro
18956,1200500,JANCINETE PERES DOS SANTOS DINIZ,EMILLY LIMA DA SILVA,23/02/1999,Sem erro
18957,1200500,JAQUELINE DA SILVA PONTES,ERONILDA DA SILVA MANOEL KAXINAWA,04/06/1992,Sem erro
18961,1200500,JOCICLEIDE RODRIGUES DA SILVA,FABIO VIRICIO DA SILVA,02/03/1976,Sem erro
18964,1200500,JORJANE PONTE DE OLIVEIRA,FRANCIENE DE CARVALHO MOURA,11/05/1955,Sem erro
18965,1200500,JOSE ANTONIO ROMANA TEIXEIRA,FRANCILENE DA COSTA NASCIMENTO,15/08/1974,Sem erro
18968,1200500,JOSELIA MARINHO DE OLIVEIRA,FRANCISCA ANUNCIACAO DA SILVA,22/02/1929,Sem erro
18970,1200500,JOSIENE DA SILVA BARBOSA DOS SANTOS,FRANCISCA DAS CHAGAS ANGELO DE SILVA,27/06/1992,Sem erro
18972,1200500,JOZIANE MUNIZ PONTES,FRANCISCA DAS CHAGAS DE LIMA NASCIMENTO,14/12/1975,Sem erro
18973,1200500,JUBIA DA SILVA REBOUCA MENDES,FRANCISCA DAS CHAGAS DE OLIVEIRA,04/02/1954,Sem erro
18976,1200500,JUDACI OLIVEIRA DE SOUZA,FRANCISCA DO CARMO BEZERRA,23/11/1982,Sem erro
18978,1200500,KAILINY MOURA DA SILVA,FRANCISCA LUCIELIA CUNHA DOS SANTOS,15/12/1932,Sem erro
18982,1200500,KAROLINA MOTA RODRIGUES LIMA,FRANCISCO DAS CHAGAS SILVA DE FREITAS,30/01/1986,Sem erro
18983,1200500,KAROLINE FELIX DE SOUZA,FRANCISCO DE ASSIS DE CASTRO AMORIM,21/04/1949,Sem erro
18984,1200500,KATHYELLY SAMPAIO DE OLIVEIRA,FRANCISCO DE ASSIS DE SOUZA,22/02/1941,Sem erro
18986,1200500,KATRINE BELARMINO DA SILVA,FRANCISCO DE JESUS PESSOA DE OLIVEIRA,29/05/2009,Sem erro
18989,1200500,KEROLAINY OLIVEIRA DO NASCIMENTO,GECILENE FERREIRA DE MELO,31/10/1952,Sem erro
18990,1200500,KIARA TAMBURINI DE LIMA,GERONIMA OLIVEIRA RAMALHO,04/04/1927,Sem erro
18993,1200500,LAYANNA DE ALMEIDA ROCHA,HANNA CATAO ELEAMEN,18/03/1960,Sem erro
18995,1200500,LEA RODRIGUES DA SILVA,IOLANDA ALVES DA SILVA,14/10/1931,Sem erro
19000,1200500,LILIANA DE OLIVEIRA IRMAO,ISETE GOMES LIMA,10/05/2016,Sem erro
19002,1200500,LOZETE ESTEVES DOS SANTOS,IZETE CARNEIRO DE PAIVA,17/02/2004,Sem erro
19004,1200500,LUANA LIMA DE ALMEIDA,JAMES DA SILVA MELO,23/02/1940,Sem erro
19006,1200500,LUCEMISA DOS SANTOS AVILA,JAQUELINE MENDONCA CORREIA,08/03/2022,Sem erro
19007,1200500,LUCIANA SANTOS DO CARMO MARINHO,JOQUEBEDES DA SILVA DAMASCENO,08/05/2009,Sem erro
19008,1200500,LUCILANDIA FEITOZA MACIEL,JOSE AMORIM CORREA,14/05/1966,Sem erro
19009,1200500,LUCINEIA SOARES CAMPOS,JOSE BENVINDO DE SOUZA SILVA,11/05/2010,Sem erro
19011,1200500,LUZENIR BRITO DO NASCIMENTO,JOSE CARLOS FALCAO DA SILVA,01/10/1936,Sem erro
19014,1200500,LUZINETE DE SOUZA TANANTA,JOSE DE LIMA SILVA,03/08/1944,Sem erro
19015,1200500,MACILENE DA CONCEICAO,JOSE DE SOUZA SILVA,22/11/1997,Sem erro
19017,1200500,MAIARA GOMES DE LIMA,JOSE PEREIRA DOS SANTOS,09/02/1972,Sem erro
19018,1200500,MAIRA CRISTINA GOMES DA SILVA,JOSEFA ALVES DE SOUZA,26/12/1968,Sem erro
19020,1200500,MANOELE PEREIRA MONTEIRO,JUSIEL PETRONILIA DA SILVA,06/11/1999,Sem erro
19023,1200500,MARIA ALBERTA FERNANDES DA SILVA,LAISE GOMES DE SOUZA,07/01/1927,Sem erro
19024,1200500,MARIA ANGELICA DE QUEIROZ MENDONCA,LAURA EMANUELLE DE SOUSA TORQUATO,08/05/1928,Sem erro
19027,1200500,MARIA ANTONIA EVANGELISTA RIBEIRO,LEANDRO DO NASCIMENTO AGUIAR,21/11/1943,Sem erro
19031,1200500,MARIA APARECIDA PIRES FLORES,LEIDIANE GOMES DE ALBUQUERQUE,21/04/1949,Sem erro
19032,1200500,MARIA BANDEIRA DA SILVA,LEIDIMAR FERREIRA DUARTE,08/05/2020,Sem erro
19033,1200500,MARIA CLEIDE FERREIRA DE OLIVEIRA,LEONARIA FERREIRA DE OLIVEIRA PESSOA,24/11/1978,Sem erro
