ID,COD_MUNICIPIO,NOME,NOME_RESPONSAVEL,data_nasc,Tipo_erro
20143,2200202,FLAVIANE DA SILVA BISPO,ANDREZA ALVES DE SOUZA,25/04/1941,Sem erro
20144,2500106,FLAVIO SOUZA RODRIGUES,ANDREZA TEIXEIRA CAVALCANTE SILVA,24/11/1948,Sem erro
20145,2500106,FRANCIELLE DIAS DOS SANTOS,ANGELA BARBOSA DOS SANTOS,11/11/1930,Sem erro
20147,2200202,GEANIA CAVALCANTE DA SILVA,ANGELA MARIA DA SILVA,10/01/1941,Sem erro
20148,2700102,GELCI DA SILVA BATALHA,ANGELA MARIA SILVA DOS SANTOS,27/09/1998,Sem erro
20149,2500106,GERLIANE VENTURA MONTEIRO,ANGELINA DOS SANTOS,03/03/1949,Sem erro
20150,2700102,GILCE MARIA DAMASCENO DOS SANTOS TEODORO,ANTONIA ALVES DA SILVA,11/09/1931,Sem erro
20156,2700102,GISELMA CONCEICAO DA SILVA,AQUILA MARIA DOS SANTOS,11/03/2009,Sem erro
20157,2200202,GIVALDO TEIXEIRA DOS SANTOS,ARLENE ARLINDA DA PAZ VITAL,01/10/1931,Sem erro
20158,2700102,GORETE DA SILVA,ARLETE DA SILVA LIMA,10/07/1953,Sem erro
20160,2200202,GRACIENE PEREIRA,AUZENIR DE OLIVEIRA FREIRE,24/01/1960,Sem erro
20161,2700102,GRACILIANE DA CONCEICAO SILVA RIBEIRO,AUZENIR GOMES DOS SANTOS LINS,04/11/1986,Sem erro
20162,2500106,HELENA DA SILVA FERREIRA DOS SANTOS,AVERILDA OTAVIO DA SILVA,14/06/1959,Sem erro
20165,2500106,IARA DA SILVA SANTOS,BEGMAR CAVALCANTE GOIS BEZERRA,14/11/1944,Sem erro
20167,2500106,IDIANE DOS SANTOS ARAUJO LEANDRO,BENEDITA MARIA DOS SANTOS SILVA,30/08/2003,Sem erro
20168,2700102,IRACEMA QUEIROZ DE LIMA,BENEDITA MARTINS VIANA,05/05/2006,Sem erro
20169,2200202,IRENE DA SILVA,BERIVANIA MELO DA SILVA,17/10/1989,Sem erro
20170,2700102,IRENE GONCALVES,BETANIA BRANDAO DA SILVA,07/10/1950,Sem erro
20171,2200202,ISABEL DA SILVA FERREIRA,BIANCA BEATRIZ DOS SANTOS NUNES,05/08/1943,Sem erro
20173,2500106,IVANILDA DOS SANTOS SILVA,BRUNA CAROLINE DA SILVA,16/10/2002,Sem erro
20174,2200202,IVANILDA MARINHO PEREIRA,BRUNA GERMANO DE BRITO,07/06/1935,Sem erro
20176,2700102,JACQUELINE SANTOS DE OLIVEIRA,CAMILA BARBOSA DA SILVA,28/03/2013,Sem erro
20177,2700102,JAILMA BEZERRA DA SILVA,CAMILA ESPERCINA SOARES DA SILVA ALVES,20/11/2019,Sem erro
20179,2200202,JAKELINE DOS SANTOS SILVA,CAMILA LIMA DE SOUZA,12/08/1960,Sem erro
20180,2700102,JANAINA LUANA MIRANDA DOS SANTOS,CAMILA SILVA MARTINS,19/12/2014,Sem erro
20181,2200202,JANAINA LUANA MIRANDA DOS SANTOS,CARLEANE GUEDES DE OLIVEIRA SILVA,28/04/1990,Sem erro
20182,2700102,JANECIA LEANDRO BARROS,CARLOS ALBERTO RODRIGUES DE LIMA,24/11/1996,Sem erro
20184,2700102,JAQUELINE BARROS DOS SANTOS,CARLOS ROBERTO DA SILVA FALCAO,13/01/2002,Sem erro
20185,2200202,JAQUELINE DA CONCEICAO DA SILVA,CASSIA MARIA DA SILVA BEZERRA,30/12/1957,Sem erro
20186,2700102,JAQUELINE DA COSTA SAMPAIO,CASSIA SILVA DE FARIAS,11/06/2006,Sem erro
20188,2700102,JESSICA ALVES DOS SANTOS AMBROSIO,CELY RENADJA MARIA DOS SANTOS,01/07/1988,Sem erro
20189,2700102,JOCELINA DOS SANTOS SANTANA,CICERA ANSELMO DA PAZ,01/12/1933,Sem erro
20193,2700102,JOSE BARROZO DE SOUZA,CICERA MARIA DE MIRANDA,21/07/1963,Sem erro
20194,2200202,JOSE BARROZO DE SOUZA,CICERA MARIA DO NASCIMENTO,01/02/1945,Sem erro
20195,2500106,JOSE DOMINGOS DOS SANTOS FILHO,CICERA MARIA DOS SANTOS,03/01/1990,Sem erro
20196,2500106,JOSE DOS SANTOS GOMES,CICERA MARIA OLIVEIRA DOS SANTOS,03/10/1961,Sem erro
20197,2700102,JOSE FERNANDO ANTONIO FERREIRA,CICERA PEREIRA DA SILVA,11/12/1949,Sem erro
20198,2500106,JOSE LINDOLFO VIEIRA CAMPOS,CICERA PEREIRA LOPES,16/04/1948,Sem erro
20200,2500106,JOSE PEDRO DA SILVA,CICERA SOUZA MORAIS,11/02/2005,Sem erro
20202,2200202,JOSE SILVIO NUNES DOS SANTOS,CICERO PEREIRA SILVA,17/12/1955,Sem erro
20209,2700102,JULIANA PEREIRA DA SILVA CRUZ,CINTIA LINDENBERGUE DE MELO,28/10/1939,Sem erro
20210,2500106,JULIETA MARIA CONCEICAO,CLARISSE DE OLIVEIRA SILVA,12/03/1964,Sem erro
20212,2200202,KELINE DOS SANTOS FEITOSA MENDES,CLAUDEMIR ALVES DA SILVA,02/06/1929,Sem erro
20213,2700102,KELLY DOS SANTOS DA SILVA,CLAUDEMIR FERNANDES DA SILVA,05/10/1982,Sem erro
20218,2200202,LEANDRO DA SILVA,CLAUDIANA DE FARIAS DA SILVA,28/02/2019,Sem erro
20221,2200202,LIDIANE MALAQUIAS ROCHA,CLAUDINETE BARBOSA DE LIMA,03/08/1937,Sem erro
20223,2200202,LIDIANE VIEIRA DA SILVA DOS SANTOS,CLAUDINETE FARIAS DA SILVA,09/10/1938,Sem erro
20225,2700102,LIRANE LIMA RODRIGUES,CLAUDIVANIA MARIA DA SILVA,08/12/1975,Sem erro
20233,2500106,LUCINEIDE FEITOZA DA SILVA,CLEIDE DA SILVA ALVES,24/09/1993,Sem erro
20234,2700102,LUCINEIDE PEREIRA DOS SANTOS RODRIGUES,CLEIDE JANE PEREIRA SOARES,05/07/2008,Sem erro
20235,2700102,LUCIVANIA RODRIGUES DOS SANTOS DA SILVA,CLEIDE MARIA DANTAS SILVA,23/01/1954,Sem erro
20236,2500106,LUIZ CARLOS PEREIRA GONZAGA,CLEIDIANE DOS SANTOS SILVA,18/11/1969,Sem erro
20237,2700102,LUIZ FELIX DE AQUINO,CLEIDIANE MARIA DOS SANTOS SILVA,02/07/1970,Sem erro
20239,2200202,LUSTRIANA SILVA DOS SANTOS,CLESIA SILVA DOS SANTOS,23/05/1987,Sem erro
20240,2500106,LUZIA SAMPAIO DE OLIVEIRA BARROS,CLESIVANIA SILVA DO NASCIMENTO,25/01/1994,Sem erro
20243,2700102,MANOEL MESSIAS GONCALVES,CREMILDA DE MELO,05/02/1995,Sem erro
20244,2200202,MANOEL MESSIAS GONCALVES,CREUZA DANTAS DOS SANTOS ARAUJO,10/03/1979,Sem erro
20245,2500106,MANOELA OLIVEIRA DA SILVA,CRISLEYDE CRISTINA GOMES,20/07/1956,Sem erro
20250,2200202,MARIA ANDRESSA DOS SANTOS DA CONCEICAO,CRISTIANE RUFINO AMARAL,02/11/1956,Sem erro
20251,2500106,MARIA APARECIDA ANDRADE DOS SANTOS,CRISTINA DANTAS DE ALBUQUERQUE,05/09/1936,Sem erro
20252,2700102,MARIA APARECIDA DA SILVA,CRISTINA SANTOS SILVA,06/01/1965,Sem erro
20254,2500106,MARIA APARECIDA DA SILVA DOS SANTOS,CRISTYANY ANDREA SANTANA SILVA,11/08/2003,Sem erro
20255,2700102,MARIA APARECIDA DA SILVA DOS SANTOS,DAIANA CAETANO MARTINS,15/06/1965,Sem erro
20256,2200202,MARIA APARECIDA DA SILVA DOS SANTOS BATI,DAMIANA DA CONCEICAO DA SILVA,13/12/2018,Sem erro
20258,2200202,MARIA APARECIDA DE AQUINO BATISTA,DAMIANA FERREIRA DA SILVA ARAUJO,04/09/1961,Sem erro
20259,2500106,MARIA APARECIDA DO NASCIMENTO DE BARROS,DANIELA MISAEL DOS SANTOS,07/04/1966,Sem erro
20261,2200202,MARIA APARECIDA DOS SANTOS NASCIMENTO,DANIELE DA CONCEICAO,04/06/1959,Sem erro
20263,2700102,MARIA APARECIDA FIRMINO RODRIGUES,DANIELLE CRISTINA DOS SANTOS,23/02/1959,Sem erro
20266,2700102,MARIA APARECIDA GUIMARAES ALVES,DARINE VITORIA DE BRITO SANTOS,24/11/2002,Sem erro
20267,2500106,MARIA APARECIDA GUIMARAES ALVES,DARLANE SILVA DE JESUS,20/10/1972,Sem erro
20274,2200202,MARIA CILENE DA SILVA LIMA BARBOSA,DAYANE SANTOS SOARES DA SILVA,06/02/2022,Sem erro
20276,2200202,MARIA CLEIDE TORRES DA SILVA,DENAIR MARIA DA SILVA,14/06/1946,Sem erro
20278,2700102,MARIA CRISTIANE MENDES DOS SANTOS,DEYSE DOS SANTOS LIMA,05/07/1926,Sem erro
20279,2200202,MARIA CRISTINA DA SILVA,DEYSE DOS SANTOS SILVA,22/03/1984,Sem erro
20280,2500106,MARIA CRISTINA DE MELO MALAQUIAS,DHERYORRANA CREMILDA SANTOS BARBOSA,22/01/1957,Sem erro
20281,2500106,MARIA DA CONCEICAO DIAS DA SILVA CIRILO,DIJANA TEIXEIRA DA SILVA,30/06/1969,Sem erro
20282,2200202,MARIA DA CONCEICAO HOLANDA DE QUEIROZ,DIVANEIDE ALVES DA SILVA,26/03/2009,Sem erro
20284,2700102,MARIA DA SAUDE DOS SANTOS,EDENILZA MARTINS DA SILVA,13/07/1996,Sem erro
20290,2200202,MARIA DAS GRACAS XAVIER,EDILANIA MARIA DOS SANTOS,22/08/1950,Sem erro
20294,2200202,MARIA DE LOURDES CORREIA PEREIRA,EDILENE OLIVEIRA GAMA,28/05/2004,Sem erro
20297,2700102,MARIA DE LOURDES DOS SANTOS,EDILMA QUEIROZ DA SILVA,04/12/2020,Sem erro
20299,2700102,MARIA DE LOURDES SOARES LIMA,EDINEIDE PEREIRA DE MENEZES,29/11/1951,Sem erro
20300,2700102,MARIA DIVA DA SILVA,EDINILDA DA SILVA SANTOS,13/03/1979,Sem erro
20301,2700102,MARIA DO SOCORRO BARROS DE OLIVEIRA,EDINILZA BATISTA DE LIMA,15/12/1951,Sem erro
20302,2500106,MARIA DO SOCORRO DOS SANTOS MANOEL SOUZA,EDITE MARIA DOS SANTOS SOUSA,04/04/2022,Sem erro
20303,2200202,MARIA DONIZETE RAMALHO DA SILVA,EDITE MILENO DE MELO,26/01/1945,Sem erro
20304,2200202,MARIA DOS SANTOS TEODORO,EDIVANIA DE OLIVEIRA SILVA,16/10/1986,Sem erro
20307,2700102,MARIA EDITE DOS SANTOS,EDJANIA DOS SANTOS LIMA,28/02/1937,Sem erro
20310,2700102,MARIA ELITANIA PEREIRA RODRIGUES,EDLANIA MENEZES FERREIRA,20/04/2007,Sem erro
20314,2200202,MARIA EVANGELEIDE TEIXEIRA LIMA,EDNA CORREIA DIAS,05/10/1926,Sem erro
20315,2700102,MARIA FLAVIANA DA SILVA,EDNA DA SILVA RODRIGUES,10/11/1950,Sem erro
20317,2500106,MARIA GEANE DOS SANTOS RICARDO,EDNA DOS SANTOS,04/06/1931,Sem erro
20323,2200202,MARIA HELENA CORREA DOS SANTOS,EDVANIA ALVES DA SILVA,30/01/1999,Sem erro
20324,2500106,MARIA HELENA SILVA DOS SANTOS,EDVANIA GRIGORIO DOS SANTOS,31/10/1992,Sem erro
20326,2700102,MARIA IZABEL PEREIRA DE BARROS,EDVANIA ROBERTA DA SILVA SANTOS,26/09/2022,Sem erro
20332,2200202,MARIA JOSE DE JESUS DOS SANTOS,ELAYNE KARINE OLIVEIRA GOMES,09/01/2012,Sem erro
20333,2500106,MARIA JOSE DE SOUZA,ELENI MARIA DA SILVA,14/04/2020,Sem erro
20335,2700102,MARIA JOSE DOS SANTOS,ELENITA KARLA DE OLIVEIRA BRITO,19/02/1957,Sem erro
20337,2700102,MARIA JOSE GONCALVES DOS SANTOS,ELIANE FRANCISCA OLIVEIRA DANTAS,12/05/1941,Sem erro
20344,2200202,MARIA LUCIA DE SOUZA DA SILVA,ELIANE SHIRLEY FERNANDES DE OLIVEIRA,20/11/2005,Sem erro
20345,2700102,MARIA LUCIENE DA SILVA,ELIEGE DOS SANTOS SILVA,15/08/1996,Sem erro
20346,2200202,MARIA LUCILENE DOS SANTOS,ELIENE CARDOSO DA SILVA,19/08/2015,Sem erro
20348,2500106,MARIA MARCIA DOS SANTOS OLIVEIRA,ELIENE NUNES DA SILVA,16/05/2006,Sem erro
20349,2500106,MARIA MARCIAM DOS SANTOS,ELIETE TELES DOS SANTOS,19/03/1930,Sem erro
20350,2700102,MARIA MARGARIDA DOS SANTOS,ELILEIDE MAURICIA DE ARAUJO,11/02/2022,Sem erro
20352,2200202,MARIA NEIDE BARROS,ELISANDRA FERREIRA SANTOS,07/02/2013,Sem erro
20353,2500106,MARIA NUBIA DE LIMA DANTAS SILVA,ELISANGELA ARAUJO DA SILVA,10/04/1928,Sem erro
20355,2200202,MARIA QUITERIA DA SILVA,ELISANGELA GUEDES DE OLIVEIRA,07/03/2022,Sem erro
20356,2200202,MARIA QUITERIA GOMES DE SOUZA,ELISANGELA JESSICA SILVA SANTOS,12/03/1940,Sem erro
20357,2500106,MARIA QUITERIA SILVA LIMA,ELISANGELA PEREIRA DA SILVA,20/10/1950,Sem erro
20358,2200202,MARIA RAFAELA RODRIGUES DOS SANTOS,ELISANGELA VIANA DOS SANTOS,06/05/2017,Sem erro
20359,2700102,MARIA RAQUEL LOPES FERREIRA,ELISMONICA SANTOS LIMA,11/03/2005,Sem erro
20363,2200202,MARIA RITA PEREIRA LIMA SILVA,EMILLY RAIZY EMILIANO LIMA,02/11/1939,Sem erro
20367,2500106,MARIA SANDRA MALAQUIAS LIMA DOS SANTOS,ERIKA MARIA PEREIRA BARBOSA DA SILVA,25/02/1983,Sem erro
20371,2700102,MARIA SILVANIA CARDIAL DE ANDRADE,ERIVALDO CARDIAL,25/03/1959,Sem erro
20372,2700102,MARIA TAYNA SILVA DIAS,ERIVALDO VITAL DOS SANTOS,01/12/1932,Sem erro
20375,2700102,MARILEIDE DOS SANTOS GAIA,ERIVANIA DA SILVA OLIVEIRA,04/10/1946,Sem erro
20376,2500106,MARILENE DA CONCEICAO DE BARROS,ESMERALDA FERREIRA DA SILVA,04/02/1926,Sem erro
20379,2500106,MARINES MARIA DOS SANTOS SOUZA,EULINA MESSIAS DA CONCEICAO,09/11/1924,Sem erro
20380,2500106,MARINES RICARDO GONCALVES,EVA MATOS DOS SANTOS,23/10/2009,Sem erro
20382,2500106,MARISANGELA DE SOUZA SANTOS,EVELLYN INGRID SILVA,10/02/1979,Sem erro
20386,2500106,MARLEIDE BARBOSA DE LIMA SILVA,FABIA PEREIRA DOS SANTOS,07/02/1980,Sem erro
20389,2200202,MARLI PEREIRA DE ANDRADE,FABIANA DIAS DAMASCENO,18/12/2015,Sem erro
20390,2200202,MAYARA DA CONCEICAO DA SILVA,FABIANA GOMES DA SILVA,05/08/1995,Sem erro
20392,2200202,MERCIA DOS SANTOS GOMES,FABIANA MARIA SANTOS SILVA,17/03/1982,Sem erro
20394,2700102,MILTON MANOEL HENRIQUE,FABIANA SANTOS DA SILVA,05/02/2014,Sem erro
20395,2700102,MIRELI DOS SANTOS DA SILVA,FABRICIA KARLA DA SILVA LEAO,24/01/2016,Sem erro
20400,2200202,NADJARA DA CONCEICAO DOS SANTOS,FERNANDA KELY ALVES,15/09/1928,Sem erro
20401,2500106,NAIR GOMES DO NASCIMENTO DE SOUZA,FERNANDO RAFAEL SANTOS,22/01/1961,Sem erro
20403,2700102,NAYANE QUEIROZ DE SOUZA,FLAVIA DOS SANTOS,24/07/1996,Sem erro
20404,2200202,NELCINEIDE TEIXEIRA DA SILVA,FLAVIA EMANUELLE DOS SANTOS,24/11/1977,Sem erro
20406,2700102,ODAIR JOSE TEIXEIRA LIMA,FRANCISCO MANOEL DOS SANTOS,12/10/2022,Sem erro
20408,2200202,PAULA FABIANA GALDINO DA SILVA DOS SANTO,GEICIKELLE FERREIRA DA SILVA,04/03/2005,Sem erro
20412,2500106,POLIANA MELO DE OLIVEIRA,GERONICE DA SILVA MARQUES,28/05/1942,Sem erro
20413,2200202,QUITERIA GOMES DE BARROS,GERSIVALDO PEDRO DA SILVA,07/12/2019,Sem erro
20415,2700102,QUITERIA MARIA DA SILVA NETA,GICELIA LUCIANA DA SILVA SOUZA,08/06/2006,Sem erro
20418,2500106,RANIELLE DE ARAUJO DOS SANTOS,GILMAR SANTOS COSTA,26/07/2011,Sem erro
20419,2700102,RAYANE FIGUEIREDO BERTO SILVA,GILMARA CAMPOS SILVA,10/03/2012,Sem erro
20420,2200202,REGINALDA RICARDO DOS SANTOS DO NASCIMEN,GILSON ALVES PEREIRA,24/01/1986,Sem erro
20422,2200202,RENATO DOS SANTOS BARROS,GILVANETE MARIA DOS SANTOS,07/05/1948,Sem erro
20423,2200202,RITA DE CASSIA MARCELINO DO NASCIMENTO,GILVANIA BARBOSA OLIVEIRA,02/08/1967,Sem erro
20424,2500106,RITA DO NASCIMENTO ALEXANDRE DA SILVA,GILVANIA BASTOS CARDOZO,21/08/1928,Sem erro
20425,2500106,ROBERLANGELA DOS SANTOS MELO,GILVANIA PEREIRA DOS SANTOS,27/10/1996,Sem erro
20429,2500106,RODRIGO BELARMINO DOS SANTOS,GISELIA BARBOSA DA SILVA,10/05/2004,Sem erro
20431,2200202,RODRIGO JOSE DA SILVA,GISELMA VILELA DA SILVA,14/12/1998,Sem erro
20432,2700102,ROGERIO DE SOUZA SANTOS,GISLANE BASILIO DOS SANTOS,06/03/1976,Sem erro
20433,2200202,ROGERIO DE SOUZA SANTOS,GISLANE LEAL DA SILVA,13/10/1967,Sem erro
20434,2500106,ROSANGELA FEITOZA DE BARROS,GISLENE DOS SANTOS SILVA,07/09/1964,Sem erro
20435,2500106,ROSANGELA SILVA BATISTA,GIVALDA CAMILO DA SILVA,02/02/1993,Sem erro
20437,2700102,ROSELI DOS SANTOS SERAFIM,GIVANEIDE DA SILVA,11/10/1963,Sem erro
20439,2200202,ROSEMAR DO NASCIMENTO,GIZELMA GERUZA DOS SANTOS,02/07/1924,Sem erro
20447,2700102,ROSINEIDE DOS SANTOS BARROS,GRACINEIDE EVANGELISTA DA SILVA,16/08/2005,Sem erro
20448,2700102,ROSIVANIA BARROS DE SOUZA,GRASYELLE OLIVEIRA DOS SANTOS,26/08/1978,Sem erro
20455,2500106,SANDRA DA CONCEICAO SILVA DOS SANTOS,HELENICE MARIA DOS SANTOS,03/11/1936,Sem erro
20456,2700102,SANDRA DOS SANTOS,HORTENCIA MOURA DA SILVA,03/02/1977,Sem erro
20457,2200202,SANDRA REGINA DOS ANJOS DA SILVA,HYANGYA VITORIA DE FREITAS CARVALHO,26/09/2005,Sem erro
20459,2200202,SEVERINO TEIXEIRA DOS SANTOS,IANCA KEYSE DE NOVAES SILVA,30/09/1947,Sem erro
20460,2200202,SIDIRLAINE DA SILVA PORFIRIO,IARA DA SILVA DE JESUS,16/02/1978,Sem erro
20464,2500106,SILVANA JESUS DA SILVA,ILMA SANTOS DE OLIVEIRA,21/06/2011,Sem erro
20465,2700102,SILVANA MARTINS DE BARROS LIMA,ILZA JANDIRA DA SILVA SANTOS,11/04/1998,Sem erro
20466,2500106,SILVANIA DA CRUZ SOARES SANTOS,ILZA SOARES DA SILVA,20/07/1999,Sem erro
20467,2200202,SINEIDE DOS SANTOS DA SILVA,INGRID RUANA DA SILVA,17/09/1959,Sem erro
20468,2200202,SIZIANA DA SILVA,IRACEMA DORA BEZERRA DA SILVA,23/08/1980,Sem erro
20469,2500106,SOLANGE DA SILVA FERREIRA,IRAILDA PAULINO DA SILVA,02/09/1999,Sem erro
20471,2500106,SONIA DA CONCEICAO,IRIS TATIANE SANTOS DE ALMEIDA,25/07/1977,Sem erro
20473,2200202,SONIA GONCALVES DOS SANTOS,IRITELMA ROZENDO DA SILVA,06/07/2016,Sem erro
20474,2200202,TAMIRES DE SOUZA LIMA,ISABELLY AZEVEDO DA SILVA,23/12/1945,Sem erro
20476,2200202,TATIELE DA SILVA DANTAS,ISLAYNE DA SILVA LEITE,20/07/1951,Sem erro
20482,2700102,VALDENICE BAPTISTA DOS SANTOS,IVONETE MARIA DE OLIVEIRA,12/01/1964,Sem erro
20483,2200202,VALDENICE MARIA DE SOUZA,IZABEL CRISTINA DOS SANTOS ALVES,02/02/1983,Sem erro
20484,2200202,VALDINEIDE PEREIRA DOS SANTOS,JACILENE NEVES DE LIMA,24/04/2003,Sem erro
20485,2200202,VALDIRENE DE ARAUJO DOS SANTOS,JACKCELLE MARIA DA SILVA,19/05/1945,Sem erro
20490,2700102,VALQUIRIA VIANA FERREIRA,JADIANE OLIVEIRA DA SILVA,19/05/2022,Sem erro
20491,2700102,VANESSA DA SILVA DOS SANTOS,JADSON KELVIN CABRAL DA SILVA,30/04/2011,Sem erro
20492,2200202,VANESSA DA SILVA DOS SANTOS,JAINE FLAVIA DOS SANTOS,18/09/2017,Sem erro
20494,2200202,VANESSA SANTOS DE ARAUJO,JAMILLY SOUZA DA SILVA,31/08/1926,Sem erro
20495,2500106,VANUSA SOARES DE BARROS TAVARES,JAMILY GOMES SOUZA,20/03/1924,Sem erro
20498,2500106,VERALUCIA LIMA RODRIGUES,JANAINA DA SILVA VICENTE,12/12/2003,Sem erro
20499,2500106,VITORIA MARIA DA SILVA DE ANDRADE,JANAINA GERONIMO DA SILVA,10/01/1994,Sem erro
20501,2500106,WELEN RAYANE DE JESUS DOS SANTOS,JANAINA SOARES DE LIMA,08/11/1989,Sem erro
20502,2700201,ADRIANA DA CONCEICAO,JANAYNE SILVA REIS,31/05/1983,Sem erro
20505,2700201,AGAMENON PAULINO DA CONCEICAO,JANE EYRE DOS SANTOS,31/01/1930,Sem erro
20514,2700201,ANA MARIA DOS SANTOS CAMPOS,JAQUELANE CONCEICAO DO NASCIMENTO DA SIL,28/10/1997,Sem erro
20515,2700201,ANA MARIA GUIMARAES DA SILVA NUNES,JAQUELINE AUGUSTA DA SILVA,22/10/1963,Sem erro
20517,2700201,ANA PAULA DOS SANTOS,JAQUELINE DAMASCENO SANTOS,24/01/1999,Sem erro
20520,2700201,ANTONIO MARCOS DA SILVA SANTOS,JAQUELINE PEREIRA DA SILVA,25/06/1924,Sem erro
20523,2700201,BRUNO NOGUEIRA DA SILVA,JEILSA ALVES DE FRANCA,17/06/1951,Sem erro
20524,2700201,CERIZ DOS SANTOS EUGENIO,JENNIFER VITORIA FREITAS SILVA,02/02/1992,Sem erro
20526,2700201,CICERA CORREIA,JESSIANE ALVES DA SILVA,02/09/1956,Sem erro
20528,2700201,CLAUDIANE DOS SANTOS DA SILVA,JESSICA COSTA DOS SANTOS,20/07/1944,Sem erro
20529,2700201,CONCEICAO DOS SANTOS DA SILVA,JESSICA DOS SANTOS GONZAGA,04/05/2019,Sem erro
20530,2700201,CRISTIANO DA SILVA,JESSICA NATANY OLIVEIRA CARNEIRO,14/11/1979,Sem erro
20531,2700201,DAIANE DE MELO DO NASCIMENTO,JESSICA OLIVEIRA BARBOSA,08/12/1990,Sem erro
20532,2700201,DANIEL DA SILVA DOS SANTOS,JESSICA PEREIRA DOS SANTOS,12/11/1962,Sem erro
20534,2700201,DARIANA GOMES DA SILVA,JESSICA SEVERIANO DOS SANTOS SILVA,19/02/1972,Sem erro
20536,2700201,DORGIVAL DA CONCEICAO DOS SANTOS,JESSIKA DOS SANTOS SILVA,26/08/2015,Sem erro
20543,2700201,GEANE MARIA SILVA DO ESPIRITO SANTO,JOANA DARC DE SOUZA SILVA,22/09/2020,Sem erro
20545,2700201,GILBERTA DOS SANTOS DA SILVA,JOELMA BARBOSA VITAL,27/06/1981,Sem erro
20546,2700201,GILVANEIDE ACIOLI DA SILVA,JOELMA COSTA BARROS,27/12/2015,Sem erro
20548,2700201,HEIDE BANY DE LIMA DA SILVA,JOHNATAN DA SILVA ARAUJO,26/02/2000,Sem erro
20551,2700201,JARIA OLIVEIRA SANTOS,JORVERLANE DA SILVA PEREIRA,30/09/1936,Sem erro
20553,2700201,JESSICA DANIETE FERREIRA DA SILVA,JOSE APARECIDO CANDIDO DA SILVA,09/01/2007,Sem erro
20554,2700201,JOHNYS ROSENDO DE OLIVEIRA,JOSE AUGUSTO DOS SANTOS,29/06/1943,Sem erro
20557,2700201,JOSE AGNALDO DA SILVA,JOSE CARDOSO DOS SANTOS,10/03/1949,Sem erro
20560,2700201,JOSE ANDRE CORREIA DA SILVA DE LIMA,JOSE DAMIAO DOS SANTOS SILVA,21/08/2009,Sem erro
20563,2700201,JOSE DANIEL CORREIA E SILVA,JOSE EXPEDITO DA SILVA,09/12/1988,Sem erro
20564,2700201,JOSE DARLAN DA SILVA OLIVEIRA,JOSE FERREIRA DA SILVA,12/11/1943,Sem erro
20565,2700201,JOSE FRANCISCO DA SILVA,JOSE GONZAGA DOS SANTOS,03/09/1948,Sem erro
20566,2700201,JOSE GREGORIO FREIRE DA SILVA,JOSE ILTON DA SILVA,20/12/1929,Sem erro
20567,2700201,JOSE MACIEL DA SILVA DOS SANTOS,JOSE LIDIO DA SILVA,28/08/1987,Sem erro
20573,2700201,JOSEFA DOS SANTOS,JOSE RIBOMAR CARDOSO,06/10/1977,Sem erro
20575,2700201,JOSEFA RAFAELLA FERREIRA DOS SANTOS,JOSE VALDEMIR DUARTE FERREIRA,26/08/1985,Sem erro
20576,2700201,JOSEFA ROSAS DE SOUZA,JOSE VALDIR FERREIRA LEITE,07/08/2008,Sem erro
20578,2700201,JOSELIA MARIA DOS SANTOS VIEIRA,JOSEANE DE FARIAS SANTOS,21/12/2005,Sem erro
20580,2700201,JOSIVANIA PEREIRA DE MELO,JOSEANE MARIA DA SILVA,26/04/1981,Sem erro
20581,2700201,JOSIVANIA TEIXEIRA DE HOLANDA,JOSEANE MARIA SANTOS SILVA,21/06/1960,Sem erro
20582,2700201,JULIANA DOS SANTOS SILVA,JOSEFA AFONSO DA CONCEICAO,14/04/1933,Sem erro
20584,2700201,LENILDA SOARES DE OLIVEIRA,JOSEFA BARBOSA DA SILVA,27/09/2021,Sem erro
20585,2700201,LEONARDO DOS SANTOS CORREIA,JOSEFA CLAUDENIA DA SILVA MAGALHAES,14/10/1931,Sem erro
20586,2700201,LIDIANE CAMILO DA SILVA,JOSEFA DA CONCEICAO MARQUES,05/11/2004,Sem erro
20587,2700201,LILIANE ROCHA SILVA,JOSEFA DA SILVA BARROS,01/03/2016,Sem erro
20588,2700201,LUCIANA DOS SANTOS DA CONCEICAO,JOSEFA DA SILVA LEITE,12/07/2011,Sem erro
20589,2700201,LUCIANA PEREIRA GOMES,JOSEFA DOS SANTOS BATISTA,14/07/1972,Sem erro
20590,2700201,LUCIANO DO NASCIMENTO SILVA,JOSEFA ELISANGELA PEDRO DA SILVA SANTOS,11/07/1987,Sem erro
20592,2700201,LUCIENE MOREIRA DA SILVA DE LIMA,JOSEFA GRASIELE PROTAZIO DOS SANTOS,17/07/1976,Sem erro
20593,2700201,LUCIETE MOREIRA DOS SANTOS,JOSEFA JESSICA BEZERRA DA SILVA,10/10/1986,Sem erro
20597,2700201,MACIELMA LOPES DA SILVA,JOSEFA LUZIA DA SILVA,12/07/1973,Sem erro
20600,2700201,MARIA APARECIDA ALVES DOS SANTOS,JOSEFA MARIA DA SILVA,19/05/1930,Sem erro
20602,2700201,MARIA APARECIDA DA CONCEICAO LIMA,JOSEFA MARIA DE MELO,13/02/1927,Sem erro
20603,2700201,MARIA BETANIA DA CONCEICAO SILVA,JOSEFA MARIA DE OLIVEIRA SILVA,04/09/1939,Sem erro
20604,2700201,MARIA BETANIA SOUZA DOS SANTOS,JOSEFA MARIA DE SOUZA,16/07/1931,Sem erro
20605,2700201,MARIA BEZERRA DA SILVA,JOSEFA MARIA DOS SANTOS,03/12/1990,Sem erro
20606,2700201,MARIA CICERA DOS SANTOS MENEZES,JOSEFA MARIA DOS SANTOS,26/08/1994,Sem erro
20608,2700201,MARIA CONCEICAO DOS SANTOS,JOSEFA MARIA LIMA DA SILVA,05/03/2018,Sem erro
20610,2700201,MARIA DO CARMO DA CONCEICAO DOS SANTOS,JOSEFA NUNES DOS SANTOS,19/10/1969,Sem erro
20611,2700201,MARIA DO CARMO DA COSTA BARROS,JOSEFA ROSEANE SANTOS DE MELO,21/01/1979,Sem erro
20615,2700201,MARIA JAILZA DA SILVA DOS SANTOS,JOSELIA CORDEIRO DA SILVA,24/08/1956,Sem erro
20616,2700201,MARIA JOSE DA CONCEICAO DE LIMA,JOSELIA SENA LIMA,08/04/1968,Sem erro
20624,2700201,MARIA MOREIRA DA SILVA DE ALMEIDA,JOSICLEA SANTOS DE OLIVEIRA,15/02/1930,Sem erro
20625,2700201,MARIA PIEDADE CONCEICAO DA SILVA,JOSICLEIDE UMBELINO DA SILVA,28/05/1999,Sem erro
20629,2700201,MARIA RITA DA SILVA,JOSILENE GOMES DOS SANTOS,25/08/1953,Sem erro
20634,2700201,MARIA ZILMA EUCLIDES DOS SANTOS,JOSIVALDO BATISTA PEREIRA,29/11/1992,Sem erro
20636,2700201,MARIZELDA WILMA DOS SANTOS AMARAL,JOVEILDA COSTA,27/08/1946,Sem erro
20638,2700201,MAXWEL RODRIGUES DA SILVA,JOYCE YARA FERREIRA BARROS,27/06/1962,Sem erro
20640,2700201,MONICA DA SILVA SIQUEIRA,JUAREZ MANOEL PEDRO,27/12/1951,Sem erro
20641,2700201,NADIEGE DO NASCIMENTO DOS SANTOS,JUCI CLEIDE TEIXEIRA DOS SANTOS,28/10/1924,Sem erro
20643,2700201,NATHALY SANTOS DA SILVA,JULIANA BARBOSA CHAGAS,15/09/1995,Sem erro
20647,2700201,QUITERIA DOS SANTOS,JULIANA SILVA NERY,18/11/1959,Sem erro
20648,2700201,QUITERIA MARIA DOS SANTOS,JULIANA TENORIO DOS SANTOS,21/04/1990,Sem erro
20650,2700201,RAYANE DA SILVA DE CERQUEIRA,JULIETE DA SILVA SANTOS,23/11/2000,Sem erro
20651,2700201,RAYANE LUCENA CLAUDINO,KAMYLLA MARCELA LIRA DA SILVA,13/10/2012,Sem erro
20652,2700201,REGINA FERREIRA DA ROCHA,KARLA CRISTIANE KECE CORDEIRO,22/12/1953,Sem erro
20654,2700201,ROSANA MATIAS DOS SANTOS,KAROLAYNE BARBOSA TAVARES,31/03/2003,Sem erro
20655,2700201,ROSELI DE MELO OLIVEIRA,KATIANE ALVES PINTO,14/11/2001,Sem erro
20657,2700201,ROSENILDO DA CONCEICAO DOS SANTOS,KATIANE GOMES VIEIRA,03/01/2014,Sem erro
20661,2700201,SANDRA MARIA DOS SANTOS,KECIA GONCALVES DA SILVA,05/12/1970,Sem erro
20663,2700201,SILEIA TARGINO DOS SANTOS,KELLY CRISTINA GOMES BATISTA,20/04/1997,Sem erro
20664,2700201,SILVANA DOS SANTOS SOUZA,KESIA VIEIRA SIQUEIRA,02/08/1995,Sem erro
20666,2700201,TAIS CORREIA DA SILVA,LAIS DA CONCEICAO SILVA,17/10/1977,Sem erro
20669,2700201,TELMA DOS SANTOS MELO,LAIS KELLY QUIRINO DA SILVA,22/02/1989,Sem erro
20670,2700201,THAIS MARIANA OLIVEIRA DE ARAUJO,LAIS TENER LIMA,29/09/1973,Sem erro
20671,2700201,THALIA DE SOUZA LIMA,LARISSA APARECIDA DOS SANTOS CAMPOS,21/02/1951,Sem erro
20672,2700201,VALDENICE EUGENIO DOS SANTOS,LARISSA CAROLINE DA SILVA LUCAS PEREIRA,03/01/1955,Sem erro
20676,2700201,VANESSA FEITOSA DA SILVA GOMES,LARISSA MORGANNA ALVES DOS SANTOS,17/02/2020,Sem erro
20678,2700201,VIVIANE DA CONCEICAO SANTOS,LARISSE BRUNA DOS SANTOS SILVA BEZERRA,16/12/1984,Sem erro
20681,2700300,ACACIA PEREIRA DOS SANTOS,LASIA MALTA CAVALCANTE,21/09/2018,Sem erro
20684,2700300,ADRIANA DA PAZ NASCIMENTO,LEANDRO OLIVEIRA SILVA,21/11/1961,Sem erro
20687,2700300,ADRIANA DO NASCIMENTO SILVA,LEILANY BRITO DA SILVA,31/07/1931,Sem erro
20689,2700300,ADRIANA DUARTE DA SILVA NEVES,LENICE VIEIRA SANTOS,01/06/1973,Sem erro
20694,2700300,ADRIANY DOS SANTOS FRIZZERA,LIDIANE BARBOZA DA SILVA ARAUJO,19/07/1987,Sem erro
20695,2700300,ADRIELE CABRAL ARAUJO TORRES,LIDIANE PEREIRA SANTOS,25/05/1956,Sem erro
20700,2700300,AFRA VITORIA DAMASCENO DOS SANTOS,LILIANA ALVES DA SILVA,05/12/2002,Sem erro
20702,2700300,ALAIDE PEREIRA SANTOS,LILIANE DA SILVA BARBOSA,04/06/1941,Sem erro
20707,2700300,ALESANDRA PEREIRA DA SILVA,LINDINALVA BATISTA DA SILVA,10/09/1982,Sem erro
20709,2700300,ALESSANDRA SOUZA E SILVA,LINDINALVA MIRENE DE LIMA,24/10/1963,Sem erro
20715,2700300,ALICIA ARAUJO DA SILVA,LUCIA EVARISTO DE OLIVEIRA,14/11/1949,Sem erro
20717,2700300,ALINE CARLA DOS SANTOS,LUCIANA DOS SANTOS PINHEIRO,06/01/1953,Sem erro
20718,2700300,ALINE FERREIRA DA SILVA ALVES,LUCIANA PEREIRA DOS SANTOS,26/07/1988,Sem erro
20719,2700300,ALINE JESSICA ALVES DOS SANTOS,LUCIANA SILVA DE SOUZA,31/08/1942,Sem erro
20727,2700300,AMANDA BARBOSA DE MAGALHAES,LUCIENE MARTINS SILVA,16/05/1979,Sem erro
20731,2700300,AMANDA SILVA DOS SANTOS,LUCIMAR SARAPIAO DA SILVA,06/09/1961,Sem erro
20733,2700300,ANA CARLA DA SILVA,LUCINEIDE DA SILVA BARBOSA,14/05/1968,Sem erro
20736,2700300,ANA CLAUDIA ALVES XAVIER,LUZIA GONSALVES SANTANA,23/05/1949,Sem erro
20739,2700300,ANA CLAUDIA ROCHA SILVA,LUZINEIDE FERREIRA DA SILVA,10/08/1985,Sem erro
20740,2700300,ANA CLECIA DIAS DE OLIVEIRA,LUZINETE LINO DA SILVA,27/07/1984,Sem erro
20742,2700300,ANA CLEDJA DANTAS,MAELY MELO DA SILVA,29/12/1932,Sem erro
20743,2700300,ANA CLEIA SOARES DA SILVA,MAGNA MONSUETO SANTOS,03/06/1994,Sem erro
20745,2700300,ANA CRISTINA OLIVEIRA ARAUJO,MAISA MARIA DOS SANTOS,06/10/1991,Sem erro
20749,2700300,ANA LECIA SILVA DE FARIAS,MARCELA DA SILVA OLIVEIRA,25/09/1956,Sem erro
20750,2700300,ANA LUCIA BARBOSA DOS SANTOS,MARCELA FELIX DE LIMA,07/10/1969,Sem erro
20751,2700300,ANA LUCIA CARVALHO VIEIRA,MARCELA OLIVEIRA DA SILVA,31/01/1992,Sem erro
20752,2700300,ANA LUCIA DA SILVA OLIVEIRA,MARCELA SOARES DA SILVA,14/01/1991,Sem erro
20755,2700300,ANA LUCIA VIEIRA,MARCIA CRISTINA NASCIMENTO DA SILVA TAVA,29/04/1942,Sem erro
20758,2700300,ANA MARIA ARAUJO DA SILVA,MARCIA MARIA DA SILVA,21/03/1933,Sem erro
