ID,COD_MUNICIPIO,NOME,NOME_RESPONSAVEL,data_nasc,Tipo_erro
19583,1200609,LAURIVANIA BRAGA DA SILVA,JOSIANE DIAS DOS SANTOS,02/12/1986,Sem erro
19585,1200609,LEILA MARIA DA SILVA GOMES,JOSINEIDE DA CONCEICAO,06/11/1963,Sem erro
19587,1200609,LENIR ROSA DA SILVA,JUCELIA DA CONCEICAO DOS SANTOS,22/08/1999,Sem erro
19588,1200609,LIANE CASTRO LIMA,JULIENE MARTINS DA CONCEICAO,19/04/1927,Sem erro
19590,1200609,LORRAINA OLIVEIRA MACHADO,LAIS DOS SANTOS NASCIMENTO,13/11/1962,Sem erro
19591,1200609,LUCENIR RODRIGUES MOREIRA,LAIS LIMA SILVA,12/09/1943,Sem erro
19597,1200609,LUIZ DOS SANTOS,LIDIANE DA SILVA DOS SANTOS SIQUEIRA,30/05/2003,Sem erro
19598,1200609,LUSANIRA DA SILVA E SILVA,LIDIANE RODRIGUES DA CONCEICAO TEIXEIRA,05/02/2007,Sem erro
19601,1200609,LUZIANE DA SILVA NASCIMENTO,LINDIANE ALVES VIEIRA,11/07/1932,Sem erro
19602,1200609,LUZIMAR AGUIAR FREIRE,LIVIA MARIA DA SILVA GAIA MALAQUIAS,04/05/2018,Sem erro
19604,1200609,MALUMA FABRICIO FONTINELE,LUCELIA MENDES DOS SANTOS,19/07/2002,Sem erro
19605,1200609,MAMEDE FERNANDES CHAIM,LUCIANA PEREIRA DE ANDRADE DO NASCIMENTO,25/03/1975,Sem erro
19609,1200609,MARCIA DE OLIVEIRA,LUCIENE DOS SANTOS,01/12/1959,Sem erro
19610,1200609,MARCILIO JONATAN SOUZA DA PAIXAO,LUCIMAR FEITOZA ALVES,20/06/1957,Sem erro
19611,1200609,MARCOS SOUZA MIRANDA,LUCINEIA GONCALVES DOS SANTOS,06/09/1980,Sem erro
19612,1200609,MARIA ADELAIDE DA SILVA BRANDAO,LUCRECIA BARROS PEREIRA,17/05/1989,Sem erro
19616,1200609,MARIA ALCIRENE AUGUSTINO DA SILVA,MAIARA VIEIRA ARAUJO,27/10/2015,Sem erro
19617,1200609,MARIA ALDERLANDIA DA SILVA TEIXEIRA,MAISA DE SOUZA LOPES,01/05/1979,Sem erro
19618,1200609,MARIA ALDINHA RODRIGUES DA SILVA,MANOEL MESSIAS DA CONCEICAO,03/01/1981,Sem erro
19619,1200609,MARIA ALZELINA DE OLIVEIRA SILVA,MANOEL MESSIAS DA CONCEICAO,29/01/1966,Sem erro
19624,1200609,MARIA ANTONIA DA LIBERDADE MELO DE LIMA,MARCIA DOS SANTOS,07/07/1952,Sem erro
19625,1200609,MARIA ANTONIA DA PAIXAO FARIAS,MARIA ADRIANA HENRIQUE LACERDA,07/05/1933,Sem erro
19626,1200609,MARIA ANTONIA DE LIMA SILVA,MARIA APARECIDA DA SILVA,16/09/1949,Sem erro
19627,1200609,MARIA ANTONIA FERREIRA SILVA,MARIA APARECIDA DE MATOS E SILVA,01/11/2000,Sem erro
19628,1200609,MARIA ANTONIA RODRIGUES ARAUJO,MARIA APARECIDA DOS SANTOS,04/12/1970,Sem erro
19629,1200609,MARIA ANTONIA SABOIA KAXINAWA,MARIA APARECIDA DOS SANTOS MANOEL LOPES,15/06/1983,Sem erro
19630,1200609,MARIA APARECIDA CAVALCANTE DE LIMA,MARIA APARECIDA FERREIRA DOS SANTOS,25/10/1946,Sem erro
19631,1200609,MARIA APARECIDA DA SILVA,MARIA APARECIDA FERREIRA DOS SANTOS DE A,09/11/2019,Sem erro
19632,1200609,MARIA APARECIDA DA SILVA LUZ,MARIA APARECIDA GOMES DE SOUZA,22/07/1965,Sem erro
19635,1200609,MARIA AUCINEIA SOUSA NASCIMENTO,MARIA APARECIDA MEDEIROS DA SILVA,17/03/1931,Sem erro
19637,1200609,MARIA AUXILIADORA DA CONCEICAO,MARIA APARECIDA SANTOS LIMA,20/07/1960,Sem erro
19639,1200609,MARIA CENIRA SOUZA DA SILVA,MARIA CARDEAL FILHO,08/10/1924,Sem erro
19640,1200609,MARIA CERRADI NASCIMENTO DE LIMA,MARIA CELIA DE SOUZA DOS SANTOS,19/09/1998,Sem erro
19643,1200609,MARIA CONCEBIDA DA SILVA E SILVA,MARIA CICERA DOS SANTOS DE SOUZA,20/11/2006,Sem erro
19644,1200609,MARIA CRISTIELE SILVA,MARIA CLARA DA SILVA FARIAS,30/03/1992,Sem erro
19645,1200609,MARIA CRISTINA MARTINS KAXINAWA,MARIA CLAUDIA LOPES TAMANDARE LIMA,08/04/2014,Sem erro
19647,1200609,MARIA DA CRUZ NASCIMENTO DE SOUZA,MARIA CLEONICE DA SILVA LEMOS,06/03/1933,Sem erro
19649,1200609,MARIA DA GLORIA DE PAIVA ARAUJO,MARIA CRISTINA ALVES DA SILVA,11/07/2000,Sem erro
19650,1200609,MARIA DA LIBERDADE CORREIA DA SILVA,MARIA CRISTINA ALVES DA SILVA,21/12/1943,Sem erro
19652,1200609,MARIA DA LIBERDADE DA SILVA FERRAZ,MARIA DA CONCEICAO,18/04/2020,Sem erro
19653,1200609,MARIA DA LIBERDADE DE AMORIM KAXINAWA,MARIA DA CONCEICAO DOS SANTOS DA SILVA,17/09/1947,Sem erro
19654,1200609,MARIA DA LIBERDADE DE NAZARE ROSAS,MARIA DA CONCEICAO GOMES,25/05/1959,Sem erro
19656,1200609,MARIA DA LIBERDADE MENDES DA SILVA,MARIA DA CONCEICAO GOMES DE SOUZA,17/07/2017,Sem erro
19657,1200609,MARIA DA LIBERDADE VIEIRA PERES,MARIA DA CONCEICAO HOLANDA DE QUEIROZ,08/05/1953,Sem erro
19659,1200609,MARIA DAS CHAGAS DE MESQUITA SOUZA,MARIA DA CONCEICAO SANTOS FILHA,01/11/1973,Sem erro
19660,1200609,MARIA DAS DORES AIRES DA SILVA,MARIA DA SAUDE DOS SANTOS,02/04/1999,Sem erro
19661,1200609,MARIA DAS DORES CARNEIRO DE LIMA,MARIA DA SAUDE VIEIRA DA SILVA,08/02/1955,Sem erro
19662,1200609,MARIA DAS GRACAS DE PAIVA,MARIA DA SILVA DE BARROS,10/06/2010,Sem erro
19665,1200609,MARIA DE FATIMA DOS SANTOS SOUZA,MARIA DAS DORES DOS SANTOS,25/01/1928,Sem erro
19668,1200609,MARIA DE FATIMA MAPES DE OLIVEIRA,MARIA DAS GRACAS CRISPIM,22/01/2021,Sem erro
19671,1200609,MARIA DE JESUS DO CARMO PEREIRA,MARIA DAS GRACAS FEITOSA DOS SANTOS,28/09/1957,Sem erro
19676,1200609,MARIA DO LIVRAMENTO BISPO SOUZA,MARIA DE FATIMA NUNES DOS SANTOS,21/09/2014,Sem erro
19678,1200609,MARIA DO LIVRAMENTO GERMANO,MARIA DE LOURDES DO NASCIMENTO,02/08/1924,Sem erro
19682,1200609,MARIA ELIANE DE PAIVA CARVALHO,MARIA EDJANE DOS SANTOS,03/07/1941,Sem erro
19683,1200609,MARIA ELISANGELA ARAUJO DE FIGUEREDO,MARIA EDUARDA DOS SANTOS TEODORO,09/03/2017,Sem erro
19684,1200609,MARIA ERENILDA MARCELINO KAXINAWA,MARIA ELCILENE DE JESUS SANDES,23/04/1932,Sem erro
19687,1200609,MARIA FRANCILDE DE OLIVEIRA MACHADO,MARIA ERNANDA DA SILVA BARROS,24/10/2021,Sem erro
19688,1200609,MARIA FRANCILENE ABREU DA SILVA,MARIA ERNANDA DA SILVA BARROS,27/07/1979,Sem erro
19689,1200609,MARIA FRANCILENE SOUZA DA SILVA,MARIA FLAVIANA DA SILVA,20/05/2001,Sem erro
19690,1200609,MARIA FRANCINILDA CONCEICAO DA SILVA,MARIA FRANCISCA DA CONCEICAO,08/07/1971,Sem erro
19691,1200609,MARIA FRANCISCA BRASIL DA SILVA,MARIA GISELMA LIMA,23/01/1990,Sem erro
19693,1200609,MARIA FRANCISCA FERREIRA DA SILVA,MARIA GONCALINA DOS SANTOS DA CONCEICAO,21/02/2011,Sem erro
19695,1200609,MARIA FRANCISCA SOUZA ALVES DE CARVALHO,MARIA GORETE DE OLIVEIRA LIMA DOS SANTOS,14/12/2022,Sem erro
19696,1200609,MARIA GEANE DA SILVA SOUZA,MARIA GRACIELA DA SILVA,03/06/1925,Sem erro
19700,1200609,MARIA IDELILDA RODRIGUES DA SILVA,MARIA HOSANA PEREIRA DE ARAUJO,19/11/1999,Sem erro
19701,1200609,MARIA IONA OLIVEIRA DA COSTA,MARIA IRENE SALVIANA BATISTA,31/03/1966,Sem erro
19702,1200609,MARIA IRISMAR GOMES DA CONCEICAO,MARIA ISABELA DE SOUZA DA SILVA,24/02/1974,Sem erro
19704,1200609,MARIA ISABELY OLIVEIRA DA SILVA,MARIA IVANILDA DE SA FERREIRA,20/05/1987,Sem erro
19706,1200609,MARIA JECILDA RODRIGUES DA SILVA,MARIA IZABEL DOS SANTOS BARROS,13/01/2004,Sem erro
19709,1200609,MARIA JOSE DA SILVA SOUZA,MARIA JOSE CRISPIM DE ANDRADE,16/01/1991,Sem erro
19710,1200609,MARIA JOSE DE CASTRO FREITAS,MARIA JOSE DA CONCEICAO NUNES DA SILVA,30/08/1951,Sem erro
19711,1200609,MARIA JOSE DE MOURA,MARIA JOSE DA SILVA,03/02/1924,Sem erro
19712,1200609,MARIA JOSE DE OLIVEIRA LIMA,MARIA JOSE DA SILVA SANTOS LIMA,24/02/1950,Sem erro
19715,1200609,MARIA JOSE MARQUES FERREIRA,MARIA JOSE DE SOUZA,27/10/2003,Sem erro
19718,1200609,MARIA JUCELIA FERREIRA SILVA,MARIA JOSE RICARDO DOS SANTOS,26/04/2007,Sem erro
19719,1200609,MARIA KESIANE SOUZA DE FRANCA,MARIA LIMA BARROS,24/07/1960,Sem erro
19721,1200609,MARIA LIBERDADE BRAGA DA SILVA,MARIA LUCIA BATALHA DOS SANTOS,07/08/1981,Sem erro
19722,1200609,MARIA LIBERDADE DA CRUZ SILVA,MARIA LUCIA DE MELO LIMA,20/04/1935,Sem erro
19724,1200609,MARIA LIBERDADE LIMA DA CONCEICAO,MARIA LUCIANA DOS SANTOS,19/11/1938,Sem erro
19725,1200609,MARIA LIBERDADE NOGUEIRA DA SILVA,MARIA LUCIENE DA SILVA,14/02/2012,Sem erro
19726,1200609,MARIA LIBERDADE PAULINO MAIA,MARIA LUCINEIDE BARROS,31/05/1952,Sem erro
19728,1200609,MARIA LUCIANE EVANGELISTA DO NASCIMENTO,MARIA NUBIA DE LIMA DANTAS SILVA,28/07/1933,Sem erro
19729,1200609,MARIA LUIZA BORGES DE OLIVEIRA,MARIA REGINA PORFIRO DA SILVA,14/05/1993,Sem erro
19731,1200609,MARIA LUZINETE DOS SANTOS PEREIRA,MARIA RITA DE LIMA CORREA,20/12/2014,Sem erro
19733,1200609,MARIA MARILENE GOMES DE LIMA,MARIA ROSILDA LIMA CONCEICAO,22/01/1946,Sem erro
19739,1200609,MARIA NAZILEIDE SILVA DE LIMA,MARIA ZULEIDE DOS SANTOS,08/07/2013,Sem erro
19741,1200609,MARIA NILZA DE SALES DOS SANTOS,MARILENE DA CONCEICAO DE BARROS,06/07/1978,Sem erro
19746,1200609,MARIA ROSA SOARES DOMINGOS,MARINES RICARDO GONCALVES,29/08/1934,Sem erro
19747,1200609,MARIA ROSANGELA DO NASCIMENTO LIMA BILO,MARINEUSA GOMES LIMA,13/08/1965,Sem erro
19749,1200609,MARIA ROSANGELA SILVA DE MOURA,MARISANGELA RODRIGUES GUIMARAES,13/09/1999,Sem erro
19753,1200609,MARIA ROSIMEIRE DA SILVA LIMA,MARLENE RODRIGUES DA CRUZ,08/07/1995,Sem erro
19756,1200609,MARIA SANTISSIMA DE LIMA FERREIRA,MARTA DE ALMEIDA DA SILVA,25/09/1932,Sem erro
19757,1200609,MARIA SEBASTIANA FEITOZA ROCHA,MASCIENE DE BARROS SANTOS,17/07/2002,Sem erro
19758,1200609,MARIA SIMONE MARTINS MOURA,MAXCILEIDE DOS SANTOS MELO,05/06/1996,Sem erro
19764,1200609,MARIA VANEIDE DE ARAUJO REGO,MILENE DA CONCEICAO,06/06/1969,Sem erro
19765,1200609,MARIA VANUSA DE OLIVEIRA DOS SANTOS,MONALISA DA SILVA DOS SANTOS,16/07/2005,Sem erro
19766,1200609,MARIA ZAIDA FERREIRA CAVALCANTE,NADJARA DA CONCEICAO DOS SANTOS,21/05/1935,Sem erro
19767,1200609,MARICELIA DA SILVA ALBUQUERQUE,NATALIA BRAZ DA SILVA,13/07/2015,Sem erro
19768,1200609,MARICELIA FALCAO DA SILVA,NATALIA LOPES DE SOUZA,30/04/1977,Sem erro
19769,1200609,MARIENE DANTAS DOS SANTOS,NEIDE DE SOUZA,02/10/2015,Sem erro
19770,1200609,MARILENE LIMA DA SILVA,NEUZA BEZERRA DOS SANTOS,21/08/1942,Sem erro
19771,1200609,MARILETE LIMA TABOSA,PAMELA APARECIDA DA SILVA DIAS,17/04/1966,Sem erro
19773,1200609,MARILUCE DA SILVA FERREIRA,PATRICIA DOS SANTOS DE LIMA,28/10/1970,Sem erro
19774,1200609,MARINALDA PINTO DE SOUZA,PAULA CRISTIANE DE SOUZA SANTOS,15/04/1927,Sem erro
19775,1200609,MARINES DE OLIVEIRA SANTOS,PAULEANA OLIVEIRA DOS SANTOS,21/07/1957,Sem erro
19776,1200609,MARINETE DE LIMA FERREIRA,PAULO DAMASCENO DO NASCIMENTO,24/04/2007,Sem erro
19777,1200609,MARINETE SILVA DO VALE,PEDRO MIGUEL DOS SANTOS DA CONCEICAO,27/09/1960,Sem erro
19778,1200609,MARISETE OLIVEIRA BEZERRA,PRISCILA SOUZA SILVA,28/01/2012,Sem erro
19779,1200609,MARIVANIO DE OLIVEIRA SILVA,QUITERIA DA CONCEICAO SANTOS,17/09/1972,Sem erro
19780,1200609,MARIZETE ALVES DA SILVA BRANDAO,QUITERIA DOS SANTOS TEODORO,23/08/1956,Sem erro
19782,1200609,MARLUCE FERREIRA BEZERRA,QUITERIA MARIA DA CONCEICAO CARDEAL,06/09/1927,Sem erro
19784,1200609,MILENA DE SOUZA LIMA,QUITERIA SANTANA DOS SANTOS,06/01/1938,Sem erro
19785,1200609,MIRACELIA VIANA SOUZA,QUITERIA VIEIRA DE BARROS,31/10/2021,Sem erro
19786,1200609,MIRIANE LOPES DE MESQUITA,RAFAELA FEITOZA DOS SANTOS LIMA,25/01/2000,Sem erro
19787,1200609,MISAEL ROQUE DE OLIVEIRA,RAFAELLA CRYSTINA DANTAS BARROS,01/05/2013,Sem erro
19788,1200609,NAIANE DE OLIVEIRA ALVES,RAQUEL ALVES DE LIMA,14/04/1926,Sem erro
19790,1200609,NATHANIA LEITE DE OLIVEIRA,REGINA SOUZA DA SILVA,02/11/1992,Sem erro
19792,1200609,NEUZELI MENDES DOS SANTOS,RITA DE CASSIA DA SILVA TELES,15/06/1972,Sem erro
19793,1200609,NIEDA FERREIRA,RITA DE CASSIA LOPES DE QUEIROZ,20/03/1942,Sem erro
19795,1200609,NILDA GOMES FREITAS,ROBELANE MARIA DA SILVA SANTOS,28/03/1931,Sem erro
19798,1200609,ORNELIA FREIRE DA SILVA,ROSANA DOS SANTOS BARBOSA,16/08/2021,Sem erro
19799,1200609,PALOMA SOUZA DA SILVA,ROSANGELA RODRIGUES DOS SANTOS MALAQUIAS,28/10/1936,Sem erro
19800,1200609,PAULA TASIA DA SILVA NASCIMENTO,ROSEANE BARBOSA DOS SANTOS SOUZA,18/02/1939,Sem erro
19802,1200609,QUETIA AGUIAR FREIRE,ROSEANE DA CONCEICAO MONTEIRO,12/08/1959,Sem erro
19806,1200609,RAIMUNDA DE SA GOMES,ROSENILDE DOS SANTOS PEREIRA,09/06/2005,Sem erro
19807,1200609,RAIMUNDA DULCILA MELO LEAO,ROSIANE DA SILVA,15/03/1982,Sem erro
19808,1200609,RAIMUNDA NONATA DA SILVA,ROSIELMA DE AQUINO,16/04/1931,Sem erro
19810,1200609,RAIMUNDA RESPLANDE RIBEIRO,ROSILENE DE JESUS VIEIRA LIMA,11/08/1977,Sem erro
19811,1200609,RAIMUNDA SILVA DOS SANTOS,ROSILENE DE JESUS VIEIRA LIMA,18/07/1934,Sem erro
19813,1200609,RAIMUNDO NONATO PEREIRA DO CARMO,ROSIMEIRE FERNANDES CORREIA,23/04/1976,Sem erro
19814,1200609,RAMAYANA VITORIA SANTOS VIANA,ROSINEIDE DE MELO DA CONCEICAO SOARES,19/11/2016,Sem erro
19821,1200609,ROSANGELA DA SILVA ALVES KATUKINA,SALETE MARIA DA SILVA,30/07/2000,Sem erro
19822,1200609,ROSANGELA MOURA DE SOUZA,SAMIRA GOMES DA SILVA,03/06/1997,Sem erro
19823,1200609,ROSIMERE DE OLIVEIRA DA SILVA,SANDE MANUELA TEIXEIRA DOS SANTOS,22/01/1974,Sem erro
19824,1200609,RUANNA DA SILVA ARAUJO,SANDRA DA CONCEICAO NUNES CAVALCANTE,05/05/1927,Sem erro
19826,1200609,SABRINA MONTEIRO MAIA,SELMA MARIA DE JESUS MALAQUIAS LIMA,02/06/2013,Sem erro
19827,1200609,SAIURA DA SILVA GAMA,SELMA RODRIGUES MALAQUIAS,30/08/1956,Sem erro
19828,1200609,SAMARA SOUZA VIANA,SENIVAL RODRIGUES DOS SANTOS,27/02/1955,Sem erro
19833,1200609,SEBASTIAO DE OLIVEIRA ALVES,SILVANA NUNES DOS SANTOS,16/01/1981,Sem erro
19834,1200609,SEBASTIAO LIMA DA SILVA,SILVANIA BEZERRA NASCIMENTO,16/09/1986,Sem erro
19836,1200609,SILVANIA DA SILVA COSTA,SILVANIA MARIA DOS SANTOS,25/01/1931,Sem erro
19840,1200609,STEPHANE GOMES RODRIGUES,SIVISLAINE PORFIRIO DE BARROS,21/02/1949,Sem erro
19842,1200609,SUELY BEZERRA GOMES,SOLANGE FEITOZA DE BARROS DOS SANTOS,04/03/2019,Sem erro
19843,1200609,TAILEIA RODRIGUES DE LIMA,SONIA DO SANTOS RODRIGUES MALAQUIAS,14/04/1984,Sem erro
19844,1200609,TALINE OLIVEIRA DE SOUZA,TAMIRES DA CRUZ SOUZA,13/04/2015,Sem erro
19845,1200609,TAMIRES YAWANAWA PEQUENO,TAMIRES RODRIGUES GOMES,07/11/1924,Sem erro
19846,1200609,TANIA PEREIRA DA SILVA,TATIELE DA SILVA DANTAS,13/03/1961,Sem erro
19847,1200609,TEREZINHA DE OLIVEIRA,VALDELICE LIMA DE FIGUEIREDO,13/02/1968,Sem erro
19848,1200609,THAIS MELO DA SILVA,VALDETE GONCALVES,29/06/2016,Sem erro
19849,1200609,VALCENIR SILVA CARNEIRO,VALDINETE MARIA DOS SANTOS,06/03/1961,Sem erro
19856,1200609,VANILCE DE FREITAS CASTRO,VANESSA DOS SANTOS DA CONCEICAO SILVA,02/04/1989,Sem erro
19859,1200609,VICENTE HENRIQUE CARIOCA,VANUSA SOARES DE BARROS TAVARES,15/11/1969,Sem erro
19861,1200609,YARA NIELE FERREIRA SOUZA,VERA LUCIA LIMA DOS SANTOS SILVA,12/08/1975,Sem erro
19862,1200609,ZENEIDE DA SILVA MARQUES,VILMA ANDRADE DOS SANTOS DA SILVA,09/03/1992,Sem erro
19863,1200708,ADRIANA MARTINS VIEIRA,VITORIA ALVES DOS SANTOS,28/05/1985,Sem erro
19865,1200708,AILKE DE SOUZA BRITO,VIVIANE ALVES DOS SANTOS,30/08/1990,Sem erro
19866,1200708,ALCINEIA PEREIRA DE QUEIROS,VIVIANE DAMASCENO DOS SANTOS,06/12/2019,Sem erro
19867,1200708,ALCIONE DE SOUZA RAMALHO,VIVIANE DAMASCENO DOS SANTOS,04/07/1939,Sem erro
19869,1200708,ANACLEIA FERREIRA BARBOSA,ADMILSON SILVA GAMA,16/09/1957,Sem erro
19870,1200708,ANDREIA LOPES RIBEIRO,AILTON JOSE PEREIRA FREITAS JUNIOR,20/06/2013,Sem erro
19873,1200708,ANDRESSA TEIXEIRA DOS SANTOS,ANA CLAUDIA DA SILVA DA CONCEICAO,02/03/1993,Sem erro
19874,1200708,ANE BEATRIZ NASCIMENTO SAMPAIO,ANA ELE GOMES DOS SANTOS,11/01/1938,Sem erro
19875,1200708,ANTONIA ANGELO DA SILVA,ANA LUCIA DA SILVA DA CONCEICAO,25/12/1970,Sem erro
19876,1200708,ANTONIA ELIANE DE SOUZA SANTIAGO,ANA LUCIA DOS SANTOS DA SILVA,18/04/1947,Sem erro
19879,1200708,ANTONIA PEREIRA DE ARAUJO,ANGELA MARIA DOS SANTOS,18/07/1988,Sem erro
19880,1200708,ANTONIA PINHEIRO PEREIRA,ANTONIO CARLOS DA SILVA,13/07/2013,Sem erro
19882,1200708,AUDINEIA DO NASCIMENTO LACERDA,BEATRIZ DA ROCHA,26/10/1966,Sem erro
19886,1200708,CLEONICE CARMO DOS SANTOS,CARLOS HENRIQUE DOS SANTOS DO NASCIMENTO,24/10/1989,Sem erro
19887,1200708,CLEUCIANE REZENDE MARTINS,CARLOS JOSE DA SILVA,31/03/2021,Sem erro
19888,1200708,CLEUCIMAR GOMES DA SILVA,CICERO ARISTIDES DOS SANTOS,12/12/1972,Sem erro
19890,1200708,CRISTIELE PEREIRA LIMA,CICERO LUCIANO DA SILVA,27/05/1970,Sem erro
19891,1200708,CRISTINA ELIZABETE ROQUE DE LIMA,CLAUDIANA DA SILVA PALMEIRA,08/01/1969,Sem erro
19893,1200708,DEIDE DE AMORIM ROCHA,CLAUDIVANIA DOS SANTOS DE OLIVEIRA,23/12/2016,Sem erro
19896,1200708,EDINA FERREIRA DE MELO,CRISTIANO FIRMINO DOS SANTOS,28/03/2009,Sem erro
19898,1200708,EDINUSSIA BARBOSA LIMA,DAYANE DA SILVA CORREIA VILELA,20/04/1935,Sem erro
19899,1200708,EDIVAN LIRA DA CONCEICAO,DINORA MARIA SANTOS DO NASCIMENTO,17/03/1987,Sem erro
19900,1200708,EDNA GOMES DE FREITAS,EDILSON DOS SANTOS SILVA,13/03/1977,Sem erro
19902,1200708,ELAINE FLOR DA SILVA SOUZA,EDINEIDE FERREIRA GONZAGA,04/02/1924,Sem erro
19903,1200708,ELICA BRITO DA SILVA,EDNALDO GOMES DA SILVA,28/03/1940,Sem erro
19905,1200708,ELISANGELA SEVERINO MENDONCA,ELISANGELA DA SILVA DE SOUZA,02/05/2012,Sem erro
19910,1200708,ESMERALDA ALVES LIMA,ERIVALDO CARMO DA SILVA,03/12/1932,Sem erro
19912,1200708,EURICLEIA BARBOSA DE SOUZA,FABIO ASSUNCAO DA SILVA,23/08/1945,Sem erro
19914,1200708,FATIMA RODRIGUES DE CASTRO,GENILDA DOS SANTOS,02/02/1974,Sem erro
19916,1200708,FRANCILENE LUZ DA SILVA,GUILHERME DE CERQUEIRA SANTOS,14/06/1940,Sem erro
19918,1200708,FRANCIRLENE CONCEICAO DE OLIVEIRA,ILDA DA SILVA MOREIRA SANTOS,26/11/2022,Sem erro
19924,1200708,IDA SILVA DE ARAUJO,JOSE ALEX DOS SANTOS,15/10/1973,Sem erro
19926,1200708,INGLEDI DA SILVA FRANCO,JOSE ANTONIO DA SILVA NUNES,04/03/2009,Sem erro
19929,1200708,JARDE MOREIRA DE MOURA,JOSE EDMILSON DA SILVA SANTOS,04/10/1981,Sem erro
19930,1200708,JARDEANA DE SOUZA DOS SANTOS,JOSE ELISVALDO DA SILVA,17/04/1957,Sem erro
19932,1200708,JOCIMARA FERREIRA DA SILVA,JOSE NILVAN DO NASCIMENTO DOS SANTOS,11/03/2008,Sem erro
19934,1200708,JONIAS DA SILVA MOURA,JOSE RODOLFO DA SILVA CHAVES,18/08/1950,Sem erro
19936,1200708,JOSIANE GONCALVES DE OLIVEIRA,JOSE SILVESTRE DA SILVA,11/03/1994,Sem erro
19937,1200708,JOSIENE BATISTA DE SOUZA,JOSEFA CONCEICAO DO CARMO DO NASCIMENTO,02/01/2015,Sem erro
19942,1200708,JUCELIA DA CONCEICAO CARVALHO,JOSEFA MELO DA SILVA FERREIRA,11/04/2013,Sem erro
19944,1200708,JULIANA NASCIMENTO LIMA,JOSEFA VANESSA CORREIA DAS GRACAS,27/11/1990,Sem erro
19945,1200708,JULIANA TELES,JOSINEIDE DA CONCEICAO MARTINS DA SILVA,23/01/1985,Sem erro
19947,1200708,KELIN MATIELLO DE OLIVEIRA,JOVELINA DOS SANTOS,14/08/1926,Sem erro
19950,1200708,LINDAURA FERREIRA DA SILVA,JULIANA DOS SANTOS SILVA,28/07/1992,Sem erro
19954,1200708,MARCIA PEREIRA DA SILVA,LETICIA BRANDAO DA SILVA,11/08/1933,Sem erro
19955,1200708,MARCIANA ROZAS DE OLIVEIRA,LUANA DOS SANTOS FERREIRA,12/10/1990,Sem erro
19959,1200708,MARIA APARECIDA SILVA OLIVEIRA,LUIZ FERNANDO DA SILVA,28/01/1970,Sem erro
19962,1200708,MARIA DAS DORES REIS DE SOUZA,MARCELO MEIRELES SILVA,27/01/1953,Sem erro
19964,1200708,MARIA DAS GRACAS RODRIGUES DA ROCHA,MARIA APARECIDA DA SILVA BEZERRA,27/08/1977,Sem erro
19965,1200708,MARIA DE LOURDES NUNES FERNANDES,MARIA APARECIDA SILVA DOS SANTOS,04/01/1995,Sem erro
19966,1200708,MARIA DO SOCORRO DA SILVA ALVES,MARIA CICERA DA CONCEICAO DO NASCIMENTO,17/07/1924,Sem erro
19968,1200708,MARIA HELENA BATISTA CRUZ,MARIA CLAUDENICE DOS SANTOS VILELA,26/09/1953,Sem erro
19970,1200708,MARIA JOANA DA SILVA NASCIMENTO,MARIA DA PIEDADE DA CONCEICAO JUSTINO,05/10/1978,Sem erro
19971,1200708,MARIA JOANA FREITAS DE OLIVEIRA,MARIA DA PIEDADE DOS SANTOS,24/01/2002,Sem erro
19974,1200708,MARIA MARLENE FERREIRA DA SILVA,MARIA DA SOLIDADE BARBOSA DE SOUZA,12/06/1946,Sem erro
19976,1200708,MARIA SEBASTIANA DANTAS DA SILVA,MARIA DAMIANA MAXIMIANO DA SILVA,06/12/1973,Sem erro
19980,1200708,MARILEUDA REBOUCAS DA SILVA,MARIA DAS DORES DOS SANTOS,08/04/1991,Sem erro
19981,1200708,MARLENE OLIVEIRA SOUZA DE BRITO,MARIA DE FATIMA BISPO DA SILVA,16/08/2013,Sem erro
19982,1200708,MARTA DE LIMA FRAZAO,MARIA DE LOURDES DA SILVA,18/01/1982,Sem erro
19984,1200708,MESSIANE OLIVEIRA RODRIGUES,MARIA DO SOCORRO DOS SANTOS DE LIMA,16/04/1951,Sem erro
19986,1200708,NAIANE DA SILVA OLIVEIRA,MARIA FRANCILENE ROCHA SANTOS,11/11/2005,Sem erro
19987,1200708,NATAL RONER CARNEIRO DA SILVA,MARIA GISELIA CIRINO DE MESSIAS,25/03/1995,Sem erro
19991,1200708,RAESSA DO NASCIMENTO LUCAS,MARIA JOSE BARBOSA DA SILVA BRITO,17/10/2015,Sem erro
19992,1200708,RAIMAURA OLIVEIRA DE SOUZA SILVA,MARIA JOSE DA CONCEICAO DA SILVA,04/01/1929,Sem erro
19993,1200708,RAQUEL FERREIRA DA SILVA CAETANO,MARIA JOSE DOS SANTOS DE OLIVEIRA,05/07/1963,Sem erro
19994,1200708,RAQUEL SOUZA RIBEIRO,MARIA LAUANDA DA PAZ,16/07/1971,Sem erro
19996,1200708,ROSANA FERREIRA DE SOUZA,MARIA QUITERIA DOS SANTOS COSTA,04/02/1931,Sem erro
19998,1200708,ROSENILDA LIMA MAIA,MARIA ROSANGELA VIEIRA DOS SANTOS,13/12/1953,Sem erro
20005,1200708,SEBASTIAO PADILHA,MORGANA MARIA CONCEICAO SANTOS,14/12/2021,Sem erro
20006,1200708,SILVANIA PEREIRA DA SILVA,NADIEGE SANTOS DA CONCEICAO,13/09/2009,Sem erro
20007,1200708,SIRLEY GOMES DA SILVA,NORMAIRA DOS SANTOS SALES,27/08/1980,Sem erro
20009,1200708,SONAYRA REIS,PAULO RICARDO DOS SANTOS SILVA,03/10/2013,Sem erro
20013,1200708,VALQUIRIA SIQUEIRA NAVARRO,RAIMUNDA DOS SANTOS SILVA,16/11/1991,Sem erro
20014,1200708,VANETE SOUZA DA CUNHA,RAYANE LUCENA CLAUDINO,05/08/1973,Sem erro
20015,1200708,VANUSA LOPES DA SILVA,REGIANE FERREIRA DOS SANTOS,24/05/1990,Sem erro
20017,1200708,VILANIR LOPES OLIVEIRA,RITA DE CASSIA DA SILVA,25/03/1993,Sem erro
20018,2500106,ADAILMA DA SILVA SOUZA,ROGERIO DA CONCEICAO DOS SANTOS,30/08/1974,Sem erro
20021,2200202,ADIMILSON MOREIRA DA SILVA,ROSILMA ALEXANDRTE RAMOS DE MELO,20/11/1924,Sem erro
20022,2500106,ALDAIR VIEIRA DA SILVA,SANDRA DOS SANTOS SILVA,12/08/2020,Sem erro
20024,2500106,ALESSANDRA RAMALHO DA SILVA,TAIZE DOS SANTOS DE JESUS,03/03/1990,Sem erro
20026,2500106,ALESSANDRO DOS SANTOS,TAMIRIS DOS SANTOS,12/04/2020,Sem erro
20027,2500106,ALINE LOPES DOS REIS,TATIANA DOS SANTOS PALMEIRA GOMES,03/06/2012,Sem erro
20034,2200202,ANA RODRIGUES LIMA DA SILVA,VANIELE DA SILVA DA CONCEICAO,02/04/2013,Sem erro
20035,2700102,ANDRE DE SOUZA BAPTISTA,VANILZA DA SILVA NUNES,13/12/1928,Sem erro
20036,2500106,ANDRE LOPES DA SILVA,VERA LUCIA DOS SANTOS BARBOSA SILVA,25/08/1964,Sem erro
20040,2200202,ANDREA FERREIRA BATISTA,WELLINGTON CARLOS SALUSTIANO DA SILVA,10/08/1962,Sem erro
20042,2500106,ANDRESSA SOARES DE SOUSA DOS SANTOS,ADERBAL BRITO DE SENA,29/03/2020,Sem erro
20044,2700102,ANDREZA LIMA DE SOUZA,ADIZETE BATISTA DA SILVA,22/02/1988,Sem erro
20046,2500106,ANGELA DOS SANTOS LIMA,ADRIANA DA SILVA,23/09/2010,Sem erro
20049,2500106,ANGELITA DA SILVA BATISTA,ADRIANA DO NASCIMENTO SILVA,28/06/1924,Sem erro
20052,2700102,ANTONIO FRANCISCO DOS SANTOS,ADRIANA LIMA DA SILVA,08/12/1996,Sem erro
20054,2200202,BENEDITO PEREIRA DOS SANTOS,ADRIANA MARIA DA SILVA,23/04/1990,Sem erro
20055,2700102,BERENICE DOS SANTOS DE SOUZA,ADRIANA MARIA DESIDERIO DA SILVA,12/06/1975,Sem erro
20057,2500106,CAMILA VIEIRA DA SILVA,ADRIANA PEREIRA SANTOS SILVA,29/10/1979,Sem erro
20058,2200202,CAMILA VIEIRA DA SILVA,ADRIANA SILVANO DA SILVA,12/06/1994,Sem erro
20059,2700102,CELIANE DE SA SOARES,ADRIANA TELMA DA SILVA,20/01/1993,Sem erro
20060,2200202,CELINA OLIVEIRA DOS SANTOS,ADRIANO FARIAS DE LIMA,24/02/1965,Sem erro
20061,2500106,CICERO CARDEAL,ADRIANO LUIS BISPO DA SILVA,08/07/2013,Sem erro
20062,2200202,CICERO CARDEAL DE ANDRADE,ADRIELLE SANTOS MATIAS,24/09/1975,Sem erro
20067,2500106,CIDALIA DO NASCIMENTO,ALCIONE BEZERRA DE LIMA,28/05/1989,Sem erro
20070,2200202,CLARICE PEREIRA DOS SANTOS ARAUJO,ALDO DE MELO,28/06/1953,Sem erro
20071,2700102,CLAUDENI BARBOSA,ALESANDRA GRACINDO VIEIRA DA SILVA,26/01/1975,Sem erro
20072,2200202,CLAUDENI BARBOSA,ALESSANDRA ALVES BARBOSA FERREIRA,03/12/1980,Sem erro
20076,2700102,CLAUDIANE GRANGEIRO,ALEXANDRINA DE LIMA NOBRE SANTANA,27/01/2005,Sem erro
20080,2700102,CLEIDE DE MELO MALAQUIAS DA SILVA,ALINE DE MOURA TERTULINO,08/06/2005,Sem erro
20081,2700102,CLEONICE SOARES DA SILVA,ALINE DIAS FARIAS,13/04/2021,Sem erro
20082,2700102,CRISTIANE DOS SANTOS PEREIRA,ALINE LAYLA DOS SANTOS SILVA,22/09/1995,Sem erro
20088,2200202,DANIELA MORAES DA SILVA VIEIRA,ALTIMA GOMES DOS SANTOS,10/05/2005,Sem erro
20091,2700102,DELIDIA GOMES DE BARROS DOS SANTOS,AMANDA CRISTINE LIMA DA SILVA,09/11/1960,Sem erro
20093,2200202,DIONICE DOS SANTOS DA SILVA,AMANDA DE OLIVEIRA SILVA,11/07/1967,Sem erro
20096,2200202,EDILENE DOS SANTOS BARROS,AMANDA MENEZES PEREIRA,21/01/1949,Sem erro
20098,2500106,EDILEUZA DE LIMA DA SILVA,ANA ALICE CARDOSO DE LIMA,21/04/1941,Sem erro
20102,2500106,EDIVANIA SANDES DA SILVA FEITOSA,ANA CLAUDIA DOS SANTOS,08/01/1947,Sem erro
20103,2700102,EDJANE DA CONCEICAO DIAS,ANA CLAUDIA PEREIRA DE ARAUJO SANTOS,24/01/2002,Sem erro
20104,2500106,EDJANE DOS SANTOS DA SILVA,ANA CLAUDIA TENORIO SOARES,25/10/1945,Sem erro
20106,2700102,EDMERE DA SILVA LIMA,ANA EDJA DE CARVALHO SANTOS SOBRAL,22/03/1924,Sem erro
20108,2200202,EDNA MAIARA DA SILVA ANANIAS,ANA KELLY DA SILVA,29/12/2002,Sem erro
20111,2700102,ELAINE DA SILVA FEITOSA DANTAS,ANA LUCIA DA SILVA,27/12/2016,Sem erro
20113,2200202,ELIANE IZABEL PEREIRA,ANA LUCIA FELIX DA SILVA,26/06/1977,Sem erro
20114,2700102,ELIANE RODRIGUES MORAES LIMA,ANA LUCIA SOARES DOS SANTOS,22/11/2002,Sem erro
20115,2700102,ELIEGE DOS SANTOS DA COSTA,ANA MARIA DA SILVA,24/02/2008,Sem erro
20117,2700102,ELIENE DOS SANTOS DE BARROS,ANA PATRICIA BARBOSA DOS SANTOS,11/05/1924,Sem erro
20118,2500106,ELINE ALEXANDRE LIMA,ANA PAULA ALVES DOS SANTOS,12/03/1932,Sem erro
20120,2500106,ELIZABETE TEIXEIRA DOS SANTOS,ANA PAULA DA SILVA,02/06/2022,Sem erro
20123,2500106,ELIZETE VIEIRA DOS SANTOS,ANA PAULA DA SILVA PAIXAO,25/09/1979,Sem erro
20126,2500106,ELMA JANUARIO SANTOS,ANA PAULA DE OLIVEIRA,30/05/1989,Sem erro
20127,2700102,ELOILDE GONCALVES DOS SANTOS,ANA PAULA DIAS DA SILVA,07/12/2011,Sem erro
20128,2700102,ELYTANIA FIGUEIREDO DOS SANTOS,ANA PAULA DOS SANTOS,13/09/1960,Sem erro
20129,2500106,EPAULIANA DOS SANTOS FEITOZA,ANA PAULA LIMA DOS SANTOS,29/10/1925,Sem erro
20130,2700102,ERENICE DOS SANTOS OLIVEIRA DO NASCIMENT,ANA PAULA SANTOS DA SILVA,31/03/1934,Sem erro
20132,2500106,ERONILDA VENTURA DA SILVA RODRIGUES,ANA PAULA VIEIRA DE ALMEIDA,23/09/1960,Sem erro
20136,2500106,FABIANA GOMES FEITOSA,ANACLESE DA SILVA MACIEL,11/06/1946,Sem erro
20138,2500106,FABIANA TEIXEIRA DA PAZ,ANDALUZA SILVA DOS SANTOS,12/10/1990,Sem erro
20139,2200202,FABIANY DA CONCEICAO DOS SANTOS,ANDREA DA CONCEICAO SANTOS,22/09/1994,Sem erro
20142,2700102,FERNANDA DA CONCEICAO DOS SANTOS,ANDRESA DO NASCIMENTO MONTEIRO SANTOS,25/06/1992,Sem erro
