ID,COD_MUNICIPIO,NOME,NOME_RESPONSAVEL,data_nasc,Tipo_erro
18083,5107206,SANDRA MARA CUNHA DE OLIVERA,SUILA INGLES LINDOSO,29/12/1945,tipo 3
18087,1200401,SANDRA MARIA AGUIAR PINTO,ALEX FERNANDES CARVALHO,22/01/1971,tipo 3
18096,5107206,SANDSON FIGUEREDO DE MATOS,ANTONIA ELIÇE FERREIRA SABINO,25/02/2003,tipo 3
18099,5107206,SANMARA NASCIMENTO DE FRETAS ARAUJO,ANTONIO DEJAIR NEVES FRANCA,18/01/1949,tipo 3
18101,1200401,SARA JANES DE SOUSA VERCOSA,ANTONIO RAILSON OLIVERA DA SILVA,07/06/1973,tipo 3
18102,5107206,SARA MARIA LIMA DO NASCIMENTO,ANTONIO RONALDO ROCHA PINHO,04/08/1950,tipo 3
18106,1200401,SARA SOUSA DA SILVA,CHAIRA MAGALHAES PLACIDO,28/11/1978,tipo 3
18116,5107206,SEBASTIANNA BENTO DA SILVA,EGILA SANTANNA DE BARROS,11/08/1993,tipo 3
18128,1200401,SEBASTIAO VITURIANO DA SILVA,GECIANA GONCALVES DA SILVA,02/02/1959,tipo 3
18163,1200401,SIMONE CARLOS DE OLIVERA,MARIA ANTONIETA JANUARIO LIMA,11/08/1968,tipo 3
18179,5107206,SIVANILDO BESERRA DA SILVA,MARIA JOSE DA CONCECAO,06/09/1929,tipo 3
18208,1200401,SUSANI DA SILVA VASCONCELOS,RAIMUNDO NONATO SANTOS NEGREROS,02/01/2010,tipo 3
18218,1200401,TAIANA SILVA DE MENESES,SAIONARA MACEDO DOS SANTOS,14/02/1973,tipo 3
18219,1200401,TAIANE ALVES DA SILVA SANTOS,SEBASTIANA ALVES DE OLIVERA,28/04/1961,tipo 3
18244,5107206,TANIA MARIA CASTRO LEAO,IVANEDE BARBOSA DE ARAUJO,28/09/1956,tipo 3
18245,5107206,TANIA MARIA SILVA DE OLIVERA MESQUITA,ISAEL LOPES KAXINAWA,08/10/1940,tipo 3
18255,5107206,TATIANNA GOMES DO MONTE,LUCIVANIA DA SILVA CUNHA,24/02/1992,tipo 3
18273,1200401,TERESINHA CAMILO DOS SANTOS,TACIA TOREJON LEVE,20/02/2009,tipo 3
18289,1200401,THAIS CRISTINA DE SOUSA,AMAURY DA SILVA FRERE,29/12/1956,tipo 3
18304,1200401,THAUANNY ASEVEDO PINHEIRO,ANGELA MARIA SOUSA CELESTINO,20/12/1968,tipo 3
18307,5107206,TAYGLIANE ACACIO GALDINO,ANTONIA ELIANE NASCIMENTO COSTA SILVA,13/11/2017,tipo 3
18328,1200401,ULISES SANCHES CARPIO,CHARLES FERRERA DA SILVA,10/01/1934,tipo 3
18334,5107206,VALCILEA ALVES DA SILVA,CLEMILDA DA SILVA PERERA JAMINAWA,29/04/1986,tipo 3
18344,1200401,VALDEMIR DA COSTA SOUSA,DAMIANNA GOMES DA SILVA,25/06/1983,tipo 3
18347,1200401,VALDERINA FERRERA DE ALMEDA,DELSIMAR DA SILVA BELARMINO,22/11/1973,tipo 3
18351,1200401,VALDIRENE ALVES DE SOUSA,DJACIR SOUSA LIMA,06/05/2011,tipo 3
18352,5107206,VALDIRENE FACANHA FERRERA,DORVAL FERRERA LIMA,22/06/1997,tipo 3
18373,1200401,VANEÇA ALVES FERREIRA,ERCILIA SILVA DO NASCIMENTO,06/03/1938,tipo 3
18375,1200401,VANEÇA COSTA DOS SANTOS,ESTER PINHERO DA SILVA,31/01/1951,tipo 3
18402,5107206,VANILEUDO SILVA ARAUJO,FRANCISCO CLAUDECIR SILVA DA COSTA,12/10/2009,tipo 3
18408,1200401,VANUSA FREITAS DOS SANTOS,GEORGIA MARIA SILVA LIMA,21/10/1998,tipo 3
18419,5107206,VERONICA DA SILVA LIMA,GLEUCIMAR CAMPOS DE ALMEDA,26/10/1940,tipo 3
18449,5107206,VITORIA OLIVERA DA SILVA,JOAO PAULO SILVA DA COSTA,20/01/1924,tipo 3
