ID,COD_MUNICIPIO,NOME,NOME_RESPONSAVEL,data_nasc,Tipo_erro
15397,5107206,EVANUZIA D. SOUSA DA SILVA,GILDACI OLIVEIRA NERI,24/09/1959,tipo 2
15492,1200401,FRANCILENE S. DE LIMA,HILDA LIMA FORTUNATO,29/03/2004,tipo 2
15496,5107206,FRANCIMONICA B. DE QUEIROZ,IARA DE FRANCA SILVA,13/03/1979,tipo 2
15592,1200401,FRANCISCA P. DE LIMA,JACKLINE SOUSA FONTINELE,07/09/1989,tipo 2
15603,1200401,FRANCISCA S. DA CUNHA,JAILSON LAZARO SILVA DE SOUZA,04/09/2007,tipo 2
15744,1200401,GIOVANNA D. SILVA GHELLERE,JOAO ROBERTO ALVES DA SILVA,15/03/2010,tipo 2
15762,5107206,GLEICIANE S. DE LIMA,JOICE DA MOTA RODRIGUES,20/12/1947,tipo 2
15793,5107206,HALLISSON M. MUNIZ,JOSE CARLOS DE OLIVEIRA ALMEIDA,10/09/1935,tipo 2
15832,1200401,INGLA B. DE LIMA DA SILVA,JOSEFA ALVES DE SOUZA,12/06/1981,tipo 2
15900,5107206,IZAIANA C. DA SILVA,JUSCILENE DE SOUZA GONZAGA,18/08/2008,tipo 2
16067,1200401,JOCICLEIA P. DA COSTA,LENIRA DIOGO DA SILVA,16/01/1971,tipo 2
16113,1200401,JOSE D. SILVA E SILVA,LINDA LUCIO DE SOUSA,08/06/2008,tipo 2
16121,5107206,JOSE F. GOMES DA SILVA,LIUDIMAR FELIPE DA SILVA,19/09/2001,tipo 2
16146,5107206,JOSE S. DO NASCIMENTO,LUCAS CHARLES LIMA DA SILVA,23/11/1959,tipo 2
16154,1200401,JOSEMIR G. DE FRANCA,LUCAS VINICIUS ALVES DOS SANTOS,28/01/1958,tipo 2
16424,5107206,LORENA S. DE SOUZA,MARIA CATRIELE DE ARAUJO FORTUNATO,02/12/1940,tipo 2
16480,5107206,LUCIANA R. FERREIRA,MARIA DAS DORES CAMPOS LIMA,21/11/1960,tipo 2
16486,1200401,LUCIANE M. DE FREITAS,MARIA DAS DORES DA SILVA SOUSA,27/11/1980,tipo 2
16518,1200401,LUCIVANIA G. DO NASCIMENTO,MARIA DE FATIMA RODRIGUES MONTEIRO,22/12/1953,tipo 2
16612,1200401,MARCIA C. BRAGA,MARIA ELISSANDRA RODRIGUES COELHO DE SAN,22/07/2009,tipo 2
16677,5107206,MARIA A. FIRMINO DE SOUZA,MARIA IMACULADA PEREIRA DE AQUINO,11/08/2017,tipo 2
16709,1200401,MARIA A. SCHECLUSKI,MARIA JOSE JANUARIO DE MATOS,16/04/1980,tipo 2
16792,1200401,MARIA D. DE MELO SOUZA,MARIA NATALICE OLIVEIRA DA SILVA,28/04/1949,tipo 2
16813,1200401,MARIA D. GRACAS MACIEL DE SOUZA,MARIA PAULA DE OLIVEIRA FROTA,19/03/1931,tipo 2
16881,1200401,MARIA D. DESTERRO LOURENCO DA SILVA,MARIA SOCORRO COELHO FERNANDES DA SILVA,29/06/1975,tipo 2
16904,1200401,MARIA E. BARROSO DE ARAUJO,MARIA VALERIA XIMENEZ DA SILVA,22/09/1955,tipo 2
16920,1200401,MARIA E. DA COSTA CORDEIRO,MARIANA BALIZARDO DE OLIVEIRA,27/02/1977,tipo 2
16946,5107206,MARIA F. DE OLIVEIRA,MARILENE SILVA DA CRUZ,24/11/2007,tipo 2
16992,5107206,MARIA G. DA SILVA MARINHO,MARLUCE PEREIRA NASCIMENTO,14/07/1969,tipo 2
17178,1200401,MARIA O. LEITAO MENDES,OBEDIANA MELO DA SILVA,21/07/1974,tipo 2
17222,1200401,MARIA R. DA SILVA ARAUJO,PATRICIA PANTOJA MARCONDES,23/07/1948,tipo 2
17265,5107206,MARIA S. ALMEIDA DERZE,RAABE MOURA DE FREITAS,10/01/2022,tipo 2
17288,5107206,MARIA V. VIANA DOS SANTOS,RAIEL DO NASCIMENTO TEIXEIRA,27/09/1951,tipo 2
17348,5107206,MARINEIDE S. DE ABREU,RAIMUNDA SILVA DE OLIVEIRA,11/07/2009,tipo 2
17435,5107206,MEIRE F. DE SOUZA,REGINALDA FERREIRA LIRA,13/12/1996,tipo 2
17474,5107206,MILIANE D. LIMA MARINHO,ROMILIA DE SOUZA SANTIAGO,01/12/2010,tipo 2
17491,1200401,MIRIA D. SILVA DANTAS,ROSA MARIA DA COSTA CAVALCANTE,03/05/1939,tipo 2
17501,5107206,MIRLIANE L. DA SILVA,ROSALINA SILVA DE OLIVEIRA,20/09/1945,tipo 2
17647,5107206,PATRICIA D. SILVA COSTA,SARA CALACINA RAMALHO,30/09/1992,tipo 2
17675,1200401,PEDRO P. SOUZA OLIVEIRA,SEBASTIANA MATOS DA SILVA,03/11/1951,tipo 2
17694,1200401,QUEILA D. SILVA,SHAKIRA DA SILVA BATISTA,30/07/1937,tipo 2
17739,5107206,RAIMUNDA C. DE LIMA,SINAI DA SILVA SOUZA,03/09/1927,tipo 2
17828,5107206,RAQUEANE M. MACHADO DIAS,TALIA ALVES DA SILVA,26/05/1960,tipo 2
17851,5107206,RAYCILENE F. DA SILVA,TATIANA DA SILVA GONZALES,25/05/1967,tipo 2
17941,5107206,ROSANE A. DA SILVA,VANDERLENE DE SOUZA FELICIO,11/10/2022,tipo 2
18141,1200401,SHELI F. DE OLIVEIRA,JOSE SILVA DE MIRANDA,14/05/1972,tipo 2
18164,1200401,SIMONE D. SILVA LIMA,MARIA AUXILIADORA FREITAS DA SILVA,23/01/1940,tipo 2
18177,1200401,SIRNEI C. MOURAO DA SILVA,MARIA IOLANDA MORAES DA SILVA,06/08/2002,tipo 2
18205,1200401,SUERLANE M. PEREIRA,QUEITE MAIANE QUEIROZ SILVA,11/03/2000,tipo 2
18239,5107206,TAMARA S. DE FREITAS,GILMER PEREZ OLIVEIRA KAXINAWA,21/10/2019,tipo 2
18261,1200401,TATIANE M. DE ARAUJO,MARIA NONATA PEREIRA DOMINGOS KAXINAWA,16/02/1993,tipo 2
18278,5107206,TEREZINHA D. JESUS GOMES,ADRIELE BARBOSA DE OLIVEIRA,07/05/1977,tipo 2
18425,5107206,VERONICE D. SOUZA FERNANDES,IRLANDIA ALVES BARCIO,01/07/2022,tipo 2
