ID,COD_MUNICIPIO,NOME,NOME_RESPONSAVEL,data_nasc,Tipo_erro
3133,2514453,ANTONIO BRITO DE FREITAS,CASSIANO DA SILVA,17/04/1984,tipo 2
3257,2610004,CRISTIANE MARIA DA SILVA,ROBERVALDO DA SILVA,22/09/1986,tipo 2
3272,2510907,ROSELI LINS DA SILVA,SOLANGE DA SILVA,29/05/1956,tipo 2
3300,2613206,JOAO PAULO FLORENTINO DO NASCIMENTO,ANA NOBRE ALVES LACERDA,27/02/1963,tipo 2
3352,2206704,LAILA CAROLYNI COSTA CARVALHO,MERCEDES SILVA OLIVEIRA,07/07/1932,tipo 2
3574,3304557,MICHAEL VINICIUS DE SANTANA BONIFACIO,MAISA BASILIO CRUZ,02/06/1968,tipo 2
3587,3304557,SILVIA DE OLIVEIRA SILVA,RAIMUNDA CAMPOS MORAES,02/10/1935,tipo 2
3805,5219803,MARIA VILMA SANTOS,CLAUDIA ALVES,19/01/2020,tipo 2
3808,3501004,VICENTE DE PAULO ASSIS,DANIELA EMILIANO,03/05/1977,tipo 2
3849,3515707,EDIVANIA SOUZA DE OLIVEIRA,AILTON DE SOUSA,20/07/1926,tipo 2
3927,2513851,LUCIANA MARIA DE LIMA,ODETE DA SILVA,18/07/1935,tipo 2
3991,3550308,ANA CAROLINA ALMEIDA DA SILVA,MARIA DA SILVA,27/08/1955,tipo 2
4043,3550308,LUCIA HELENA RODRIGUES,ARETANIA DE MOURA,28/03/2010,tipo 2
4060,3550308,PALOMA ISABELE JUSTINO COSTA,SILVANIA DA SILVA,27/06/1938,tipo 2
4121,2702504,WEVERTON DA CONCEICAO LIMA,JOSE DE JESUS SANTOS,20/01/1941,tipo 2
4146,2704302,LUCINEIDE DOS SANTOS,ELIELTON DOS SANTOS,27/03/1960,tipo 2
4222,1303007,MARIA ROSELI ALFAIA DOS SANTOS,JACO DE JESUS SANTANA,05/05/1948,tipo 2
4286,3112000,UBIRAJARA CHAVES DE JESUS,JEAN DOS SANTOS,29/04/1982,tipo 2
4306,2908309,JULIO CESAR CONCEICAO CONRADO,LUCILENE DA SILVA,07/05/1988,tipo 2
4321,2909208,ROZILDA OLIVEIRA DE JESUS,JULIANA DOS SANTOS,22/09/1961,tipo 2
4335,2911501,JULIO CEZAR DE OLIVEIRA SOUZA,MILENA SOUZA,23/03/1924,tipo 2
4406,3524204,MAILDE MARIA DA SILVA SOUZA,GENILSON SILVA DE OLIVEIRA,04/06/2005,tipo 2
4625,2303709,RAIMUNDO GONCALVES OLIVEIRA,SANDRA RIBEIRO DE LIMA,11/02/2013,tipo 2
4669,2304400,IDEUZA RICARDO AZEVEDO,ANA SOARES SILVA,28/01/1942,tipo 2
4699,2304400,MARIA VILANI VIEIRA DE ALMEIDA,HELIANE SIMPLICIO,04/06/1934,tipo 2
4715,2304400,THIAGO HOLANDA RAMALHO,LUZIA FREIRE,13/09/2009,tipo 2
4750,2306405,SEVERO DOS SANTOS DAMIAO,PATRICIA RIBEIRO FRANCISCO,15/11/1984,tipo 2
4859,3203809,JADIR DA SILVA,JOSE JESUS DA SILVA SENA,31/03/1936,tipo 2
4936,2103802,KAOANE CRISTINA DA SILVA BARROSO,MARIA VELOZO DOS SANTOS,18/12/2019,tipo 2
4955,2106706,MARIA DE JESUS RODRIGUES SA,CONCEICAO MARIA SOUSA PEREIRA,07/04/1970,tipo 2
4960,2107100,LUIZ ALFREDO PEREIRA DA SILVA,FRANCISCO GOMES DA ROCHA,23/12/1925,tipo 2
5027,2111300,PATRICIA CIPRIANA COSTA,DILVAR RAMOS,30/12/1938,tipo 2
5034,2111300,SIMONE SOUSA BASTOS,ROSINETE DOS SANTOS,03/04/1945,tipo 2
5130,3118601,ELIANE AMARO DA SILVA,AGNALDO DE JESUS,18/05/2018,tipo 2
5146,3122454,RENATO ROCHA PEREIRA,MARIA RODRIGUES,24/09/1933,tipo 2
5190,3150109,LUCIA HELENA DE BRITO,JULIANA,06/07/2022,tipo 2
5245,3170206,ANA LUCIA DE ABREU LIMA,OZEANEA PINTO,14/07/2018,tipo 2
5297,1500107,ROSILENE COSTA DA SILVA,COSMO DA SILVA,16/08/1937,tipo 2
5356,1504208,CLAUDIA BARBOSA,GILMAR SILVA DIAS,10/10/1952,tipo 2
5484,2512804,AGAMENON RODRIGUES RAMALHO,AUDILENE DO NASCIMENTO,13/10/1982,tipo 2
5509,2601201,MARIA APARECIDA RODRIGUES DE OLIVEIRA,ALDA DE SOUZA,22/06/1997,tipo 2
5584,2604403,GERLAINNE SANTANA DOS SANTOS,COSMA DA SILVA MELO,16/11/1947,tipo 2
5594,2605806,INGRYD GIGRYOLLE MEDEIROS DE ASSUNCAO GO,JOSIMAR DE NORONHA,23/09/1955,tipo 2
5621,2606408,GILCICLEIDE CICERA RODRIGUES,LEANDRO DOS REIS,08/08/1952,tipo 2
5626,2607000,MANOEL TEIXEIRA DA SILVA,CLESIOMAR NUNES,29/02/1972,tipo 2
5665,2610004,GEORGE BERTO DA SILVA,JOEL VIEIRA,07/06/1989,tipo 2
5673,2610400,CARLOS ANDRE CAJARANA,MARIA REMEDIOS DE SOUSA,16/12/1963,tipo 2
5676,2610509,PEDRO BATISTA DA SILVA,MOISES DA SILVA,01/04/1942,tipo 2
5790,2207009,LILIANE SANTOS DA CRUZ,MARIA DE LEMOS SANTOS,16/07/1942,tipo 2
5803,2209559,GORETE PAES LANDIM ALVES,FERNANDO FERREIRA,18/06/1996,tipo 2
5822,2211001,HENRIQUE LUIS DE SOUSA FILHO,ELIANE RIBEIRO DA SILVA,18/04/1972,tipo 2
5920,3302254,DANIELA PAULA DA SILVA,NILZA OLIVEIRA SANTOS,15/01/2009,tipo 2
5995,3303500,MATHEUS SOUZA DE ALMEIDA,MARIA SALES RAMALHO,23/06/1929,tipo 2
6047,3304557,EDILENE DAS NEVES,RAIMUNDO DA SILVA,11/05/1970,tipo 2
6049,3304557,ELAINE CRISTINA LIMA,RITA SANTOS,14/08/1924,tipo 2
6074,3304557,KELLY MICAELE DOS SANTOS TEIXEIRA,WALCLECIA SILVA FERNANDES,19/07/1966,tipo 2
6250,1400233,IVONETE FREITAS SILVA,EDVALDO ALMEIDA,19/06/1958,tipo 2
6288,4305108,ROSANE LEITE DO PRADO,LUZIA DE LIMA,28/02/1932,tipo 2
6319,4316907,MARIA GLACI RODRIGUES CASTRO,NEUZA DE OLIVEIRA,23/05/1968,tipo 2
6376,2401107,JOSE ERALDO DOS SANTOS,MARLY SILVA PINHEIRO,14/12/2022,tipo 2
6386,2506905,GILBERTO DOS SANTOS PINTO,ALEX LOPES,25/02/1979,tipo 2
6402,2804458,EDILSON LIMA DE JESUS,ALISSON CAVALCANTE DE OLIVEIRA,08/05/1969,tipo 2
6453,3509502,MAURO AUGUSTO DE SOUZA,LUIZ XAVIER,11/06/2019,tipo 2
6493,3518701,BRUNA DA SILVA GAUDINO,EDNA AMBROSIO,10/05/2018,tipo 2
6546,3523206,LUCIANE KRUBNIKI DE OLIVEIRA SILVA,LUIZ DE SOUZA,30/08/1957,tipo 2
6597,3542602,TATIANE DA SILVA,ROSANGELA DO AMARAL,01/07/2004,tipo 2
6676,3549953,SIRLENE PEREIRA FABIANO,ELAICE DA SILVA,26/12/1960,tipo 2
6740,3550308,INGRID SANTOS RODRIGUES,JOSE BEZERRA LINTO,16/09/1935,tipo 2
6770,3550308,MARCELA BARBOSA ARAUJO,MARIA DOS SANTOS,29/10/2008,tipo 2
6804,3550308,RAFAEL MARCO DA SILVA,MARIA DOS SANTOS,25/05/2017,tipo 2
6835,3550308,WALMIR SCHAPER,LUSIA MARINHO SILVA,05/12/2019,tipo 2
6870,1200104,CLEONICE PEIXOTO FELIX,CAROLINE RIBEIRO DAS NEVES,05/07/1983,tipo 2
6894,4102208,MARIA BENEDITA MENDES DOS SANTOS,ANTONIA DA SILVA SANTOS,06/10/1953,tipo 2
7000,2709400,DENILDO MOREIRA DA SILVA LIMA,NELSIENE DA SILVA,09/01/2008,tipo 2
7006,1301001,ANTONIO VADERLAN VICENTE DA SILVA,CRISTIANE CRUZ LIMA,06/11/2008,tipo 2
7026,1304104,JOSILANE BATISTA PONSIANO,EDNALDA DE SOUZA ARAUJO,18/06/1968,tipo 2
7051,2902104,GILSON SANTOS DE JESUS,DANILO CONCEICAO ALMEIDA,23/04/1948,tipo 2
7062,2903508,ORLANDO VIEIRA DA SILVA,WANDERLETE DOS SANTOS,07/11/2012,tipo 2
7168,2912400,JAKELINE GOMES DE ARAUJO,VALDOBERTO DE ARAUJO,27/06/2012,tipo 2
