ID,COD_MUNICIPIO,NOME,NOME_RESPONSAVEL,data_nasc,Tipo_erro
14249,5116394,ADRIANO SACRAMENTO DE SOUZA NASCIMENTO,ANGELA DA SILVA,03/06/2011,tipo 4
14251,5117021,ADRIELAYNE COSTA DE LIMA,ANGELA MARIA ASSUNCAO DE SOUZA,04/01/1933,tipo 4
14253,1200824,ADRIELE SOARES MARCAL,ANGELICA CONCEICAO DA SILVA,07/09/1930,tipo 4
14256,1209328,ADRIELLE SOUZA DA SILVA,ANGELITA PAULACH,19/08/2011,tipo 4
14265,5109173,AIRAILDA BENTO DE OLIVEIRA,ANNE KELLY DA COSTA RAMOS,06/06/2016,tipo 4
14284,5114551,ALBERTINHO DA SILVA COSTA,ANTONIA DE SOUZA TEIXEIRA,04/03/1925,tipo 4
14298,5110199,ALCIMAR LOPES DE ARAUJO,ANTONIA INGRIDY FERREIRA SANTIAGO,04/05/2008,tipo 4
14299,1204708,ALCIMARA ALVES DE ARAUJO,ANTONIA JAINA SILVA FERREIRA,19/02/2017,tipo 4
14313,1207826,ALDEISA DA SILVA OLIVEIRA,ANTONIA MARQUES NASCIMENTO DE LIMA,17/10/1959,tipo 4
14315,1207848,ALDEISA DE ARAUJO PEREIRA,ANTONIA MARTA DA COSTA SILVA MARQUES,22/06/1940,tipo 4
14320,1201227,ALDENIA MARIA COSTA DA SILVA BARROS,ANTONIA MONTEIRO DE OLIVEIRA PENHA,01/03/1998,tipo 4
14343,5113580,ALICE DOS SANTOS TELES,ANTONIA ZENIR ARAUJO GOMES,12/09/1983,tipo 4
14351,1201168,ALINE CRISTINA DA COSTA LIMA,ANTONIO CHALES DE OLIVEIRA BATISTA,25/06/1957,tipo 4
14361,5116511,ALINE MARQUES MUNIS,ANTONIO JOSE SOUZA DA COSTA,20/05/2021,tipo 4
14362,5114457,ALINE NASCIMENTO DA SILVA,ANTONIO LEONARDO DE SOUZA PEREIRA,13/05/1951,tipo 4
14369,1201959,ALINNE SOUZA RODRIGUES,ANTONIO OLIVEIRA DE MEDEIROS,19/02/1978,tipo 4
14380,5116383,AMADEUS GUIMARAES DA SILVA,APARECIDA FERNANDES,06/07/2012,tipo 4
14393,5109076,AMANDA VITORIA DA COSTA FERREIRA,ARNETE ALMEIDA DO NASCIMENTO,02/09/2004,tipo 4
14409,1208495,ANA CAROLINE DE LIMA DA SILVA,AUGLEIDE SANDY SOUZA SIQUEIRA,19/07/2000,tipo 4
14441,1202039,ANA LUCIA DE SOUZA FALCAO,BRENDA MATOS DE ALENCAR,23/02/1992,tipo 4
14444,5113597,ANA LUIZA O NASCIMENTO,BRENO HENRIQUE VIEIRA DA SILVA,16/10/2011,tipo 4
14446,5108576,ANA MARIA CUNHA MARTINS,BRUNA ALITA MELO DA SILVA,21/02/1949,tipo 4
14458,1201993,ANA PAULA DE OLIVEIRA,BRUNA SANTOS DE ALENCAR,25/12/2001,tipo 4
14470,1201261,ANA PAULA SANTOS DOS PASSOS,CAMILA DA SILVA ALAMEIDA,19/03/1957,tipo 4
14471,1206777,ANA PAULA SOUZA DA SILVA,CAMILA DA SILVA ALAMEIDA,21/02/1986,tipo 4
14473,5113194,ANA RAYNA BRAGA PINHEIRO,CAMILA MARTINS ANDRADE,13/05/1989,tipo 4
14474,1209151,ANA RILLERY DE SOUZA DA SILVA,CAMILA MATIAS DA SILVA,23/03/2012,tipo 4
14476,1206277,ANA SILVIA ALVES DE ALBUQUERQUE,CAMILA OLIVEIRA DO NASCIMENTO,18/07/2008,tipo 4
14484,5115422,ANANDA CAYNNE DA SILVA LIMA,CARLA DANYELE GOMES DE VASCONCELOS,03/08/1985,tipo 4
14489,1207105,ANDERSOM DA SILVA E SILVA,CARLENE SOUZA ROSA,24/08/1994,tipo 4
14498,1205391,ANDREA NEURIANE MARTINS DA SILVA,CARLOS ROBERTO ARAUJO DE FREITAS,25/04/2015,tipo 4
14507,1202371,ANDREIA NUNES DA SILVA,CAROLINA TEIXEIRA DOS SANTOS,16/07/1930,tipo 4
14522,5114354,ANDRESSA GOMES DE FARIAS,CATRINE DA SILVA PONCE DE SOUZA,10/02/1942,tipo 4
14531,5116596,ANGELA APARECIDA NEGREIROS DE LIMA,CHAIANE GOMES DE AGUIAR,22/12/2021,tipo 4
14538,5109941,ANGELA MARIA LIMA DOS SANTOS,CILDERLANDIA DA SILVA GOMES SOUSA,08/10/1973,tipo 4
14558,5114641,ANSELMO GAMA DA SILVA,CLAUDIO SENA DA SILVA,11/06/1924,tipo 4
14565,5112688,ANTONIA CLEICE VARGAS RIBEIRO,CLECIANE SHEENA DA SILVA,28/02/1988,tipo 4
14577,5108766,ANTONIA EDILENE RODRIGUES DE SOUZA,CLEIDIANE FERREIRA DE LIMA,23/04/2009,tipo 4
14587,5113371,ANTONIA FREITAS PAIVA,CLENILCE GAMA DA SILVA,28/09/1984,tipo 4
14588,5113829,ANTONIA HEIGINA COSTA DE SOUZA,CLENILDA NASCIMENTO DE SOUSA SILVA,06/04/1954,tipo 4
14598,1201447,ANTONIA MARIA DE ALMEIDA SANTOS,CLEUNICE LOPES DO NASCIMENTO,23/06/2021,tipo 4
14605,5108994,ANTONIA MONTE DA SILVA,CLICIANE NASCIMENTO DA SILVA,28/07/2017,tipo 4
14606,5107702,ANTONIA MOREIRA PONTES,CLISCIANE DE SOUSA ARAUJO,17/09/2020,tipo 4
14608,5108384,ANTONIA NILDA DE ARAUJO FEITOSA,CLOTILDES DOS SANTOS DA COSTA,27/08/1970,tipo 4
14609,5113313,ANTONIA OCICLEIA MONTEIRO DA ROCHA,CONCEICAO FERREIRA ANJO,23/09/1984,tipo 4
14634,1206451,ANTONIO CHALES DE OLIVEIRA BATISTA,CRISTINA APARECIDA CAMPOS DOS SANTOS,05/02/2012,tipo 4
14635,1202093,ANTONIO CLAUDIO RODRIGUES DE LIMA,CRISTINA DE OLIVEIRA MEDEIROS CORREIA,09/03/2011,tipo 4
14653,5116514,ANTONIO JOSE SOUZA DA COSTA,DAIANE FONSECA BORGES,12/04/2007,tipo 4
14658,5114320,ANTONIO NOGUEIRA DE QUEIROZ,DAIANE SOUZA SERRA,21/02/1962,tipo 4
14660,5114775,ANTONIO PESSOA DOS REIS,DAMERSON DO LAGO,12/10/1934,tipo 4
14673,5109021,APARECIDA OLIVEIRA GOMES,DANIELA DA SILVA CAMPOS,06/05/1979,tipo 4
14702,1208291,AUREO GOMES DE SOUZA,DARIANA DA SILVA DUTRA,19/01/2010,tipo 4
14704,5114792,AURICELIA MORAIS FERREIRA,DARIELLE LIMA DA CUNHA,17/12/1961,tipo 4
14721,1208392,BEATRIZ MESQUITA DA SILVA,DAYARA CHALUB DO NASCIMENTO,12/10/1961,tipo 4
14725,1209974,BEATRIZ RABELO SIMPLICIO,DEBORA DE SOUZA FREITAS,14/06/1985,tipo 4
14816,5113809,CERENICE ALVES ZUMBA,EDILSON ROSA MATOS,04/05/1965,tipo 4
14822,1206112,CHARLENE DA SILVA VEIGA NASCIMENTO,EDISON MARINHO DA COSTA,13/09/1999,tipo 4
14824,5109550,CHARLES BRAGA DE SOUZA,EDIVAN DA SILVA PACHECO,16/10/2003,tipo 4
14828,5115838,CICERA CARNEIRO DE LIMA,EDMILSON FERREIRA FEITOSA,11/09/2022,tipo 4
14829,1206279,CIELE SANTIAGO BARBOSA,EDNA DOS SANTOS NASCIMENTO,19/08/1971,tipo 4
14832,5108378,CILENE DE OLIVEIRA CASTRO,EDUARDA NONATO DE SOUZA,29/03/1932,tipo 4
14838,1203431,CIPRIANO DA SILVA SOARES,EFRANCINA PACAIA TUESTA,10/05/1956,tipo 4
14868,5114780,CLEICIANE SILVA COSTA,ELIANA FERREIRA DE SOUSA,04/12/1948,tipo 4
14869,5115869,CLEICIANE SILVA DO NASCIMENTO,ELIANA LIMA DA SILVA,02/11/1940,tipo 4
14870,5114174,CLEIDE ANY DA SILVA,ELIANA MARIA DE LIMA FERREIRA,10/04/1950,tipo 4
14897,5112769,CLEUDO PINHEIRO RIBEIRO,ELIANE SILVA FERREIRA,18/08/1955,tipo 4
14911,5107453,CREIDIVAN FERREIRA DE SOUZA,ELIETE CAMPOS DA SILVA,28/10/1951,tipo 4
14912,1208888,CREIDIVAN FERREIRA DE SOUZA,ELIETE DE FREITAS AMARAL,27/04/1951,tipo 4
14914,5107550,CREMILDA PEREIRA DOS SANTOS,ELIEZO NASCIMENTO DA SILVA,23/08/1974,tipo 4
14918,1205367,CRISCILANDIA ALVES RAMOS,ELISAMA VIEIRA DE MATOS,24/10/1996,tipo 4
14934,1201321,CRISTIANE MELO DE AGUIAR,ELISSANDRA DA SILVA OLIVEIRA,09/08/1926,tipo 4
14937,5108782,CRISTINA DA SILVA BARROS,ELISSANDRA DE SOUZA VALE,01/04/1938,tipo 4
14947,1206500,CYBEELLE RODRIGUES DAVILA DE CARVALHO,ELITA NASCIMENTO DA SILVA,16/10/1946,tipo 4
14957,1207912,DAIANE QUINTINO BILO,ELIZANGELA DA SILVA AMARAL NUNES,25/05/2016,tipo 4
14964,5113560,DALVANI DA SILVA DAMASCENO KAXINAWA,ELIZANGELA LIMA DA SILVA,29/10/1986,tipo 4
14978,5107661,DANIELA DE ANDRADE GOMES,ELONIZA LIMA DOS SANTOS,30/03/1924,tipo 4
14980,5114049,DANIELA MARTINS DOS SANTOS FERREIRA,ELQUESTANIA MOREIRA COSTA DA SILVA,07/01/1943,tipo 4
14987,5108427,DANIELE OLIVEIRA DA SILVA,EMANUELE SOUZA DA SILVA,29/05/1968,tipo 4
14991,1200475,DANIELE SILVA DE SOUZA,EMILIA BATISTA TEIXEIRA,07/07/2021,tipo 4
15013,1208845,DAYANE NASCIMENTO DA SILVA,ERICA DOSSIMO FERREIRA,29/09/1956,tipo 4
15032,5116070,DEJANE SANTANA DO NASCIMENTO,ERIVALDO MARINHO DO CARMO,18/08/1969,tipo 4
15047,1208705,DEYME MAGALHAES DA COSTA,ESTEFANY SAMPAIO FERREIRA,04/08/1948,tipo 4
15052,1201083,DHEMERSON LIRA DO CARMO,ESTER SILVA DA COSTA,02/12/1971,tipo 4
15075,1200583,DIONISIA PESSOA SANTIAGO,EVALDO DA COSTA OLANDA,05/03/1977,tipo 4
15098,5112878,ECIENE FERREIRA DA SILVA,FABIANA CALADO DA SILVA,19/12/1930,tipo 4
15120,1201936,EDINEIA SILVA DA COSTA,FATIMA FRANSCISCA DA CONCEICAO,13/11/1984,tipo 4
15129,1210315,EDMILSON PEREIRA DE LIMA,FERNANDA CORREIA DA SILVA,14/04/1950,tipo 4
15132,1208550,EDNA DA FONSECA RIBEIRO,FERNANDA DA SILVA LIMA,05/01/1977,tipo 4
15140,5114148,EDSON MONTEIRO SILVA,FIAMA ALVES DE SOUZA ARAUJO,14/07/2020,tipo 4
15149,1202171,EDUARDO DOS SANTOS SOUZA,FLAVIO DE ALMEIDA DA SILVA,11/03/1950,tipo 4
15159,5109593,ELAINE GOMES DA SILVA,FRANCILENE DA CONCEICAO ALVES,11/09/1973,tipo 4
15170,1207462,ELEN DAYANE FERREIRA DA SILVA,FRANCIMAR GOMES MACHADO,24/03/2023,tipo 4
15180,1205370,ELI JUNIOR OLIVEIRA LIMA DE FREITAS,FRANCINEIDE LOPES SOUZA APURINA,01/03/1984,tipo 4
15205,5107702,ELIANE ARAUJO DE SOUZA,FRANCISCA BRASIL DOURADO DA SILVA,23/11/1944,tipo 4
15218,5109076,ELIANE SILVA DOS SANTOS,FRANCISCA DAS CHAGAS BORGES SOARES,07/04/2011,tipo 4
15223,5113416,ELICA DE OLIVEIRA BARBOSA,FRANCISCA DAS CHAGAS DE LIMA ASSEM,30/11/2016,tipo 4
15233,1202659,ELIETE MAGALHAES DE OLIVEIRA,FRANCISCA ELIANA DA CRUZ DE MOURA SILVA,18/11/1924,tipo 4
15241,1202516,ELISAMIA DE BRITO DA SILVA,FRANCISCA FRANCIMAR SOUZA DE ALBUQUERQUE,23/04/2006,tipo 4
15253,1207046,ELISANGELA NASCIMENTO DOS SANTOS,FRANCISCA LIMA DA SILVA,06/04/1931,tipo 4
15256,5109917,ELISMAR CARDOSO DE BESSA,FRANCISCA LUCAS PINHEIRO,28/02/1996,tipo 4
15259,5111323,ELISSANDRA ARAUJO DA COSTA,FRANCISCA LUZIA LIMA OLIVEIRA,23/02/1956,tipo 4
15266,1209132,ELISSANDRA SILVA DE LIMA,FRANCISCA NOGUEIRA DE LIMA,18/09/2014,tipo 4
15306,5117092,EMANUELA SOUZA DA SILVA,FRANCISCO DA SILVA GOMES,01/01/2018,tipo 4
15309,1210293,EMANUELLY FREITAS DA SILVA,FRANCISCO DAS CHAGAS SILVA CRUZ,09/11/2009,tipo 4
15314,5113859,EMILLE FERREIRA SANTOS,FRANCISCO DE SOUZA AMANCIO,07/06/2009,tipo 4
15334,1202470,ERICA SILVA RUBIM,FRANCIVANIA GOMES SANTOS,21/06/1968,tipo 4
15340,1206075,ERIDAN FARIAS DE OLIVEIRA,GABRIELA ALENCAR DA SILVA,21/02/1975,tipo 4
15359,1202224,ERNILSA DE LIMA SOUZA,GELIANE DA SILVA ROCHA,14/03/1987,tipo 4
15373,1208038,EUCIENY PEREIRA DA ROCHA,GERCIANI MATIAS,21/06/1930,tipo 4
15375,5108097,EUDES DE SOUZA VIEIRA,GERLAINE AVILAR DA SILVA,28/02/1924,tipo 4
15376,1207148,EUFLAVIA PEREIRA DOS SANTOS,GERLANDIA CARNEIRO DA SILVA,20/09/1994,tipo 4
15387,5114014,EVA BARBOSA DA SILVA,GETULIO DOS SANTOS CARVALHO,20/10/1948,tipo 4
