ID,COD_MUNICIPIO,NOME,NOME_RESPONSAVEL,data_nasc,Tipo_erro
29852,2710016,ALINE VITORIA ALVES DE ARAUJO,MARIA DA PENHA DA SILVA SANTOS,24/03/1963,tipo 4
29853,2711642,ALVANIR BARBOSA DOS SANTOS,MARIA DAS DORES COSTA,20/02/1967,tipo 4
29868,2710941,DAYVISON RANIEL NASCIMENTO DOS SANTOS,MARIA JOSE CORDEIRO,29/10/1987,tipo 4
29874,2711324,EDNELZA ALVES DOS SANTOS,MARIA LUCIA BATISTA DE OLIVEIRA,21/07/2008,tipo 4
29875,2709432,EDNILSON DOS SANTOS,MARIA QUITERIA LARANJEIRA SILVA,27/10/2011,tipo 4
29884,2705639,ERICKSON RODRIGO FLORIANO DA SILVA,MIKAEL GOMES DOS SANTOS,29/07/1950,tipo 4
29905,2713046,JAYNE RAYANNE MARQUES DE VASCONCELOS,ROSILENE MIGUEL DE LIMA SILVA,05/12/1962,tipo 4
29907,2710688,JOAO FERNANDES SILVA,SANDRA PEREIRA DE LIMA,23/07/1975,tipo 4
29909,2710959,JOAO PILAR DOS SANTOS,SEVERINA SOUZA SILVA,14/07/1982,tipo 4
29911,2707859,JOSE ADENILSON DOS SANTOS,SILVANIA CREUZA DA CONCEICAO SANTOS,24/02/1989,tipo 4
29913,2708194,JOSE CLENISSON DOS SANTOS,SILVANIA SANTOS DE OLIVEIRA,30/07/2012,tipo 4
29914,2710640,JOSE GENUALDO RODRIGUES DA SILVA,SIMONE DOS SANTOS,20/04/2016,tipo 4
29916,2708043,JOSE MIGUEL DA CONCEICAO CARVALHO,SIMONE GRIGORIO DA SILVA,11/10/1961,tipo 4
29938,2707060,MARCIA DOS SANTOS,ZENILDA AMARAL DA SILVA PEREIRA,22/10/1977,tipo 4
29947,2705116,MARIA CLARICE SANTOS DA SILVA,ALIANA CONCEICAO GOMES,20/12/1996,tipo 4
29973,2713121,NAELY DOS PASSOS SANTOS,CLAUDICE VALENTIM DA SILVA,01/01/1961,tipo 4
29974,2707390,NICOLLY JORDANY DA SILVA,CLAUDIETE DA SILVA LUZ,08/11/2013,tipo 4
29985,2705329,RONALDO DOMINGOS DOS SANTOS,DILMA SILVA MELO,07/06/1931,tipo 4
29990,2713381,STEPHANIE RODRIGUES DE JESUS BARBOSA,EDILSON FIRMINO DOS SANTOS,24/05/2016,tipo 4
29992,2709026,THAUANA MYRELLA LIMA DE ALBUQUERQUE,EDJANES DE FARIAS SANTOS,29/01/1944,tipo 4
30006,2712721,ANA LUIZA DOS SANTOS BARROS,ERICA FERREIRA SILVA DOS SANTOS,15/06/1952,tipo 4
30007,2708937,ANA PAULA DO NASCIMENTO,ERICELMA DOS SANTOS DA SILVA,04/07/1926,tipo 4
30012,2709031,ARIANA FERREIRA FLORENCIO DA SILVA,FERNANDA DA SILVA SANTOS,27/10/1962,tipo 4
30018,2712667,CICERA AMARA DA SILVA,GEANE BARBOSA GOMES SILVA,23/12/1989,tipo 4
30032,2705381,EDILANIA OLIVEIRA DOS SANTOS,JANAINA BELO SILVA,14/12/1954,tipo 4
