ID,COD_MUNICIPIO,NOME,NOME_RESPONSAVEL,data_nasc,Tipo_erro
11299,4116514,IVINA SOUZA DA SILVA,KETHEN DA SILVA FIGUEIREDO,09/12/1932,tipo 4
11316,1208731,JAIRO DIAS DE OLIVEIRA,LEIDIANE SILVA DE SOUZA,03/02/1965,tipo 4
11329,4115839,JANAINA LIMA MAIA,LIDIANA DA SILVA MENEZES,12/07/1957,tipo 4
11340,4308410,JANISSON LIMA BEZERRA,LINDONETE DA SILVA CRUZ,05/02/1932,tipo 4
11341,4114733,JAQUELINE PINHO DA SILVA,LINIANE DE PAULA MUNIZ,16/05/1928,tipo 4
11349,4110164,JARLINE DA SILVA OLIVEIRA,LUANA ROCHA DOS SANTOS,25/05/1984,tipo 4
11371,4314939,JOCILEIDE BARBOSA FERREIRA,LUIZA GABRIELE LEITE DE OLIVEIRA,07/05/1927,tipo 4
11377,4112720,JOCILENE DE ANDRADE MESQUITA,MACIELI CONCEICAO BRAGA,28/11/1963,tipo 4
11378,1201968,JOCILENE DE ANDRADE MESQUITA,MACINEIDE NASCIMENTO FONTE,30/06/1986,tipo 4
11384,4313181,JOEL FRANCISCO PEREIRA GOMES,MAIRANE SILVA OLIVEIRA,08/02/1929,tipo 4
11392,4310863,JORCILEIDE ALVES DA ROCHA,MANOEL MARIO DE SOUZA NEVES JUNIOR,07/10/1940,tipo 4
11408,4109081,JOSE EUDES VARELA COELHO,MARCIANE DE FREITAS MONTEIRO,27/02/1990,tipo 4
11416,4311338,JOSE FRANCISCO DE LIMA PIMENTEL,MARDSON SOUZA DOS SANTOS,05/10/1961,tipo 4
11423,4314707,JOSE ILSON SILVA DE ABREU,MARIA AGAIDE SILVA ALVES,02/04/1975,tipo 4
11432,1207847,JOSEFA OLIVEIRA DE LIMA,MARIA ALDENICE SANTOS DE SOUZA,24/11/1976,tipo 4
11435,4315390,JOSEMA DOS ANJOS NEPOMUCENO,MARIA ALDERENE HERCULANO LIMA,23/03/2021,tipo 4
11436,4314023,JOSIANE FERREIRA ARAUJO,MARIA ALDERLENE REIS SILVA,08/05/1955,tipo 4
11446,4107980,JUCIANE NEGREIROS DE SOUZA,MARIA ANDRELINE ALVES VIEIRA,04/07/1956,tipo 4
11450,1202163,JUDEMILA DA SILVA ABREU,MARIA ANGELITA DE LIMA SOUZA,09/03/1961,tipo 4
11457,4316126,JULIETE DA COSTA ALVES,MARIA ANTONIA DE OLIVEIRA PESSOA,10/01/1982,tipo 4
11459,4307599,JURGLEICE BUSONS DE OLIVEIRA,MARIA ANTONIA DO CARMO BEZERRA,18/07/1939,tipo 4
11472,1208761,LAISSE DA SILVA LIMA,MARIA ANTONIA SANTOS DA COSTA,21/01/1942,tipo 4
11488,4116673,LEILA MARIA SILVA DE LIMA,MARIA ARLENE BATISTA DA SILVA,14/08/1990,tipo 4
11505,4106872,LINDOMAR DE SOUZA,MARIA CELI BERNARDINA DA SILVA,26/01/2011,tipo 4
11515,4306336,LUANA SAMPAIO SILVA,MARIA CLEICIA SALES BEZERRA,08/02/2021,tipo 4
11526,4111804,LUCIANA SOUZA SILVA,MARIA CRISTIANA VIANA DE MATOS,14/04/1995,tipo 4
11532,1203153,LUCILENE DO NASCIMENTO RODRIGUES,MARIA DA CONCEICAO ABREU DE OLIVEIRA,04/08/1998,tipo 4
11546,4306645,LUZINETE DE SOUZA SILVA,MARIA DA GLORIA COSMO DA SILVA,07/04/1969,tipo 4
11552,4312727,MAGNA NUCIA DA COSTA SILVA,MARIA DA GLORIA MOTA GOMES,15/06/1987,tipo 4
11562,4310310,MANOEL DOS SANTOS,MARIA DAS CHAGAS PIMENTEL DO NASCIMENTO,20/10/1995,tipo 4
11577,1210103,MARCIA PEDROZA DE SOUZA,MARIA DAS NEVES PEREIRA DA COSTA,16/06/1932,tipo 4
11580,4311329,MARCILENE FERREIRA DOS SANTOS,MARIA DE FATIMA DE LIMA SILVA,20/04/1990,tipo 4
11589,4309712,MARGARETE MATIAS DA SILVA,MARIA DE FATIMA NASCIMENTO FREITAS,30/06/1995,tipo 4
11593,4309903,MARIA ALBA BENTES VERAS,MARIA DE FATIMA SAMPAIO NEPOMUCENO,14/09/2022,tipo 4
11597,4308069,MARIA ALCILENE SAMPAIO DA SILVA,MARIA DE JESUS CHAGAS DA SILVA,15/05/1962,tipo 4
11605,4107059,MARIA ALEXANDRA SILVA DE MELO,MARIA DE NAZARE ARAUJO DE MELO,19/12/2013,tipo 4
11611,1200276,MARIA ALVILENE DE LIMA CARVALHO,MARIA DE NAZARE FIRMINO,26/02/1940,tipo 4
11630,1208044,MARIA ANTONIA DOS SANTOS SILVA,MARIA DOSONETE SOUZA DE OLIVEIRA,05/11/1997,tipo 4
11635,4307425,MARIA ANTONIA NOGUEIRA SOMBRA,MARIA EDNA DO NASCIMENTO ARAUJO,17/10/1987,tipo 4
11639,1204013,MARIA ANTONIA SILVA DOS SANTOS,MARIA ELANE CARLOS DE SOUZA,19/02/2018,tipo 4
11650,4107776,MARIA APARECIDA SILVA DE SOUZA,MARIA ELIETE RODRIGUES DA SILVA,24/11/1986,tipo 4
11669,4314462,MARIA BRIGIDA SILVA DE SOUZA,MARIA EVANI NASCIMENTO DA SILVA,03/03/2008,tipo 4
11670,4311165,MARIA CARITA DA COSTA LIMA,MARIA EVANIA DA SILVA OLIVEIRA,07/07/1995,tipo 4
11674,4306682,MARIA CELENE DE VASCONCELOS SALVIANO,MARIA FERNANDA LIMA DA SILVA,31/08/1986,tipo 4
11682,4111619,MARIA CIRENE FERREIRA DIAS,MARIA FRANCISCA DE SOUZA AMORIM,08/12/1956,tipo 4
11686,1200940,MARIA CLAICIANE ROCHA DE MATOS,MARIA FRANCISCA FREITAS BARROSO,29/08/1949,tipo 4
11689,1208895,MARIA CLEICIONE SOUZA DE OLIVEIRA,MARIA FRANCISCA NASCIMENTO DA SILVA,10/05/1999,tipo 4
11691,4312893,MARIA CLEIDE PEREIRA DE OLIVEIRA,MARIA FRANCISCA TAVARES DE OLIVEIRA,13/01/2006,tipo 4
11694,1209921,MARIA CLEIDIMAR GOMES CHAVES,MARIA GEANE ALVES DE ALMEIDA,03/09/1966,tipo 4
11709,4312795,MARIA DA CONCEICAO DE SOUZA SILVA,MARIA GRACIETE LIMA DE CASTRO,29/07/1924,tipo 4
11711,4314096,MARIA DA CONCEICAO LAU DA SILVA,MARIA GRACILENE DA SILVA OLIVEIRA,21/05/1928,tipo 4
11724,1201009,MARIA DA GLORIA INACIO DA SILVA,MARIA IVANILDE RAMALHO DA SILVA,13/08/1938,tipo 4
11729,1209258,MARIA DA GLORIA SOUZA SILVA,MARIA JANIELE SILVA DE OLIVEIRA,13/09/2016,tipo 4
11740,4311780,MARIA DANUSIA NASCIMENTO DA SILVA,MARIA JOSE ALVES DE SOUZA,13/12/1996,tipo 4
11749,4113279,MARIA DAS DORES NASCIMENTO DA SILVA,MARIA JOSE DA CRUZ RAMOS,05/07/1950,tipo 4
11763,4107886,MARIA DE FATIMA AMANCIO DE LIMA,MARIA JOSE LIMA BEZERRA,19/02/1932,tipo 4
11769,4306215,MARIA DE FATIMA DE SOUZA NERES,MARIA JOSE NERY PEREIRA,01/03/2000,tipo 4
11778,4311228,MARIA DE FATIMA SILVA DE FREITAS,MARIA JOSE SILVA OLIVEIRA,27/07/1931,tipo 4
11780,4314894,MARIA DE JESUS CARNEIRO DA SILVA,MARIA JOSE SOUZA DE ASSIS,06/06/1964,tipo 4
11784,4109301,MARIA DE JESUS LIMA DA SILVA,MARIA JURACI VIEIRA DE SOUZA,09/04/1983,tipo 4
11794,4115698,MARIA DE NAZARE DA SILVA LIMA,MARIA LEIDIMAR SOARES GOMES,13/11/1963,tipo 4
11796,4311210,MARIA DE NAZARE DE SOUZA ARAUJO,MARIA LIBERTIR DOS SANTOS SOUZA,24/07/1962,tipo 4
11797,4309680,MARIA DE NAZARE GOMES DA SILVA,MARIA LIDIA DE OLIVEIRA SILVA,31/12/1949,tipo 4
11804,4311838,MARIA DEJEANE MELO DA SILVA,MARIA LUCIA NERY,28/02/1979,tipo 4
11807,4311059,MARIA DJANIRA DO NASCIMENTO,MARIA LUCIA SILVA DOS SANTOS,05/09/2008,tipo 4
11811,4312366,MARIA DO SOCORRO NUNES DE BRITO,MARIA LUCIANA SOUZA DA SILVA,12/01/2001,tipo 4
11822,4306764,MARIA ELANIA DA SILVA FREITAS,MARIA LUCIMAR RODRIGUES DA SILVA,18/06/1974,tipo 4
11836,4115194,MARIA ELIETE DE SOUZA SILVA,MARIA MARGARENE NASCIMENTO DA SILVA,30/10/2009,tipo 4
11855,4114200,MARIA EUDA DA SILVA RAMALHO,MARIA MILLE QUEIROZ DA SILVA,26/09/1962,tipo 4
11873,1205583,MARIA FRANCISCA DA SILVA SOUZA,MARIA ODALICE ALENCAR DA SILVA,06/09/1930,tipo 4
11874,4306890,MARIA FRANCISCA DE LIMA ARAUJO,MARIA OFELIA DE MELO DIAS,09/05/1981,tipo 4
11884,4308314,MARIA FRANCISCA LIMA DE ALMEIDA,MARIA PERPETUA SILVA SOUZA,06/08/1941,tipo 4
11888,4313054,MARIA FRANCISCA NASCIMENTO DA SILVA,MARIA RAILDES BARBOSA MESQUITA,13/07/1927,tipo 4
11932,1202745,MARIA IZETE CONCEICAO DE NASCIMENTO,MARIA SILVENI PEIXOTO DA SILVA,23/04/1970,tipo 4
11933,4311075,MARIA JANAIRA SILVA DA CONCEICAO,MARIA SIMONE DANTAS DA SILVA,02/03/1972,tipo 4
11944,4114782,MARIA JOCILENE OLIVEIRA DA SILVA,MARIA SOLANGE SILVA DO NASCIMENTO,06/12/1990,tipo 4
11974,4307014,MARIA JOSE FERREIRA DA SILVA,MARIA VANGELA MARQUES DE MENEZ,30/04/1970,tipo 4
12006,4109773,MARIA KARINA SANTOS DA COSTA,MARINALVA BARROS DA CONCEICAO,27/10/2022,tipo 4
12011,1206088,MARIA LEIDIANA AMORIM DOS SANTOS,MARINEIS DA COSTA,15/12/2008,tipo 4
12012,4312734,MARIA LEIDIANE SANTOS DA SILVA,MARINELDA MIRANDA DE CARVALHO,20/03/1933,tipo 4
12013,4312227,MARIA LEIDIANIA AMARAL DE LIMA,MARINES FERREIRA DOS SANTOS,01/12/1946,tipo 4
12017,4307493,MARIA LICE NASCIMENTO COSTA,MARINETE SERENO CERQUEIRA KAXINAWA,04/12/1942,tipo 4
12022,4112832,MARIA LIMA DA SILVA,MARIO ROSELITO DA SILVA ARAUJO,22/07/1991,tipo 4
12023,4113999,MARIA LINDALVA BEZERRA DA SILVA,MARIO ROSELITO DA SILVA ARAUJO,26/03/1968,tipo 4
12057,1206741,MARIA LUZILENE LIMA FIGUEIREDO,MIRIAN DO VALE SILVA,07/03/1974,tipo 4
12066,4308015,MARIA MARCLEIDE GOMES DOS SANTOS,MOISES DE SOUZA OLIVEIRA,03/09/2003,tipo 4
12069,1207209,MARIA MARGARIDA CARLOS BATISTA,MONICA DE MATOS FERREIRA,03/03/2016,tipo 4
12072,1203185,MARIA MARILEIDE ALVES DE SOUZA,NAGILA CORDEIRO DE OLIVEIRA,11/09/2008,tipo 4
12082,4107942,MARIA MARTA BAZILIO DE LIMA,NATACHA DE OLIVEIRA BATISTA,07/01/1963,tipo 4
12095,4312156,MARIA NAYELE SILVEIRA DE SOUZA,NELCILENE MARQUES VIEIRA,10/10/1940,tipo 4
12098,4308840,MARIA NILDA DE SOUZA CAUASSA,NIGILIANE DA COSTA OLIVEIRA,04/01/1973,tipo 4
12162,1204025,MARIA SOCORRO LIMA DA COSTA,RAIMUNDA ALVES DE SOUZA,27/04/1925,tipo 4
12169,1200696,MARIA SUELMA OLIVEIRA TORRES,RAIMUNDA MARQUES DA SILVA,28/07/1982,tipo 4
12179,4115794,MARIA TAMIRES LIMA SILVA,RAIMUNDO MANOEL DE OLIVEIRA,05/02/1955,tipo 4
12188,4308202,MARIA VALDELIZ BENEDITO DA SILVA,RANIELE CANDIDO DOS SANTOS,08/04/1936,tipo 4
12191,4111576,MARIA VALDERLIZ BRAZ DO NASCIMENTO,RAQUEL DA SILVA NEVES,04/03/2022,tipo 4
12202,4308472,MARIA ZULENI DO VALE CRUZ,REGIANE LIMA DE SOUZA,18/04/1928,tipo 4
12204,1202991,MARIANE PINHEIRO DE LIMA MARTINS,REGIANE MELO TOME,12/05/1930,tipo 4
12205,4310135,MARICELIA MELO DE BRITO,REGIMAR FERREIRA,11/08/1977,tipo 4
12206,4311005,MARIETA INES DA SILVA SIMIAO,RENAN SILVA DOS SANTOS,07/07/1932,tipo 4
12215,1206220,MARILENE PINHEIRO DE QUEIROZ,RICHARIA SILVA DE ALENCAR,16/09/2011,tipo 4
12227,1207604,MARINES SOUZA DA COSTA,RONI CHARLES BORGES DA SILVA,28/01/1928,tipo 4
12232,4315315,MARINICE GAMA DA SILVA,ROSA MACEDO DOS REIS,08/05/1955,tipo 4
12252,4313898,MARLUCIA DA SILVA MENDES,ROSIANA DE SOUZA PINTO,20/03/1959,tipo 4
12275,1202738,MICHELE OLIVEIRA LIMA,RUTILENE MACEDO DOS REIS,26/01/2014,tipo 4
12277,1202848,MICHELI DE ARAUJO BANDEIRA,SABRINA MACHADO DOS SANTOS,09/04/1970,tipo 4
12293,4306388,MONICA RUANA MARTINS DA SILVA,SANDRA SILVA DA CONCEICAO,02/01/1995,tipo 4
12335,4313180,OSELIA LIMA DE ALENCAR,SUELANDIA BARBOSA PAULA,08/06/1976,tipo 4
12342,4116519,PAMELA BEZERRA PEREIRA,SUIANE DE ALMEIDA LIMA,11/01/1956,tipo 4
12344,4310634,PATRICIA BRITO DIAS,SUIANE DE SOUZA MOTA,08/07/2022,tipo 4
12351,4112829,PAULA NAIARA MESSIAS DE ALENCAR,TACIONE GOMES,03/11/1950,tipo 4
12376,4107600,RAFAELA MATOS DA SILVA,TAMIRES ALVES,23/05/2000,tipo 4
12381,4108215,RAILA OLIVEIRA DA SILVA,TANIA MEDEIROS BANDEIRA MONTEIRO,22/01/2013,tipo 4
12389,1201878,RAIMUNDA ELIENE SANTOS SILVA,TERESA FEITOSA DE MELO,16/05/1965,tipo 4
12400,4108319,RAIMUNDA NONATA RODRIGUES DA SILVA,THIAGO BRAGA DE SOUZA,12/04/1972,tipo 4
12426,4307673,REJANE MARIA FRANCA DE SOUZA,VANESSA SILVA DO NASCIMENTO,16/04/1974,tipo 4
12434,1207005,RITA DA CONCEICAO MOTA,VERA LUCIA DO VALE PAPOULA,27/06/1935,tipo 4
12486,4313917,ROSINETE CERQUEIRA DA ROCHA,GILCILENE XAVIER,15/11/2009,tipo 4
12499,4313808,SAMARA COUTO CAMPOS,JENEIAS DOS SANTOS DA COSTA,07/03/1984,tipo 4
12506,4309085,SAMIA MARIA LIMA BEZERRA,JULIANA LIMA DOS SANTOS,27/05/1947,tipo 4
12511,1206931,SAMILI DE PAIVA COUTINHO,LEINE DE SOUZA BRITO,19/12/2010,tipo 4
12524,1205100,SARA SOUSA DO NASCIMENTO,MARIA DO CARMO DA SILVA PAIXAO,21/09/1949,tipo 4
12526,4116406,SEBASTIANA MARIA ROCHA MOREIRA,MARIA FRANCINEIDE DOS SANTOS OLIVEIRA,21/11/2016,tipo 4
12529,1206205,SEBASTIANA TABOSA GOMES,MARIA GEISIMAR QUEIROZ DO NASCIMENTO,18/06/1996,tipo 4
12533,4115463,SHEILA ALVES DE ALMEIDA,MARIA LUCIANA DE SOUZA,11/06/2012,tipo 4
12546,4110576,SONIA ANDRE DA COSTA,RAIMUNDA LEAL DA COSTA,24/12/1980,tipo 4
12554,4107534,SUIANES LIMA DA SILVA,SELENA SILVA DO NASCIMENTO,12/02/1985,tipo 4
12563,1205902,TAIANE DE CARVALHO MOTA,WALERIA HUCHOA GONCALVES,27/09/2008,tipo 4
12569,4109262,TAIRES LIMA DO NASCIMENTO,ADRIANA MINIA KULINA,18/08/1977,tipo 4
12570,4107217,TAIRES SANTOS BARBOSA,ALCIONE ROCHA DE OLIVEIRA,30/10/1998,tipo 4
12573,4116371,TAIS RAMOS DA SILVA,AMEIRES VIANA ARAUJO,28/02/2019,tipo 4
12579,4314783,TALITA BARBOSA DE EVANGELISTA,ANDRESSA CASTRO DA SILVA,05/10/2000,tipo 4
12590,4310574,TARITA ESTEFANI FRANCA BEZERRA,ANTONIA KELLE RIBEIRO DOS SANTOS,28/02/1996,tipo 4
12594,1209678,TATIANE ROGERIO DE SOUZA,ANTONIO ARAUJO DA SILVA,18/04/1953,tipo 4
12628,4314516,VANESSA CONCEICAO FERREIRA,EDUARDA NASCIMENTO DE SOUSA,24/09/1993,tipo 4
12649,1210177,ZILENE MACIEL BEZERRA,FRANCISCA ROSENI DE SOUSA SILVA,09/02/2020,tipo 4
12682,1207372,ERIANE CRISTINI DE OLIVEIRA GOMES,JOSE DAVI OLIVEIRA SOUSA,08/02/1990,tipo 4
12694,1202964,GISLENE GOMES ROCHA,KEDILA CARVALHO DA SILVA SHANENAWA,20/11/1980,tipo 4
12697,1200726,IRANILDA SARAIVA LOPES,LENILDA FERNANDES GURGEL,19/08/1972,tipo 4
12705,1204666,JOANA DA SILVA,LUCILENE DE OLIVEIRA BASTOS,24/04/2001,tipo 4
12713,1202418,JULIA FERREIRA DA SILVA,MARENILDA CRUZ DE FREITAS,28/07/1947,tipo 4
12716,1208727,KARIS GOMES DE OLIVEIRA,MARIA ALCILENE PEREIRA DE ARAUJO,07/10/1930,tipo 4
12722,1206903,LUCIANA RIOS DE AZEVEDO,MARIA ANTONIA VIEIRA GOMES DAS CHAGAS,11/07/1941,tipo 4
12727,1209281,MARIA ANTONIA DOMINGOS DAS NEVES,MARIA CLARICE MELO DO NASCIMENTO,26/02/1975,tipo 4
12737,1201133,MARIA DO SOCORRO NUNES MOREIRA BARBOSA,MARIA DA LIBERDADE FERREIRA DANIEL,12/02/1994,tipo 4
12748,1201991,MILTON DA SILVA AMORIM,MARIA DOMINGOS FONTES,23/06/1993,tipo 4
12752,1202501,POLIANA MOREIRA DE MORAES,MARIA ELIZABETE ARAUJO SANTOS,22/01/2006,tipo 4
12768,1201531,SANDRA MARQUES FERREIRA,MARIA IVANILDES PONTES DE SOUSA,01/07/1989,tipo 4
12791,1203873,ANTONIA ALVES DE OLIVEIRA,MARIA LUZENILDA LIMA DO NASCIMENTO,05/07/2021,tipo 4
12801,1200427,ANTONIA REGINE ROCHA PINTO,MARIA NEURIVANIA OLIVEIRA DA SILVA,27/01/1945,tipo 4
12820,1204273,DUCILENE BRAZ DA SILVA,MARIA SIONEIDE DE LIMA NASCIMENTO,25/05/1986,tipo 4
12821,1203684,EDIMILSON HUKUMA KULINA,MARIA SUELY SANTOS FEITOSA,12/11/1954,tipo 4
12822,1207460,EDINELIA DA SILVA CRUZ,MARIA TEREZA CANDIDO DA SILVA,18/05/1929,tipo 4
12833,1204079,ERLENE DA SILVA SOARES,MARINES AGUIAR DE SOUSA,11/02/2000,tipo 4
12839,1208896,FLERDEANIA DE LIMA SILVA,NAGELA DE LIMA MOISES KAXINAWA,19/03/2002,tipo 4
12841,1209358,FRANCIANE GOMES FEITOSA,NAYARA CARVALHO RODRIGUES KAXINAWA,29/11/1977,tipo 4
12863,1210079,GRACINEUDO RABELO DE ALMEIDA,SAMILLY DA SILVA PORTELA,07/07/1948,tipo 4
12868,1209537,ISMAEL NASCIMENTO DA SILVA,SEBASTIANA CUSTODIO BEZERRA,10/05/1993,tipo 4
12896,1203096,JUNIOR SILVA DA COSTA,ANTONIA MARCENIRA NASCIMENTO DE HOLLANDA,23/02/1939,tipo 4
12909,1209356,LUZIEDE DA SILVA PINTO,FRANCISCO DOMINGO SALES KAXINAWA,07/06/1976,tipo 4
12912,1201548,MANOEL DE JESUS MARANGUAPE DE ARAUJO,GILVAN CARVALHO DA SILVA,16/07/1988,tipo 4
12926,1201098,MARIA APARECIDA VIANA CORREIA DOS SANTOS,MARIA ADELINA MOISES MARTINS KAXINAWA,15/05/2005,tipo 4
12936,1204819,MARIA DA LIBERDADE CAVALCANTE NASCIMENTO,MARIA JOSE CALIXTO KAXINAWA,30/10/1991,tipo 4
12982,1205984,MARIA OLIMPIA DA SILVA E SILVA,ANTONIA AGNES DA SILVA MACIEL,09/04/1968,tipo 4
12995,1208799,MARIA ROSINEIDE SOARES DE OLIVEIRA,CLICIANE DE ALMEIDA BENEVIDES,11/07/1945,tipo 4
12997,1210167,MARIA SEBASTIANA CASTRO DE SOUSA,DANIEL MAMPA DA SILVA,11/06/2016,tipo 4
13060,1204569,TAIS DA SILVA LIMA,JOSE ADELMO DE MELO,15/09/1969,tipo 4
13069,1209201,THAIS NONATA NERES,JULIA SOUZA DA SILVA,20/01/1949,tipo 4
13070,1205415,THAMALA JESSICA DO NASCIMENTO GOMES,JULIANA DE OLIVEIRA SILVA,14/12/1980,tipo 4
13071,1204367,TIMAR SILVA E SILVA KAXINAWA,LEANDRO ALMEIDA DA SILVA,18/07/1995,tipo 4
13073,1207356,VALCIMAR NOVALGEM DIAS,LUCIANO AMARAL DA SILVA,17/11/2007,tipo 4
13078,1203520,VANDRESSA FROTA DELFINO,MAIARA BEZERRA MOREIRA,16/05/1924,tipo 4
13092,1203653,CLARICE DE AQUINO DO NASCIMENTO,MARIA DARLENE FERREIRA DA SILVA,12/06/1943,tipo 4
13095,1204156,DAMIAO LIMA DE ARAUJO,MARIA DE FATIMA ARAUJO DA CONCEICAO,30/12/2021,tipo 4
13098,1200525,DEBORA AMIN DOS SANTOS,MARIA DEANI LIMA DE OLIVEIRA,16/03/1929,tipo 4
13102,1207889,FRANCILINA FIRMINO MOREIRA,MARIA DUCILENE DA SILVA MESQUITA RODRIGU,20/08/1948,tipo 4
13128,1208310,MANOEL SILVA CASTRO,MARILANDE OLIVEIRA DE SOUZA,29/01/1951,tipo 4
13130,1205278,MARIA ANTONIA MARTINS DE SOUZA KAXINAWA,MARINES DA SILVA SOMBRA,20/06/1949,tipo 4
13132,1206428,MARIA CLEIDILENE DO ESPIRITO SANTO,MARNIZIA DA SILVA OLIVEIRA,23/12/2016,tipo 4
13139,1202414,MARIA GENILDA SALES KAXINAWA,NERICILDA LEITE DE SOUZA,21/08/1938,tipo 4
13144,1205962,MARIA MENEZES PASSOS PAIVA,QUECIA FERNANDES DA COSTA,02/05/2003,tipo 4
13152,1209382,MARIA ZELI SERENO PAULINO KAXINAWA,ROBERTA MARIA MIRANDA DOS SANTOS,07/12/2007,tipo 4
13157,1206899,MOACIR MACARIO NAPOLEAO KAXINAWA,ROSILENE DIAS LIMA,12/08/1982,tipo 4
13158,1206927,NATHACHE DA SILVA PAIVA,ROSIMEIRE FERNANDES DE SOUZA,18/11/1956,tipo 4
13171,1209842,VALDECIR MARTINS DE SOUZA,VANDERLEIA MENDONCA DE ALMEIDA,14/05/2012,tipo 4
13172,1208761,VANDERLEI DE SOUSA LEAO,WENDIA NERI DA SILVA,12/08/1951,tipo 4
13174,1206978,AGILA MARIA MENDOCA DA SILVA,ZILA BENTO DE CARVALHO,01/06/2002,tipo 4
13181,1207439,ALINY COSTA REBOUCAS,ANA PAULA FERREIRA DE MORAIS,20/06/1969,tipo 4
13184,1202844,ANDREIA MATOS DO NASCIMENTO,ANTONIA GEISIANE PASSOS DA SILVA,06/03/2016,tipo 4
13209,1201061,EDIMARA DA SILVA NASCIMENTO,ELITON FERREIRA RODRIGUES,21/03/1985,tipo 4
13219,1201097,ELIETE MATOS DO NASCIMENTO,FRANCISCO DAS CHAGAS ARAUJO GOMES,06/01/1966,tipo 4
13228,1206380,ERLANIA PINHEIRO MUNIZ,JOSE MILTON COELHO DA COSTA,14/08/1946,tipo 4
13232,1204451,EUSEBIO COSTA ALENCAR,KEZIA FERNANDES DE CASTRO,21/02/1933,tipo 4
13239,1210091,FRANCISCA ALENCAR DA SILVA,LUZIA DE MENEZES LEITE,20/12/1966,tipo 4
13240,1200561,FRANCISCA DE LIMA RUFINO,MACIA LIMA DIAS,17/12/1969,tipo 4
13242,1203997,FRANCISCA FERREIRA MOTA,MALDENE PEREIRA DA SILVA,07/07/1998,tipo 4
13250,1202925,GEILSON MOREIRA SILVA,MARIA CLEUCIDE DA SILVA LOPES,02/05/1936,tipo 4
13264,1202612,IVANETE LOPES DOS SANTOS,MARIA VENINA IUMBATO FERREIRA,20/06/1928,tipo 4
13282,1200833,JOSE RODRIGUES BENEVIDES,RASARIA KULINA,03/08/1963,tipo 4
13297,1208858,KESSIA SOUZA DOS ANJOS,XAYANE DA SILVA RODRIGUES,08/08/2020,tipo 4
13299,1206809,LENITA CONCEICAO DA SILVA,ZENILDA DO NASCIMENTO GOMES,23/10/2019,tipo 4
13304,1203141,LUCIANA DANTAS DA SILVA,ALDENIZIA FREIRE MESQUITA,03/01/1935,tipo 4
13305,1206515,LUCIANA RAMOS DE SOUZA,ALICE BARROSO DA SILVA,05/04/1977,tipo 4
13307,1206562,LUCINEI DA SILVA ROCHA CONCEICAO,ALQUIMAR DA SILVA CORREIA,04/04/1933,tipo 4
13341,1205348,MARIA FRANCISCA SANTOS DA SILVA,DENILTON SANTOS NASCIMENTO,23/12/1994,tipo 4
13342,1208826,MARIA FRANCISCA SATURNINO DA SILVA,DENIZE DE OLIVEIRA FURTADO,07/06/1973,tipo 4
13373,1208199,MARLENE NEO PEREIRA,JOAO VITOR PEQUENO LIMA,30/10/1961,tipo 4
13393,1209474,RAIMUNDA ELIANA SANTOS SILVA,MARCELO BORGES ALMEIDA,07/06/1948,tipo 4
13396,1202957,RENILDES SOUZA PEREIRA,MARIA ALZENIR GOMES,13/03/1973,tipo 4
13398,1205405,ROMERITO DE OLIVEIRA RODRIGUES,MARIA APARECIDA ESTEVAO DO NASCIMENTO,22/04/1998,tipo 4
13408,1204197,SEBASTIAO MONTEIRO DE LIMA,MARIA DE FATIMA FERREIRA LIMA,18/01/2001,tipo 4
13415,1209254,VALDERLENE GOMES NASCIMENTO,MARIA ELENISIA BEZERRA MORREIRA,19/04/1939,tipo 4
13439,1200792,DENISE MONTEIRO DO NASCIMENTO,MARIA MARCILENE GOMES DE AZEVEDO,19/04/1975,tipo 4
13441,1200453,DHUSA LISBETE PEREZ KAXINAWA,MARIA NELSA OLIVEIRA AZEVEDO,01/04/2002,tipo 4
13459,1203491,FERNANDA FERREIRA DO NASCIMENTO,PEKIRI ASHENINKA,11/01/1955,tipo 4
13460,1208919,FERNANDO COSTA DE SOUZA,QUESIA OLIVEIRA DA SILVA,23/01/1979,tipo 4
13471,1201920,IVALENE DE ANDRADE DIAS,SHARIKI ROMAKA ASHENINKA,14/11/1950,tipo 4
13474,1205439,JARDILA FERREIRA DE ALMEIDA,SIMONE COSTA SOUZA,02/05/1991,tipo 4
13485,1201835,LEIDIANE DIAS DA SILVA,ADRIELE BARROS DE OLIVEIRA,02/09/1935,tipo 4
13488,1208734,LUCIANA ALMEIDA DE SOUZA SILVA,ALTEVIR ALVES BARROS,17/09/1950,tipo 4
13496,1203090,MARIA ANTONIA SANTIAGO DOS SANTOS,ANTONIA MOURA FERREIRA MUNIZ,04/10/1984,tipo 4
13498,1204708,MARIA APARECIDA DA SILVA XAVIER,ARIEL RIBEIRO DA SILVA,16/10/1951,tipo 4
13502,1207813,MARIA DE FATIMA ALMEIDA DIAS,BRUNA ROCHA ALENCAR,11/04/1985,tipo 4
13503,1208345,MARIA DE FATIMA COELHO DA COSTA,BRUNA RODRIGUES DE SOUZA,28/12/1955,tipo 4
13507,1203694,MARIA FRANCISCA DE SOUZA,CARINA FREITAS AMORIM,17/08/1977,tipo 4
13514,1202861,MARIA SALDANHA REGIO,EDINEIA SOUZA DA SILVA FREITAS,16/08/2015,tipo 4
13516,1207572,MARILEIDE NASCIMENTO DE ALMEIDA,EMILLE NICOLY SANTOS RODRIGUES,30/11/1931,tipo 4
13528,1200608,RAIMUNDA KULINA,GERLANE SANTOS DA SILVA,02/11/1977,tipo 4
13534,1207554,ROSINEIA SILVA DA COSTA,ISAIAS DA COSTA,07/10/1926,tipo 4
13546,1206273,VANDERLEIA BUTZKE,KEETLEN LOWENY DE MOURA DA SILVA,28/09/1950,tipo 4
13579,1209263,CIRLANDIA DA SILVA CONCEICAO,ROSA MARIA DA CONCEICAO SOARES,02/11/1988,tipo 4
13587,1209757,DARLEIDE SOUZA OLIVEIRA,SERAFIM CICERO DOS SANTOS,26/06/1936,tipo 4
13588,1201896,DARLENE MONTEIRO ALEMAO,SHARLES SANTANA DA SILVA,24/08/1951,tipo 4
13626,1205952,JAQUELINE SILVA DA CUNHA,ANTONIETA FELIX BARAO,06/06/1971,tipo 4
13629,1201133,JOAO RODRIGUES,ATEMILDA DE MOURA FELIX,24/06/1943,tipo 4
13640,1206635,JOSEANA MOREIRA DA CUNHA,COSMA RIBEIRO DE OLIVEIRA,16/01/2014,tipo 4
13641,1203535,JOSIANA SOUZA DE FREITAS,DAIANE OLIVEIRA DA SILVA,25/01/2002,tipo 4
13655,1206421,MARIA ANTONIA FERREIRA DE OLIVEIRA,ELIANA LIMA DE ALMEIDA,02/11/1993,tipo 4
13661,1202423,MARIA CLAUDENICE VIANA GOMES,ENGLES DOS SANTOS SILVA,17/01/1924,tipo 4
13679,1209407,MARIA ENILZA RODRIGUES DA SILVA,FRANCISCA LOPES DA CRUZ,21/09/1959,tipo 4
13687,1200468,MARIA IVANETE DE OLIVEIRA SANTOS,GEREMIAS PEREIRA CHAGAS,02/03/1935,tipo 4
13695,1200436,MARIA LINDAURA GOMES DA SILVA,IRISMAR CAVALCANTE DA CONCEICAO,13/04/2012,tipo 4
13703,1205024,MARIA NIZIA CORREIA DA SILVA,JAQUELINE RICARDO LOPES,08/07/2008,tipo 4
13736,1209869,SAMARA NOGUEIRA MAIA,LUDMILLE CORONEL DOS SANTOS,24/06/1992,tipo 4
13747,1200995,TXEWIKO ASHENINKA,MARIA DA CONCEICAO CARDOSO DE SOUZA,20/01/1978,tipo 4
13759,1201350,ANGELA SOUZA DE ARAUJO,MARIA LENILDA DE SOUZA MARTINS,24/02/1984,tipo 4
13771,1204514,CLAUDINEIA ROMI DE LARA,MARIA VILANI DA SILVA E SILVA,04/03/1934,tipo 4
13779,1201292,ELISSANDRA DE SOUZA FERRAZ,MAVIANA DA SILVA DE LIMA,28/07/1949,tipo 4
13781,1208213,FRANCIELE MORAES DA SILVA,MEURY JOANA BARBOSA DA SILVA,25/03/2020,tipo 4
13795,1200867,JHESSICA HILDA VARGAS DE MORAES,REGINEIDE FERNANDES DA SILVA,01/05/2010,tipo 4
13827,1200893,MARIA PERPETUO SOCORRO DE SOUZA PEREIRA,ANDREA DIAS BARBOZA,27/05/1931,tipo 4
13858,1203837,WILLIANE BARROS SILVA,JARLIANE SILVA DOS SANTOS,27/04/1928,tipo 4
13866,1210271,ALESSANDRO MARTINS DE SOUZA,LUDIANE FERNANDES DO NASCIMENTO,10/08/1980,tipo 4
13869,1201364,AMARILDO LUNIERE LOPES,MARCIANA DA SILVA DINIZ,07/04/2020,tipo 4
13871,1201172,ANA CLAUDIA ARAUJO RODRIGUES,MARIA ALCINETE SILVA ARAUJO,22/07/1977,tipo 4
13873,1210159,ANA CLAUDIA SILVA DE OLIVEIRA,MARIA CIRLETE GOMES SOUZA,03/04/1959,tipo 4
13885,1202260,ANTONIA RAIMUNDA DOS ANJOS CHAVES,MARIA LUCIA SILVA DA COSTA,21/11/1989,tipo 4
13887,1203852,ARIANA DE SOUZA COELHO NASCIMENTO,MARIA LUCIETE COSTA DE MATOS,05/09/1936,tipo 4
13918,1201575,FRANCILETE FERREIRA DA SILVA,ABELINO FERREIRA DE SOUSA,18/09/1970,tipo 4
13919,1206507,FRANCISCA DAS CHAGAS GOMES DA SILVA,ABILA FERREIRA DE ARAUJO,06/06/1941,tipo 4
13921,1205068,FRANCISCA PROBEM FERNANDES,ACACIA DIAS DA SILVA,22/12/1939,tipo 4
13936,1206054,GRACIELE SANTOS DA SILVA,ADILA VARGAS SILVA,22/05/1977,tipo 4
13939,1202722,JAIR RIBEIRO,ADRIALICE DA SILVA MELO,06/12/1956,tipo 4
13943,1205460,JOAO BESSA DA CONCEICAO,ADRIANA BARROS MAIA,07/07/1986,tipo 4
13945,1205997,JOICE DE SOUZA,ADRIANA CATTER CAVALCANTE LOPES,10/05/1973,tipo 4
13952,1204893,JUSCIELE AGUIAR BEZERRA,ADRIANA DUARTE CAVALCANTE,14/02/2009,tipo 4
13959,1209926,KEILA OLIVEIRA SILVA,ADRIANA NORONHA DE ABREU COSTA,06/01/1928,tipo 4
13969,1209220,LIVIA LEITE DA SILVA,ADRIELLY MOYSES LOPES,04/05/1939,tipo 4
13974,1206642,LUCIMAR DA SILVA SANTOS,AGNES LAUANDA GOMES DE FREITAS,31/08/1951,tipo 4
13975,1204067,LUCINEIDE REIS DE OLIVEIRA,AGOSTINHA DAVILA ROCHA,05/01/1933,tipo 4
13981,1205795,MARIA ALDA DE CASTRO DE LIMA,AIRTON FERREIRA DA SILVA,06/06/1969,tipo 4
13989,1207782,MARIA DE FATIMA DOS SANTOS DA SILVA,ALBERLANJA DE SOUZA MELO,09/06/2017,tipo 4
14005,1203293,MARIA LUCIA VAIZ SANTANA,ALCINEIDE NOGUEIRA DE ASSIS,30/07/2000,tipo 4
14020,1210435,MICHELY MOTA BATISTA DA SILVA,ALDEMIR SILVERIO RODRIGUES DA SILVA,25/04/2005,tipo 4
14027,1206430,NATALINA NASCIMENTO DA SILVA,ALDENORA SOARES DA SILVA,11/06/1936,tipo 4
14047,1201151,SIRLEI SILVA DE SOUZA MOREIRA,ALEXSANDRA CAVALCANTE DE ARAUJO,08/08/1993,tipo 4
14061,1210749,VERA LUCIA JUSTINO DA SILVA,ALINE DE SOUZA DAMASCENA,27/06/1962,tipo 4
14068,1204820,ADERNIZIA RODRIGUES VITOR,ALINE SILVA PEREIRA MENDES,17/11/1977,tipo 4
14083,1200917,ANTONIA ELISSANDRA PEREIRA,ALZENIRIS DOS SANTOS SOUZA DE CASTRO,03/11/1981,tipo 4
14093,1201458,CAMILA FREITAS DE ARAUJO,AMANDA DE SOUSA TAVARES,28/07/1977,tipo 4
14096,1203142,CATIANA COELHO DIAS,AMANDA NOBRE JALUL,10/02/1968,tipo 4
14122,1206926,LUCIENE AZEVEDO DA SILVA,ANA CLARA MORAES GELETT,20/07/1978,tipo 4
14130,1203377,MARIA CARLIANE BARRETO COELHO,ANA CLAUDIA SALES BATISTA,06/11/2005,tipo 4
14131,1201519,MARIA CLAUDIMAR LIMA DA SILVA,ANA CLAUDIA VIEIRA DA SILVA,10/02/1929,tipo 4
14132,1206591,MARIA COSMA PEREIRA LIMA,ANA CLECIA DUARTE DE ANDRADE,18/05/1953,tipo 4
14139,1201335,MARIA DJANIRA BARBOSA RODRIGUES,ANA CRISTINA MOURA DA SILVA,05/02/1986,tipo 4
14149,1209514,MARIA LINDOMAR DA SILVA,ANA KELLY FERNANDES GUEDES,20/06/1975,tipo 4
14161,1206024,MARIA ROSIENE FERREIRA DA SILVA,ANA MARIA DE ARAUJO VIEIRA,24/11/1937,tipo 4
14164,1200616,MARIA SILVANA DOMINGOS DA SILVA,ANA MARIA MAGALHAES DA CRUZ,21/11/2004,tipo 4
14166,1210375,MARIA SOCORRO PEREIRA DA SILVA,ANA MARIA SAMPAIO DA SILVA,09/02/1925,tipo 4
14172,1204233,MARINILZA NOGUEIRA DA SILVA ARARA,ANA PAULA CABECO DOS SANTOS,20/01/1971,tipo 4
14173,1204194,MARIO COSTA DOS SANTOS,ANA PAULA CARVALHO WILAMOWSKI,28/04/1982,tipo 4
14190,1200461,SEBASTIAO PEREIRA DA SILVA,ANA PAULA SOUZA E SILVA,21/01/1934,tipo 4
14191,1205970,SUZETE NOGUEIRA DA SILVA,ANA PAULA SOUZA E SILVA,06/01/1932,tipo 4
14199,1201494,ABDIAS FERNANDES DOS SANTOS,ANADRIA FONSECA DA SILVA,11/04/1966,tipo 4
14206,5117048,ADALCILEIDE OLIVEIRA COSTA,ANDRE LUIZ DO NASCIMENTO CAETANO,18/09/2020,tipo 4
14207,1207873,ADALCILEIDE OLIVEIRA COSTA,ANDRE NASCIMENTO CARNEIRO,27/01/2018,tipo 4
14242,5109959,ADRIANA NASCIMENTO SIQUEIRA,ANDREZA CONCEICAO DA SILVA,17/07/2009,tipo 4
